Robert,,Short,Chief Technology Officer,VirnetX Announces New Chief Technical Officer,VirnetX,www.VirnetX.com,Computers & Electronics : Computers & Electronics Other,5615 Scotts Valley Dr Ste 110,Scotts Valley,CA,95066,USA,831.438.8200,robert_short@virnetx.com,7/9/2010,7/9/2010,Promotion,"VirnetX Announces New Chief Technical Officer                                                                                                                                                                                                                                                                                                                                                                                           Original Patent Inventor and Chief Scientist Elevated To New Post                                                                                                                                                                                             SCOTTS VALLEY; Calif.; June 30 /PRNewswire-FirstCall/ -- VirnetX Holding Corporation (NYSE Amex: VHC); an Internet security software and technology company; announced today that on July 9; 2010; Dr. Robert Short III will take over duties as VirnetX Chief Technical Officer. Dr. Short replaces Edmund ""Gif"" Munger who has formally retired from active service with the Company in order to pursue other interests and spend time with his family.                                                                                                                                                                                             Dr. Short is named as a co-inventor on substantially all of the patents of the Company's rich patent portfolio. He has been the Chief Scientist for the Company since May 2006. From February 2000 to April 2007; Dr. Short was Assistant Vice President and Division Manager at Science Applications International Corporation (""SAIC""). From 1994 to February 2000; he also held various other positions at SAIC. Prior to SAIC; he worked at ARCO Power Technologies; Inc. (Atlantic Richfield Petroleum); Sperry Corporate Technology Center and Sperry Research Center. Dr. Short has worked on numerous U.S. national security technology programs. He has a Ph.D. in Electrical Engineering from Purdue University along with a M.S. in Mathematics and a B.S. in Electrical Engineering from Virginia Tech.                                                                                                                                                                                             ""Bob Short is the perfect choice for CTO of VirnetX;"" said Kendall Larsen; VirnetX President and CEO. ""As co-inventor of our patents and VirnetX Chief Scientist he understands our vision and is uniquely qualified to lead VirnetX as we develop our licensing program and prepare to launch our Secure Domain Name Initiative which we believe will be the de facto platform for securing 4G.""                                                                                                                                                                                             Mr. Munger has been VirnetX's Chief Technical Officer for the last four years and worked with Dr. Short in the development of VirnetX's patent portfolio. ""Gif has been instrumental to our many achievements;"" said Kendall Larsen. ""He will always be a part of the VirnetX family and we wish him well in his retirement.""                                                                                                                                                                                             About VirnetX                                                                                                                                                                                             VirnetX Holding Corporation; an Internet security software and technology company; is engaged in commercializing its patent portfolio by developing a licensing program as well as developing software products designed to create a secure environment for real-time communication applications such as instant messaging; VoIP; smart phones; eReaders and video conferencing. The Company's patent portfolio includes over 48 U.S. and international patents and pending applications that were recently declared as essential for 4G security specifications and provide the foundation for the Company's unique GABRIEL Connection Technology. For more information; please visit www.virnetx.com.                                                                                                                                                                                             Contact:                                                                                                                                                                                             Greg Wood                                                                                                                                                                                             VirnetX Holding Corporation                                                                                                                                                                                             831.438.8200                                                                                                                                                                                             greg_wood@virnetx.com",25 - 100,$1 - 10M,LinkedIn Update,,VirnetX  promoted Robert Short to Chief Technology Officer,Robert Short has been previously Chief Scientist for VirnetX since May 2006.,VirnetX Holding Corporation; an Internet security software and technology company; is engaged in commercializing its patent portfolio by developing a licensing program as well as developing software products designed to create a secure environment for real-time communication applications such as instant messaging;  VoIP; smart phones; eReaders and video conferencing. The Company's patent portfolio includes over 48 U.S. and international patents and pending applications that were recently declared as essential for 4G security specifications and provide the foundation for the Company's unique GABRIEL Connection Technology. For more information; please visit www.virnetx.com.,http://www.prnewswire.com/news-releases/virnetx-announces-new-chief-technical-officer-97484479.html
Rusty,,Andrews,Chief Information Officer,Wastequip Names New CFO; CIO and HR VP,Wastequip,www.wastequip.com,Manufacturing : Heavy Machinery,25800 Science Park Drive; Suite 140,Cleveland,OH,44122,USA,877.468.9278,randrews@wastequip.com,7/28/2010,7/28/2010,Appointment,Wastequip Names New CFO; CIO and HR VP                                                                                                                                                                                             Jul 28; 2010                                                                                                                                                                                             In conjunction with the move of its corporate headquarters to Charlotte; N.C.; Wastequip has named Steve Svetik chief financial officer; Rusty Andrews chief information officer; and Sheri Satterfield vice president of human resources.                                                                                                                                                                                             Svetik will be responsible for finance and treasury; human resources; information technology and environmental health and safety. His background includes extensive financial leadership with Masterbrand Cabinets; Reliance Electric and KPMG. In his most recent role; Svetik served as chief financial officer at Valley National Gases. He holds a master's in business administration from Cleveland State University and is a certified public accountant.                                                                                                                                                                                             Andrews’ previous experience includes roles as director of information systems/chief information officer at Coca-Cola Bottling Company and most recently; senior vice president of hosting and chief information officer at Titan Technology Partners. Andrews has a bachelor’s degree in business from Appalachian State University.                                                                                                                                                                                             Satterfield held leadership positions in human resources at SunAlliance and Centex Construction. In her most recent position she was director of human resources at Muzak; LLC. Satterfield has a bachelor’s degree in business from Montreat College and is completing her master’s degree in human resources from Clemson University.,1K - 10K,$50 - 100M,Press Release,,Wastequip appointed Rusty Andrews  as Chief Information Officer,Rusty Andrews’ previous experience includes roles as director of information systems/chief information officer at Coca-Cola Bottling Company and most recently; senior vice president of hosting and chief information officer at Titan Technology Partners. Andrews has a bachelor’s degree in business from Appalachian State University.,Wastequip is a world leader in the manufacturing of waste handling equipment. With manufacturing facilities across the United States; as well as facilities in Mexico and Canada; the Company serves all facets of the waste industry as a single source supplier for top performing products. The Company prides itself on a solid reputation for quality products and service. For more information on Wastequip; visit www.wastequip.com.,http://eponline.com/articles/2010/07/28/wastequip-names-new-cfo-cio-and-hr-vp.aspx
John,,O’Donnell,Chief Technology Officer,WRI appoints CTO,Web Reservations International,www.webresint.com,Travel; Recreation & Leisure : Travel Agents and Services,999 Baker Way Ste 290,San Mateo,CA,94404,USA,650.372.1700,John.Odonnell@webresint.com,7/28/2010,7/28/2010,Appointment,WRI appoints CTO                                                                                                                                                                                             28.07.2010                                                                                                                                                                                              Web Reservations International (WRI) has announced the appointment of John O’Donnell as chief technology officer (CTO).                                                                                                                                                                                              In his new position; O’Donnell will be responsible for leading WRI's technology strategy through the company’s next phase of growth. He will report directly to WRI’s CEO Feargal Mooney.                                                                                                                                                                                             O’Donnell joins the company from Paddy Power where he was head of technology from 2000. During this time; he developed the organization’s technology capabilities from a handful of employees to a 100-strong multi-discipline development and support function. This capability underpinned the growth of its e-commerce online business from a fledgling channel in 2000 to a €1bn turnover business delivering more than 70pc of corporate profits in 2009.                                                                                                                                                                                             He also developed and delivered a mission-critical product and pricing global delivery system that was the basis for Paddy Power’s B2B business channel; which enabled its 2010 strategic alliance with the French conglomerate PMU.                                                                                                                                                                                              Prior to joining Paddy Power; O’Donnell worked in New York as technology operations manager for Lehman Brothers and was responsible for the project implementation of a newly developed trading platform (OptiMark) onto the Nasdaq stock exchange in 1999.                                                                                                                                                                                             At WRI; O’Donnell will be responsible for crafting the technology strategy and roadmap for enhancing the company’s overall competitive position. Key to this in 2010 is the relaunch of WRI’s flagship brand Hostelworld.com and associated international sites.                                                                                                                                                                                             O’Donnell starts at a time when WRI is set to increase its workforce by 25pc this year. According to WRI; he will be integral to this growth; with the majority of the jobs within the IT and software development department.                                                                                                                                                                                              “We’re delighted to have John joining the team at WRI;” said Feargal Mooney. “He brings with him a broad level of expertise; which will be paramount in driving our technology strategy over the coming years. His wealth of experience; proven record for success and passion for technology make him the perfect fit for WRI; enabling us to fully realise the opportunities for growth and innovation that lie before us.”,25 - 100,$1 - 10M,News,,Web Reservations International appointed John O’Donnell as Chief Technology Officer,John O’Donnell was head of technology at Paddy Power from 2000. During this time; he developed the organization’s technology capabilities from a handful of employees to a 100-strong multi-discipline development and support function.                                                                                                                                                                                                                         Prior to joining Paddy Power; O’Donnell worked in New York as technology operations manager for Lehman Brothers and was responsible for the project implementation of a newly developed trading platform (OptiMark) onto the Nasdaq stock exchange in 1999.,Web Reservations International delivers online reservations to over 50;000 properties in 165 countries through a network of owned sites and affiliate partners. Customers can choose from 5 star hotels to hostels around the world through major online brands including hostelworld.com; hostels.com; trav.com and the newly launched boo.com. ,http://www.siliconrepublic.com/careers-centre/item/17158-wri-appoints-cto/
Jeff,,Segal,Chief Technology Officer,The Herd: New hires and promotions for 7.14.10,WellAWARE Systems,www.wellawaresystems.com,Healthcare; Pharmaceuticals; & Biotech : Healthcare; Pharmaceuticals; & Biotech Other,5500 Cox Road; Suite K,Glen Allen,VA,23059,USA,804.249.2149,jsegal@wellawaresystems.com,7/14/2010,7/14/2010,Appointment,The Herd: New hires and promotions for 7.14.10                                                                                                                                                                                             July 14; 2010                                                                                                                                                                                              Finance/investing                                                                                                                                                                                             Kevin Nicholson joined RiverFront Investment Group as a senior fixed income portfolio manager. Nicholson had a previous position with Wells Fargo Advisors and its predecessor firms; where he managed both taxable and tax-exempt fixed income portfolios. He attended Randolph-Macon College and has an MBA from VCU.                                                                                                                                                                                             Education                                                                                                                                                                                             Erin Lowery joined the University of Richmond as an assistant director in the Career Development Center. Lowery will provide career counseling and programming to undergraduates; graduate students and alumni. She also will serve as a liaison to the accounting; economics; international business and management departments and develop career opportunities with accounting and consulting firms. Lowery went to William and Mary and to graduate school at the University of Texas at Austin.                                                                                                                                                                                             Law                                                                                                                                                                                             Whitney R. Travis has joined the law firm of Christian & Barton as an associate. She will focus her practice on bankruptcy and creditors’ rights. Travis most recently served as a law clerk for Stephen C. St. John and Frank J. Santoro; judges of the United States Bankruptcy Court for the Eastern District of Virginia. She received her law degree from Washington and Lee School of Law and her undergraduate degree from Florida State.                                                                                                                                                                                             Brian L. Buniva joined the law firm Eckert Seamans Cherin and Mellott in the environmental and litigation practices. Buniva joins the firm from LeClairRyan; where he was a shareholder. Buniva went to the University of Richmond School of Law and attended American University for graduate school. He studied at Georgetown; too.                                                                                                                                                                                                                                                                                                                                                                                          Nonprofits                                                                                                                                                                                             Charles Edward “Eddie” Williams has been promoted to director of communications and operations for theVirginia Early Childhood Foundation. Williams had joined the VECF in 2009 as a marketing manager. Prior to joining the VECF; Williams was a multimedia communications producer for Genworth Financial.                                                                                                                                                                                                                                                                                                                                                                                          Healthcare:                                                                                                                                                                                             Jeff Segal has joined WellAWARE Systems as chief technology officer. Segal was previously at intoPIX of America; where he was CEO and established the U.S. market for the Belgium-based company. He was also co-founder and CTO of CINEA; a Dolby Laboratories Company; where he defined the technology and product strategy for the company. Segal has a bachelor’s in mathematics/computer science from VCU and a master’s in engineering management from George Washington University.                                                                                                                                                                                             WellAWARE Systems also hired Lori Sulak as Director of Sales. She will be based in Texas. She brings more than 20 years’ experience of working in the senior living industry.                                                                                                                                                                                                                                                                                                                                                                                          Information technology                                                                                                                                                                                             Clifton Guthrie has recently joined Networking Technologies and Support; Inc.; as a Desktop Support Specialist.                                                                                                                                                                                             Amanda Mikrut has recently joined Networking Technologies and Support; Inc.; as a Desktop Support Specialist.                                                                                                                                                                                             Marketing                                                                                                                                                                                             MaryJo M. Steinmetz joined MetLife Mid-Atlantic Financial Group (formerly Richmond Financial Group) as the marketing director. She was formerly the advertising manager at S&K Menswear. Steinmetz is a graduate Edinboro University of Pennsylvania.,250 - 1000,$10 - 50M,News,,WellAWARE Systems appointed Jeff Segal as Chief Technology Officer,Jeff Segal was previously at intoPIX of America; where he was CEO and established the U.S. market for the Belgium-based company. He was also co-founder and CTO of CINEA; a Dolby Laboratories Company; where he defined the technology and product strategy for the company. Segal has a bachelor’s in mathematics/computer science from VCU and a master’s in engineering management from George Washington University.,WellAWARE™ Systems; in partnership with Volunteers of America (VOA) and The Evangelical Lutheran Good Samaritan Society (GSS); offers the opportunity for enhanced quality of life for our aging population through an innovative approach to wellness and safety for senior living. ,http://www.richmondbizsense.com/2010/07/14/the-herd-new-hires-and-promotions-for-7-14-10/
