First Name,Middle Initial,Last Name,Title,Headline,Company Name,Company Website,Industry,Address,City,State,Zip code,Country,Phone,Email,Date of announcement,Effective date,Type,The full text of the press release,Link,Company Size Employees,Company Size Revenue,Source,Short Url,What Happened,About Person,About Company,More Link
Chris,,Roberts,Assistant Vice President of Information Technology,SunLink Health Systems Appoints Byron D. Finn; President of SunLink ScriptsRx; LLC and Promotes Chris Roberts to Assistant Vice President of Information Technology,SunLink Health Systems; Inc.,www.sunlinkhealth.com,Healthcare; Pharmaceuticals; & Biotech : Healthcare; Pharmaceuticals; & Biotech Other,900 Circle 75 Pkwy SE Ste 1120,Atlanta,GA,30339,USA,770.933.7000,chris.roberts@sunlinkhealth.com,10/5/2010,10/5/2010,Promotion,SunLink Health Systems Appoints Byron D. Finn; President of SunLink ScriptsRx; LLC and Promotes Chris Roberts to Assistant Vice President of Information Technology<br><br>SunLink Health Systems; Inc. today announced that Byron D. Finn has been named President of SunLink ScriptsRx; LLC; the company's specialty pharmacy business. Mr. Finn was most recently President of Byron D. Finn; CPA; PC; which provided accounting; financial consulting and litigation support services to its clients; including numerous healthcare clients. His experience also includes various positions with The Coca-Cola Company; where he served in a number of financial-related positions and in connection with special projects; and he was previously employed by Ernest & Young. Mr. Finn is a licensed CPA; and received his BA in Business Administration and Masters in Accountancy degrees from the University of Georgia. <br>Chris Roberts; who has held the position of Director of Hospital Information Technology and Financial Operations for SunLink Health Systems for the past two years; has been promoted to Assistant Vice President of Information Technology. Mr. Roberts has 15 years experience in finance; accounting and information technology. Prior to joining SunLink; he worked at Healthcare Management Systems in Nashville; TN; where he held several positions including Project Manager; Project Coordinator; Implementation Specialist and Software and Financial Support Analyst. Mr. Roberts received a BS in Finance from the University of Tennessee-Knoxville and an MBA in Accounting/Information Systems from Texas Tech University. <br>About SunLink Health Systems; Inc. <br>SunLink Health Systems; Inc. currently operates seven community hospitals and related nursing home and home care businesses in the Southeast and Midwest; and its specialty pharmacy business; SunLink Scripts Rx; in Louisiana and Georgia. Each SunLink hospital is the only hospital in its community. SunLink's operating strategy is to link patients' needs with dedicated physicians and health professionals to deliver quality; efficient medical care and healthcare products and services in each area it serves,http://www.marketwatch.com/story/sunlink-health-systems-appoints-byron-d-finn-president-of-sunlink-scriptsrx-llc-and-promotes-chris-roberts-to-assistant-vice-president-of-information-technology-2010-10-05?reflink=MW_news_stmp,1K-10K,$100-250 Million,Press Release,,SunLink Health Systems promoted Chris Roberts to Assistant Vice President of Information Technology,Mr. Roberts has 15 years experience in finance; accounting and information technology. Prior to joining SunLink; he worked at Healthcare Management Systems in Nashville; TN; where he held several positions including Project Manager; Project Coordinator; Implementation Specialist and Software and Financial Support Analyst. Mr. Roberts received a BS in Finance from the University of Tennessee-Knoxville and an MBA in Accounting/Information Systems from Texas Tech University.,SunLink Health Systems; Inc. currently operates seven community hospitals and related nursing home and home care businesses in the Southeast and Midwest; and its specialty pharmacy business; SunLink Scripts Rx; in Louisiana and Georgia. Each SunLink hospital is the only hospital in its community. SunLink's operating strategy is to link patients' needs with dedicated physicians and health professionals to deliver quality; efficient medical care and healthcare products and services in each area it serves. For additional information on SunLink Health Systems; Inc.,http://www.marketwatch.com/story/sunlink-health-systems-appoints-byron-d-finn-president-of-sunlink-scriptsrx-llc-and-promotes-chris-roberts-to-assistant-vice-president-of-information-technology-2010-10-05?reflink=MW_news_stmp
Jeff,,Hagins,Chief Technology Officer,ReachLocal Announces New CTO; Head of Global Sales Operations,ReachLocal; Inc.,www.reachlocal.com,Business Services : Advertising; Marketing; & PR,21700 Oxnard St.; Ste. 1600,Woodland Hills,CA,91367,USA,818.274.0260,jhagins@reachlocal.com,9/30/2010,10/1/2010,Promotion,ReachLocal Announces New CTO; Head of Global Sales Operations<br>WOODLAND HILLS; Calif. (September 30; 2010) — ReachLocal; Inc. (NASDAQ:RLOC); a leader in local online marketing solutions for small- and medium-sized businesses (SMBs); announced today it has elevated Jeff Hagins to the position of Chief Technology Officer; while Steven Power; ReachLocal Australia’s Chief Executive Officer; has been promoted to become ReachLocal’s Executive Vice President of Global Sales Operations. These changes will take effect on October 1; 2010.<br>Hagins was ReachLocal’s Vice President of Engineering for Digital Presence and came to ReachLocal through the Company’s February acquisition of SMB:LIVE Corporation; where he was a founder and Chief Technology Officer. Hagins will succeed Robert “Rick” Spitz; who is retiring after a 38-year-career as a technology innovator. Rick will remain with the Company in an advisory capacity to assist with the transition.<br>Prior to joining ReachLocal and the founding of SMB:LIVE; Hagins held CTO roles at Mural Consulting; a Software-as-a-Service (SaaS) advisory firm; Dynix; a library automation software company; Apptix; a hosted messaging and collaboration provider; and TeleComputing; a hosted application management provider. He has also served as the leader of the software QA and test organization at enterprise software firm J.D. Edwards and spent 13 years in various technical; management; and business development positions at Lockheed Martin. He holds a Bachelor of Science in Computer Science from Texas Tech University.<br>“Jeff has both the technical and management expertise to lead our technology effort. He will focus on the continued optimization of our ReachLocal Platform; which manages thousands of simultaneous campaigns; while developing innovative products and services to meet the ever-changing needs of local businesses globally;” said Zorik Gordon; President and CEO of ReachLocal. “As one of ReachLocal’s co-founders; Rick Spitz has been an integral part of our team; and we could not be more grateful for his contributions to our success.”<br>In his new role as head of Global Sales Operations; Steven Power will be primarily responsible for enhancing the company’s global sales team and operations; reporting to Nathan Hanks; the Company’s Chief Distribution Officer. Power launched ReachLocal’s Australian operations in 2006 and was the driving force behind the Company’s success in that market. Power’s prior responsibilities in Australia will be assumed by local management in Australia. Prior to ReachLocal; Power served as an executive at Netus Pty Ltd; an Australian venture capital company backed by News Corporation; and at PMP as a National Sales Director and as Executive for Acquisitions and Solutions Development. Power holds both a Bachelor of Arts and a Bachelor of Commerce degree from the University of Melbourne.<br>“Steve’s contributions to ReachLocal have gone well beyond his success in growing our Australian operations;” said Hanks. “We’re excited that he will take that institutional knowledge and apply it to impact our entire sales operation; as part of our ongoing efforts to enhance the performance and efficiency of our global sales organization.”<br>About ReachLocal; Inc.<br>ReachLocal; Inc.’s (NASDAQ: RLOC) mission is to help small- and medium-sized businesses (SMBs) acquire; maintain and retain customers via the Internet. ReachLocal offers a comprehensive suite of online marketing solutions; including search engine marketing (ReachSearch(TM)); display advertising (ReachDisplay(TM)) and remarketing; customer retention tools (Bizzy(TM)); online marketing analytics (TotalTrack®); and our out-of-the-box assisted chat service (TotalLiveChat(TM)); each targeted to the SMB market. ReachLocal delivers this suite of services to SMBs through a combination of its proprietary technology platform and its direct; “feet-on-the-street” sales force of Internet Marketing Consultants and select third party agencies and resellers. ReachLocal is headquartered in Woodland Hills; CA; with offices throughout North America and in Australia and the United Kingdom.<br>Caution Concerning Forward-Looking Statements<br>This document includes certain forward-looking statements. These statements are based on the current expectations or beliefs of management of ReachLocal and are subject to uncertainty and changes in circumstances. Actual results may vary materially from those expressed or implied by the statements herein due to (1) changes in economic; business; competitive; technological and/or regulatory factors; (2) failure to compete successfully in a highly competitive and rapidly changing marketplace; (3) failure to retain key employees; and (4) other factors affecting the business operation of ReachLocal. More detailed information about these and other factors that may affect current expectations may be found in filings by ReachLocal with the U.S. Securities and Exchange Commission. ReachLocal is under no obligation to; and expressly disclaims any such obligation to; update or alter its forward-looking statements; whether as a result of new information; future events; or otherwise.<br>Photos/Multimedia<br>Contact<br>ReachLocal; Inc.<br>David Glaubke; 818-936-9908 (Media)<br>Director of Corporate Communications<br>dglaubke@reachlocal.com<br>or<br>The Blueshirt Group<br>Alex Wellins; 415-217-5861 (Investor Relations)<br>alex@blueshirtgroup.com,http://pressrelease.net/reachlocal-announces-new-cto-head-of-global-sales-operations/,250-1000,$100-250 Million,Press Release,,ReachLocal ; a leader in local online marketing solutions for small- and medium-sized businesses (SMBs); announced today it has elevated Jeff Hagins to the position of Chief Technology Officer,Hagins was ReachLocal’s Vice President of Engineering for Digital Presence and came to ReachLocal through the Company’s February acquisition of SMB:LIVE Corporation; where he was a founder and Chief Technology Officer.,ReachLocal; Inc.’s (NASDAQ: RLOC) mission is to help small- and medium-sized businesses (SMBs) acquire; maintain and retain customers via the Internet. ReachLocal offers a comprehensive suite of online marketing solutions; including search engine marketing (ReachSearch(TM)); display advertising (ReachDisplay(TM)) and remarketing; customer retention tools (Bizzy(TM)); online marketing analytics (TotalTrack®); and our out-of-the-box assisted chat service (TotalLiveChat(TM)); each targeted to the SMB market.,http://pressrelease.net/reachlocal-announces-new-cto-head-of-global-sales-operations/
Alok,,Gupta,Chief Technology Officer,Alok Gupta; PhD; Joins ikaSystems as Chief Technology Officer,ikaSystems,www.ikasystems.com,Healthcare; Pharmaceuticals; & Biotech : Biotechnology,134 Turnpike Road,Southborough,MA,01772,USA,508.229.0600,agupta@ikasystems.com,9/30/2010,9/30/2010,Appointment,Alok Gupta; PhD; Joins ikaSystems as Chief Technology Officer <br>SOUTHBOROUGH; Mass.–(BUSINESS WIRE)–Noted healthcare technology innovator Alok Gupta; PhD; has joined ikaSystems; the nation’s premier.,http://www.technologynewsreport.com/alok-gupta-phd-joins-ikasystems-as-chief-technology-officer/,100-250,$10-50 Million,News,,Noted healthcare technology innovator Alok Gupta; PhD; has joined ikaSystems; the nation’s premie,Alok Gupta; PhD; has an extensive track record of innovation; general management experience; product and business development success; global research and development (R&D) leadership; high-performance team-building and business execution. Before joining ikaSystems; he was senior vice president and chief information officer at CareFirst BlueCross BlueShield; the largest private health insurer serving Maryland; Washington DC and northern Virginia.,ikaSystems is healthcare payers’ premier provider of enterprise-level cloud computing technologies for commercial; Medicare and Medicaid lines of business. ikaEnterprise; the company’s flagship product; automates all key processes in the payer business cycle — from marketing and sales through claims administration and customer service to care and quality management — all on a single integrated platform,http://www.technologynewsreport.com/alok-gupta-phd-joins-ikasystems-as-chief-technology-officer/
Brian,,Thompson,Vice President of Technology,SoftVu Announces New Executive Team Members,SoftVu,www.softvu.com,Software & Internet : E-commerce and Internet Businesses,12920 Metcalf Ave Ste 200,Overland Park,KS,66213,USA,913.696.9700,brian.thompson@softvu.com,10/5/2010,10/5/2010,Promotion,SoftVu Announces New Executive Team Members<br>New Appointments to Further Drive Marketing Automation Service<br> FOR IMMEDIATE RELEASE<br>PRLog (Press Release) – Oct 05; 2010 – OVERLAND PARK; KANSAS — To better serve the needs of the financial services industry; SoftVu today announced Brian Thompson as Vice President of Technology and Kory Dillman as Vice President of Product Management. These changes reflect the company’s increased focus on delivering services and technologies that help businesses streamline the marketing communication process.<br>“In the current economic conditions; our clients need better analysis; measurability; and focus on return on investment. The new executive positions strengthen our management team; bringing capabilities and experiences to deploy tools and services to meet growing market demands;” said Tim Donnelly; SoftVu President and CEO. “I look forward to the contributions Brian and Kory can make in helping SoftVu strengthen our value proposition as we continue to drive innovation in the industry.”<br>Brian Thompson has been promoted to the company’s Vice President of Technology; overseeing all facets of SoftVu’s product architecture; development; and support. Thompson joined SoftVu in 2005; serving most recently as the Chief Architect for the company. Prior to SoftVu; Thompson worked for Cerner Corporation as a software architect; with responsibility for the design; development; and support of its clinical results repository.<br>Kory Dillman has joined the company as Vice President of Product Management; with responsibility for the company’s product and services marketing. Before SoftVu; Dillman worked as an executive with marketing and operations responsibilities; including the Director of Operations with IVOX; a predictive risk analytics provider; where he was responsible for marketing strategy and service roll outs. Prior to that role; as Executive Vice President of SiriCOMM; Dillman was responsible for marketing strategy; network operations; and customer service.<br><br>About SoftVu<br>SoftVu provides marketing automation solutions that streamline the marketing communication processes. Our software and services deliver increases in revenue and customer loyalty while maximizing results through automated workflows and campaign management.,http://www.prlog.org/10977442-softvu-announces-new-executive-team-members.html,0-25,$1-10 Million,Press Release,,SoftVu promoted Brian Thompson to Vice President of Technology,Thompson joined SoftVu in 2005; serving most recently as the Chief Architect for the company. Prior to SoftVu; Thompson worked for Cerner Corporation as a software architect; with responsibility for the design; development; and support of its clinical results repository.,SoftVu provides marketing automation solutions that streamline the marketing communication processes. Our software and services deliver increases in revenue and customer loyalty while maximizing results through automated workflows and campaign management.,http://www.prlog.org/10977442-softvu-announces-new-executive-team-members.html
Darrell,,Snow,CTO,Flying Wisdom Studios Names Darrell Snow New CTO; COIN Division,Flying Wisdom Studios; Inc.,www.flyingwisdomstudios.com,Software & Internet : Games and Gaming,1620 Montgomery Street; Suite 170,San Francisco,CA,94111,USA,650.352.3548,dsnow@flyingwisdomstudios.com,9/1/2010,9/1/2010,Appointment,Flying Wisdom Studios Names Darrell Snow New CTO; COIN Division<br>Darrell Snow; CTO; COIN Division<br>San Francisco; CA (PRWEB) September 1; 2010<br>Flying Wisdom Studios (FWS) today announced that Darrell Snow has been named the game developer’s new CTO; COIN Division. Mr. Snow is a seasoned technology manager with an excellent understanding of how to successfully implement complex technology solutions. With experience in manufacturing; banking; insurance; retail; airline; and telecommunications; he brings a broad business perspective to FWS.<br>“We are extremely fortunate to have Darrell joining the Flying Wisdom Studios management team” says James Schermerhorn; VP of Business Development at FWS. “I worked closely with Darrell during his time as a VP with Blast Radius; and I have first hand knowledge of the high quality output he brings to a team environment. He has just the right mix of strategy with tactical execution that Flying Wisdom Studios needs to be successful in this early stage of our growth. He’s also an avid MMO gamer; so he speaks the language!”<br>Snow has a strong history of accomplishment in software design; architecture and construction; focusing on custom development; technology infrastructure; project management; team building and leadership development. Darrell has worked closely with ATG for the last decade; including work on implementations for clients in North America and EMEA including Vodafone NL; Orange UK; OfficeMax; Franklin Covey; Lexmark; Newell Rubbermaid; Nike; Jenny Craig; and Nutrisystem. Darrell most recently held the position of CTO at Infosys for the SaaS business unit; before which he held senior level technology roles at Microsoft; Avenue A | Razorfish; and Starbucks Coffee Company.<br>Flying Wisdom Studios makes games as a function of unparalleled innovation. Founded in 2008 by three successful industry veterans; development is driven by their exclusive collective insights into virality; social mechanics; and trans-media storytelling. FWS prides itself equally in the creation of independently developed intellectual property; and in the quality of the games they produce for well-known clients like National Geographic; Lady Gaga; George Romero; SGN; and ngmoco:). For more information on Flying Wisdom Studios; please visit them online at www.flyingwisdomstudios.com,http://architecturedesignschools.com/flying-wisdom-studios-names-darrell-snow-new-cto-coin-division,0-25,$1-10 Million,Press Release,,Flying Wisdom Studios (FWS) today announced that Darrell Snow has been named the game developer’s new CTO; COIN Division,Snow has a strong history of accomplishment in software design; architecture and construction; focusing on custom development; technology infrastructure; project management; team building and leadership development. Darrell has worked closely with ATG for the last decade; including work on implementations for clients in North America and EMEA including Vodafone NL; Orange UK; OfficeMax; Franklin Covey; Lexmark; Newell Rubbermaid; Nike; Jenny Craig; and Nutrisystem.,Flying Wisdom Studios creates high quality games using original intellectual property or by building upon existing IP for top-tier game publishers on mobile and social network platforms.,http://architecturedesignschools.com/flying-wisdom-studios-names-darrell-snow-new-cto-coin-division
Lex,,Crosett,Chief Information Officer,WeatherBug Hires Lex Crosett as Vice President and Chief Information Officer,WeatherBug,www.weatherbug.com,Business Services : Security Services,12410 Milestone Center Drive; Suite 300,Germantown,MD,20876,USA,301.250.4000,lcrosett@weatherbug.com,10/7/2010,10/7/2010,Appointment,October 07; 2010 09:45 AM Eastern Daylight Time <br>WeatherBug Hires Lex Crosett as Vice President and Chief Information Officer <br>GERMANTOWN; Md.--(BUSINESS WIRE)--WeatherBug®; the leading provider of consumer and professional weather products and services and operator of the largest weather observing and lightning network; announced the hiring of Lex Crosett as vice president and chief information officer. An information technology executive with over 25 years of experience; Crosett will oversee all information and networking technology and lead the advancing development of infrastructure; tools and business systems as WeatherBug expands its global networks and systems operations. <br>“Without a doubt; Lex’s background in software development and networking technology will be instrumental as we continue to bring to market extremely sophisticated network and hosted solutions. I look forward to his leadership in advancing our operational and technology infrastructure to the next level.”<br>Prior to joining WeatherBug; Crosett served as vice president of technology at Purepay Capital; a Columbus; Ohio-based strategic investor and operator of payments companies. Previously; Crosett was CTO at ConnectEdu; an educational services company. Earlier; Crosett served as principal at Kalex Enterprises; a company he founded to provide management consulting services to software and technology organizations. <br>In addition; Crosett held executive and leadership technology positions at Providus Software Solutions; fourthchannel; Lotus Development Corporation and Banyan Systems (before its acquisition by Unisys); Myway.com and CompuServe. <br>“Lex Crosett is an accomplished technology professional and business leader and we are extremely pleased to be adding him to the executive team;” said Rich Spaulding; chief financial officer; WeatherBug. “Without a doubt; Lex’s background in software development and networking technology will be instrumental as we continue to bring to market extremely sophisticated network and hosted solutions. I look forward to his leadership in advancing our operational and technology infrastructure to the next level.” <br>About WeatherBug <br>WeatherBug (http://www.weatherbug.com and http://www.weatherbugprofessional.com) precisely monitors; organizes and disseminates global weather information. As a trusted source for live; local dynamic data; WeatherBug empowers society with weather intelligence for making more informed decisions. Millions of consumers and professional organizations; including the National Weather Service; rely on WeatherBug to plan daily activities; safeguard lives and improve business operations. WeatherBug is a brand of AWS Convergence Technologies; Inc. (http://www.aws.com). <br>Photos/Multimedia Gallery Available: http://www.businesswire.com/cgi-bin/mmg.cgi?eid=6458532&lang=en <br>Contacts <br>WeatherBug<br>Jennifer Gilmore; 301-250-4239<br>jgilmore@weatherbug.com<br>or<br>Rachel Hunt; 301-250-4046<br>rhunt@weatherbug.com,http://www.businesswire.com/news/home/20101007005229/en/WeatherBug-Hires-Lex-Crosett-Vice-President-Chief,25-100,$1-10 Million,Press Release,,WeatherBug appointed Lex Crosett as Chief Information Officer,Lex Crosett was previously the vice president of technology at Purepay Capital; a Columbus; Ohio-based strategic investor and operator of payments companies.,WeatherBug (http://www.weatherbug.com and http://www.weatherbugprofessional.com) precisely monitors; organizes and disseminates global weather information. As a trusted source for live; local dynamic data; WeatherBug empowers society with weather intelligence for making more informed decisions.,http://www.businesswire.com/news/home/20101007005229/en/WeatherBug-Hires-Lex-Crosett-Vice-President-Chief
