First name,Middle Initial,last name,title,headline,company name,company website,Industry,address,city,state,zip code,country,phone,email,Date of announcement,effective date,type,The full text of the press release,Company Size – Revenue,Company Size – Employees,source,short url,what happened,about person,about company,more link
David,,Manser,Director of Technology,TASC; Inc. Appoints Retired Naval Aviator to Enterprise Systems Business Unit,TASC,www.tasc.com,Software & Internet : Software & Internet Other,4805 Stonecroft Blvd,Chantilly,VA,20151,USA,703.633.8300,david.manser@tasc.com,7/7/2010,7/7/2010,Appointment,"TASC; Inc. Appoints Retired Naval Aviator to Enterprise Systems Business Unit                                                                                                                                                                                              TASC; Inc.                                                                                                                                                                                             7 July 2010                                                                                                                                                                                             PR Newswire (U.S.)                                                                                                                                                                                             CHANTILLY; Va.; July 7 /PRNewswire/ -- TASC; Inc.; the leading independent and non-conflicted provider of advanced systems engineering; integration and support services to the intelligence; defense and federal civilian markets; has named David Manser Director of Technology for TASC's Enterprise Systems Business Unit. Manser joins TASC from Boeing; where he served as program manager and IT director on the company's internal advanced experimental network; LabNet; which serves as the backbone for modeling; simulation and experimentation for future applications at agencies such as the Department of Defense; Department of Homeland Security and the Federal Aviation Administration.                                                                                                                                                                                              ""Dave's deep experience in virtual test environments will further strengthen TASC's ability to tailor and apply advanced test capabilities and tools to the most complex enterprise systems;"" says Pamela Drew; vice president of Enterprise Systems Business Unit at TASC.                                                                                                                                                                                              During his tenure at Boeing; Manser led the development teams that created leading applications in cyber warfare and network management. He managed large-scale programs and systems integration projects; including the $400 million S3 truss segment and S4 power-generation module of the International Space Station. He is a NASA-certified spaceflight controller and served in Mission Control Houston and the Russian Spaceflight Control Center in Korolev for the construction of the space station's pressurized modules and first manned crews.                                                                                                                                                                                             ""With his background in developing leading-edge; network-centric systems and managing large-scale infrastructure and cyber security programs; Dave brings great insight into the needs of TASC's customers in the military and intelligence communities; as well as in civilian sectors;"" says Drew.                                                                                                                                                                                             A retired naval aviator; Manser served in the U.S. Navy for 22 years in active duty and the reserves. He earned a master's of science in space systems from the Naval Postgraduate School; and a B.A. in economics from Duke University.                                                                                                                                                                                             About TASC                                                                                                                                                                                             TASC is the premier; non-conflicted provider of advanced systems engineering; integration and decision-support services across the intelligence community; Department of Defense and civilian agencies of the federal government. Formerly a unit of Northrop Grumman Corporation; TASC became an independent company in December 2009. For more than 40 years; TASC has partnered with our customers toward one goal—the success of their missions. Our broad portfolio of services includes system and policy analysis; program; financial and acquisition management; enterprise engineering and integration; advanced concept and technology development; and test and evaluation. With nearly 5;000 employees; TASC generates more than $1.6 billion in annual revenue. For more information and career opportunities; visit our website at www.tasc.com [http://www.tasc.com].                                                                                                                                                                                             CONTACT                                                                                                                                                                                             Christine Nyirjesy Bragale                                                                                                                                                                                             (703) 653-5996 (office)                                                                                                                                                                                             Christine.Bragale@TASC.com",>100K,>$1B,News,http://bit.ly/cVptUx,TASC appointed David Manser as Director of Technology,A retired naval aviator; Manser served in the U.S. Navy for 22 years in active duty and the reserves. He earned a master's of science in space systems from the Naval Postgraduate School; and a B.A. in economics from Duke University.,TASC is the premier; non-conflicted provider of advanced systems engineering; integration and decision-support services across the intelligence community; Department of Defense and civilian agencies of the federal government. ,http://www.prnewswire.com/news-releases/tasc-inc-appoints-retired-naval-aviator-to-enterprise-systems-business-unit-97990569.html
Jerry,W.,Clever,Chief Technology Officer,Alkane; Inc. Names New Chief Technology Officer,Alcane,www.monsterdiesel.com,Energy & Utilities : Energy & Utilities Other,2205 York Road; Suite 14,Lutherville,MD,21093,USA,410.666.7837,jerry@monsterdiesel.com,7/26/2010,7/26/2010,Appointment,"Jul 26; 2010 14:01 ET                                                                                                                                                                                             Alkane; Inc. Names New Chief Technology Officer                                                                                                                                                                                             Clever Brings Technology; Business; and Research Experience to the Position                                                                                                                                                                                             BALTIMORE; MD--(Marketwire - July 26; 2010) - Alkane; Inc. (OTCQB: ALKN) (PINKSHEETS: ALKN) is pleased to announce the company has appointed Jerry W. Clever; Ph.D. to the role of Chief Technology Officer. Dr. Clever is the former President and owner of JEDB Associates; LLC; where he built significant government and defense contacts in the alternative energy industry.                                                                                                                                                                                             Before joining forces with Alkane; Dr. Clever's JEDB Associates supported alternative; renewable energy technologies to maximize the value of sustainability -- making environmental excellence; energy innovation; and social responsibility drivers for increased reliance and energy independence.                                                                                                                                                                                             Dr. Clever received his Ph.D. from Catholic University of America in 1991 and has worked as an advocate for renewable; sustainable energy throughout his career. He served as Adjunct Professor for the school and in various research capacities in both the academic and professional realm. In addition; Dr. Clever's private sector career included executive responsibilities for a physician driven provider network and three medical mall facilities in the Washington; D.C. area.                                                                                                                                                                                             ""Dr. Clever brings uncommon expertise; terrific energy; and a unique set of interdisciplinary skills which will form the nexus of technology for our products today and tomorrow;"" said Mathew Zuckerman; Ph.D.; CEO & President. ""He has the rare combination of a curious mind; natural leadership; communication; and interpersonal skills.""                                                                                                                                                                                                                                                                                                                                                                                          About Alkane; Inc.                                                                                                                                                                                              Alkane; Inc. is dedicated to the development of a family of alternative fuels and additives; which; collectively; will contribute to a solution to the global energy crisis. Additional benefits of Alkane; Inc.'s product offerings include positive environmental impact through the reduction of harmful emissions and reduced vehicle operation and maintenance costs. Monster Diesel™; flagship product of Alkane; Inc.; is a patent pending high energy ""green"" alternative fuel additive which boosts diesel fuel's quality to premium levels and is designed for use in any diesel powered motor.                                                                                                                                                                                             Forward-Looking Statements:                                                                                                                                                                                             This press release contains certain forward-looking statements. Investors are cautioned that certain statements in this release are ""forward-looking statements"" and involve both known and unknown risks; uncertainties and other factors. Such uncertainties include; among others; certain risks associated with the operation of the company described above. The Company's actual results could differ materially from expected results.                                                                                                                                                                                             Visit www.MonsterDiesel.com for more product information; news and analysis; and information on how to order Monster Diesel™ and branded products. Also visit Monster Diesel™ on Facebook or follow on Twitter.                                                                                                                                                                                             Monster Diesel™ and the logo are trademarks and are the property of Alkane; Inc.",25 - 100,$1 - 10M,Press Release,http://bit.ly/cVptUx,Jerry Clever was appointed Chief Technology Officer at Alkane Inc.,Before Alkane; Dr. Clever's JEDB Associates supported alternative; renewable energy technologies to maximize the value of sustainability -- making environmental excellence; energy innovation; and social responsibility drivers for increased reliance and energy independence.,"Alkane; Inc. is dedicated to the development of a family of alternative fuels and additives; which; collectively; will contribute to a solution to the global energy crisis. Additional benefits of Alkane; Inc.'s product offerings include positive environmental impact through the reduction of harmful emissions and reduced vehicle operation and maintenance costs. Monster Diesel™; flagship product of Alkane; Inc.; is a patent pending high energy ""green"" alternative fuel additive which boosts diesel fuel's quality to premium levels and is designed for use in any diesel powered motor.",http://www.marketwire.com/press-release/Alkane-Inc-Names-New-Chief-Technology-Officer-1295466.htm
Jim,,Tommaney,Chief Technology Officer,Calpont Appoints Jim Tommaney as Chief Technology Officer,Calpont,www.calpont.com,Software & Internet : Software & Internet Other,3011 Internet Blvd Ste 100,Frisco,TX,75034,USA,214.618.9500,jtommaney@calpont.com,7/23/2010,7/23/2010,Promotion,Calpont Appoints Jim Tommaney as Chief Technology Officer                                                                                                                                                                                             Tommaney Promoted from Chief Product Architect to CTO to Accelerate Development and Customer Success                                                                                                                                                                                                                                                                                                                                                                                          Frisco; TX (PRWEB) July 23; 2010                                                                                                                                                                                             Calpont Corporation; a provider of scalable; high-performance; column-oriented analytic databases; today announced the promotion of Jim Tommaney from Chief Product Architect to Chief Technology Officer (CTO). In this position; Tommaney will work closely with customers to help guide Calpont’s long-term technology strategy and keep it aligned with industry requirements.                                                                                                                                                                                             “We are very fortunate to have Jim’s “next bench” expertise with 25 years of software development experience. His recognized expertise; forward-thinking; and strategic guidance will help Calpontcontinue to innovate in the areas of scalable solutions; improved data load procedures and integration support for the applications our customers use today and in the future.” said Jeff Vogel; CEO of Calpont. “Jim will continue to provide genuine innovation; and provide leading-edge solutions to keep moving the industry forward.”                                                                                                                                                                                             Tommaney served as Chief Product Architect for the past four years. He has been responsible for the design and architecture for the InfiniDB product; a high-performance; horizontally-scalable and cost-effective database solution purpose-built for analytics; business intelligence and data warehousing. His broad expertise in design; managing and delivering performance for enterprise data architectures continues to be instrumental in the InfiniDB architecture. Tommaney holds a BBA from Texas A&M and a Masters in MIS from the University of Texas at Dallas and has provided data architecture leadership for teams up to 200 developers.                                                                                                                                                                                             About Calpont                                                                                                                                                                                              Calpont Corporation is a provider of scalable; high-performance analytic databases enabling ultra-fast; deep analysis of massive data sets. Its InfiniDB Enterprise Edition is the emerging choice for demanding data warehouse; Business Intelligence; reporting; analytic application and data mart deployments. Known for its quick implementation time; unmatched operational simplicity and unparalleled value; InfiniDB provides rapid access to critical business data for data-intensive businesses including those in the SaaS; retail; telecommunications and government industries. For more information; please visit www.calpont.com; or follow us at twitter.com/calpont.                                                                                                                                                                                             All names referred to are trademarks or registered trademarks of their respective owners.                                                                                                                                                                                             Media Contact:                                                                                                                                                                                              Lisa Prassack                                                                                                                                                                                              EDGE Consulting for Calpont Corporation                                                                                                                                                                                              lprassack(at)calpont(dot)com or press(at)calpont(dot)com                                                                                                                                                                                              +1(303) 570-8141,25 - 100,$1 - 10M,Press Release,http://bit.ly/cVptUx,Calpont promoted Jim Tommaney to Chief Technology Officer,Jim Tommaney served as Chief Product Architect for the past four years. He has been responsible for the design and architecture for the InfiniDB product; a high-performance; horizontally-scalable and cost-effective database solution purpose-built for analytics; business intelligence and data warehousing. His broad expertise in design; managing and delivering performance for enterprise data architectures continues to be instrumental in the InfiniDB architecture. Tommaney holds a BBA from Texas A&M and a Masters in MIS from the University of Texas at Dallas and has provided data architecture leadership for teams up to 200 developers.,Calpont Corporation is a provider of scalable; high-performance analytic databases enabling ultra-fast; deep analysis of massive data sets. Its InfiniDB Enterprise Edition is the emerging choice for demanding data warehouse; Business Intelligence; reporting; analytic application and data mart deployments. Known for its quick implementation time; unmatched operational simplicity and unparalleled value; InfiniDB provides rapid access to critical business data for data-intensive businesses including those in the SaaS; retail; telecommunications and government industries. ,http://www.prweb.com/releases/2010/07/prweb4297574.htm
