Ed,,Steinike,Chief Information Officer,The Board of Directors of the Coca-Cola Company Announces Quarterly Dividend                                        Elects Chief Information Officer Ed Steinike as a Vice President,The CocaCola Company,www.thecoca-colacompany.com,Manufacturing : Nonalcoholic Beverages,1 Coca Cola Plz Northwest,Atlanta,GA,30313,USA,404.676.2121,esteinike@na.ko.com,7/22/2010,7/22/2010,Appointment,July 22; 2010 12:17 PM Eastern Daylight Time                                                                                                                                                                                              The Board of Directors of the Coca-Cola Company Announces Quarterly Dividend                                                                                                                                                                                              Elects Chief Information Officer Ed Steinike as a Vice President                                                                                                                                                                                              ATLANTA--(BUSINESS WIRE)--The Board of Directors of The Coca-Cola Company today declared a regular quarterly dividend of 44 cents per common share. The dividend is payable October 1; 2010; to shareowners of record as of September 15; 2010.                                                                                                                                                                                              This is equivalent to an annual dividend of $1.76 per share; up from $1.64 per share in 2009. The dividend reflects the Board's confidence in the Company's long-term cash flow. The Company returned $5.3 billion to shareowners in 2009; through $3.8 billion in dividends and $1.5 billion in share repurchases.                                                                                                                                                                                              The Board also elected Ed Steinike as a vice president of the Company.                                                                                                                                                                                              As Chief Information Officer; Mr. Steinike oversees the Company’s global information technology strategy; services and operations. Before rejoining The Coca-Cola Company in April; Mr. Steinike served as Executive Vice President and Chief Information Officer at ING Insurance. Prior to ING; he was The Coca-Cola Company’s Chief Development Officer and CIO of its North America business from 2004 to 2007. From 2002 to 2004; Mr. Steinike was the Company’s Chief Technology Officer. Prior to joining The Coca-Cola Company; he worked at General Electric between 1976 and 2002; holding positions of increasing responsibility including CIO for GE Energy and GE Medical Systems.                                                                                                                                                                                              Mr. Steinike holds a Bachelor of Science degree from Marquette University.                                                                                                                                                                                              The Coca-Cola Company (NYSE: KO) is the world's largest beverage company; refreshing consumers with more than 500 sparkling and still brands. Along with Coca-Cola®; recognized as the world's most valuable brand; the Company's portfolio includes 12 other billion dollar brands; including Diet Coke®; Fanta®; Sprite®; Coca-Cola Zero®; vitaminwater®; POWERADE®; Minute Maid®; Simply® and Georgia Coffee®. Globally; we are the No. 1 provider of sparkling beverages; juices and juice drinks and ready-to-drink teas and coffees. Through the world's largest beverage distribution system; consumers in more than 200 countries enjoy the Company's beverages at a rate of 1.6 billion servings a day. With an enduring commitment to building sustainable communities; our Company is focused on initiatives that protect the environment; conserve resources and enhance the economic development of the communities where we operate. For more information about our Company; please visit our website at www.thecoca-colacompany.com.                                                                                                                                                                                              Stay informed. Subscribe to receive the latest news from The Coca-Cola Company at http://feeds.feedburner.com/NewsFromTheCoca-ColaCompany.                                                                                                                                                                                              Photos/Multimedia Gallery Available: http://www.businesswire.com/cgi-bin/mmg.cgi?eid=6369638&lang=en                                                                                                                                                                                              Contacts                                                                                                                                                                                              The Coca-Cola Company                                                                                                                                                                                             Kenth Kaerhoeg; +1 (404) 676-2683 pressinquiries@na.ko.com                                                                                                                                                                                              Permalink: http://www.businesswire.com/news/home/20100722006214/en/Board-Directors-Coca-Cola-Company-Announces-Quarterly-Dividend,10K - 50K ,$31.94B,Press Release,http://bit.ly/bGOih0,Ed Steinike was appointed Chief Information Officer of The Coca-Cola Company,Before rejoining The Coca-Cola Company in April; Mr. Steinike served as Executive Vice President and Chief Information Officer at ING Insurance. Prior to ING; he was The Coca-Cola Company’s Chief Development Officer and CIO of its North America business from 2004 to 2007. From 2002 to 2004; Mr. Steinike was the Company’s Chief Technology Officer. Prior to joining The Coca-Cola Company; he worked at General Electric between 1976 and 2002; holding positions of increasing responsibility including CIO for GE Energy and GE Medical Systems. Mr. Steinike holds a Bachelor of Science degree from Marquette University.,The Coca-Cola Company (NYSE: KO) is the world's largest beverage company; refreshing consumers with more than 500 sparkling and still brands. Along with Coca-Cola®; recognized as the world's most valuable brand; the Company's portfolio includes 12 other billion dollar brands; including Diet Coke®; Fanta®; Sprite®; Coca-Cola Zero®; vitaminwater®; POWERADE®; Minute Maid®; Simply® and Georgia Coffee®. Globally; we are the No. 1 provider of sparkling beverages; juices and juice drinks and ready-to-drink teas and coffees. Through the world's largest beverage distribution system; consumers in more than 200 countries enjoy the Company's beverages at a rate of 1.6 billion servings a day. With an enduring commitment to building sustainable communities; our Company is focused on initiatives that protect the environment; conserve resources and enhance the economic development of the communities where we operate. For more information about our Company; please visit our website at www.thecoca-colacompany.com.,http://www.businesswire.com/news/home/20100722006214/en/Board-Directors-Coca-Cola-Company-Announces-Quarterly-Dividend
Dan,,Raju,Chief Information Officer,Online Broker TradeKing Appoints Raju Chief Information Officer,TradeKing,www.tradeking.com,Financial Services : Insurance and Risk Management,5455 N Federal Hwy Ste E,Boca Raton,FL,33487,USA,561.988.0171,dan@tradeking.com,7/8/2010,7/8/2010,Appointment,Online Broker TradeKing Appoints Raju Chief Information Officer                                                                                                                                                                                             Former Global IT Executive for AP and Borders Brings More Than 15 Years of Strategy; Infrastructure and Technical Operations Leadership to Fast-Growing Online Brokerage Firm                                                                                                                                                                                             July 08; 2010 09:03 AM Eastern Daylight Time                                                                                                                                                                                              BOCA RATON; Fla.--(EON: Enhanced Online News)--Now in its fifth year of sustained high growth; online broker TradeKing (www.tradeking.com) today announced it has selected Dan Raju to join its senior management team as TradeKing’s first Chief Information Officer (CIO). Raju comes to TradeKing having served in senior global IT roles at both the Associated Press and Borders Group Inc. where he oversaw the infrastructure and operations groups for these vast global organizations. He will be based in the firm’s Charlotte; NC; offices and will be responsible for heading up all of the firm’s technology-based initiatives; reporting directly to TradeKing President and COO Rich Hagen.                                                                                                                                                                                              “It became very clear to us in speaking with Dan and evaluating his experience that he is deeply proficient at driving efficiency and stability through periods of corporate hyper-growth and change;” said Hagen. “He has a great track record of identifying new opportunities to maximize operational performance and using technology to drive greater organizational value. We believe Dan will be a great asset to our firm and; consequently; to our clients.”                                                                                                                                                                                             Raju was most recently Senior Director and Associate Vice President of Global Technology Infrastructure & Operations at the Associated Press where he was charged with overseeing all aspects of technology operations; strategy; engineering and support for the world's largest news company with operations in 300 plus global locations supporting about 10;000 newspapers and broadcasters and members. Before that; Raju held the position of senior director of IT Infrastructure and & Operations for Borders Group Inc. where he spent three years managing the complete infrastructure and operational support services for the Fortune 500 company with annual sales of over $4 Billion derived via its online and more than 1;400 retail stores. He has also held senior IT positions with other major national brand companies including Charming Shoppes (parent to fashion retailers Lane Bryant; Fashion Bug and others); Safety-Kleen and NCR Corporation. Raju received his Bachelor of Science degree in Chemical Engineering from JN Technology University in India and a Masters of Science in Computer Science from the University of Mississippi.,25 - 100,$10 - 50M,Press Release,,TradeKing appointed Dan Raju as Chief Information Officer,Raju was most recently Senior Director and Associate Vice President of Global Technology Infrastructure & Operations at the Associated Press where he was charged with overseeing all aspects of technology operations; strategy; engineering and support for the world's largest news company with operations in 300 plus global locations supporting about 10;000 newspapers and broadcasters and members.,TradeKing (http://www.tradeking.com) is a nationally licensed online stock and option trading broker offering simple; low trading fees ($4.95 per trade plus $.65 per option contract) with no hidden costs or account minimums.1 A pioneer in integrating new financial social media as part of its innovative online equities; options trading and fixed-income trading platform; TradeKing has received multiple five-star ratings from top industry sources and was rated best in customer service by SmartMoney2 Magazine; ahead of OptionsXpress; Scottrade; Fidelity and TD Ameritrade. (June 2010 SmartMoney Broker Survey).,http://eon.businesswire.com/news/eon/20100708005368/en
Carole,,Teolis,Chief Technology Officer,TRX Systems,TRX Systems Hires Carol Politi As CEO,www.trxsystems.com,Manufacturing : Automobiles; Boats and Motor Vehicles,7500 Greenway Center Dr.                                                                                                                  Ste. #820,Greenbelt,MD,20770,USA,301.313.0053,teolisc@trxsystems.com,7/26/2010,7/26/2010,Lateral move,TRX Systems Hires Carol Politi As CEO                                                                                                                                                                                              Mobile industry executive joins the TRX Systems' team to support expansion in business and partnerships for TRX personnel tracking technology. TRX develops precise; infrastructure-free location and tracking products that operate indoors; underground; and in other GPS-denied areas.                                                                                                                                                                                             Greenbelt; MD (PRWEB) July 26; 2010                                                                                                                                                                                              TRX Systems announced today the appointment of Carol Politi as Chief Executive Officer of the company. TRX develops the first personnel location and tracking products that deliver the required precision to safeguard personnel in environments without reliable GPS; including inside buildings; underground; and in dense urban areas. Dr. Carole Teolis has been named Chief Technology Officer of the company and Chairman of its Board of Directors.                                                                                                                                                                                             Former Senior Vice President of kajeet®; the cell phone service delivering sophisticated online service controls; Politi brings more than 20 years of experience in developing; managing; and marketing wireless services and portable devices to TRX. She will use those skills to bring TRX Systems’ cutting edge technology to people who often work without an adequate safety net; including firefighters; military; law enforcement; maritime; and mining personnel.                                                                                                                                                                                             “TRX’s sophisticated GPS-denied navigation technology enables the people who protect us from the world’s biggest perils and who work in harm’s way every day to keep themselves safe;” says Politi. “It is our privilege to get this technology into their hands.”                                                                                                                                                                                             At kajeet; Politi was responsible for the initial product definition and held P&L responsibility for mobile voice; data; messaging and content services. Prior to kajeet; Politi co-founded; served as Vice President of Marketing; and was a member of the Board of Directors for telecommunications software developer Megisto Systems. Prior to Megisto; she was Vice President of Product Management at Ericsson; where she managed internal product development and third-party vendor relationships for the company's mobile data infrastructure products.                                                                                                                                                                                              About TRX Systems Inc.                                                                                                                                                                                             TRX Systems Inc. develops precise; infrastructure-free location and tracking products that deliver real-time 3D location and status of personnel in environments without GPS coverage. TRX products are the first to deliver the precision required to improve situational awareness and safety for first responders; dismounted soldiers; and security personnel (including those inspecting for radiation; chemical; and other threats); and to effectively support personnel training applications. TRX Navigation Engine software can easily be integrated with partner sensors; communication systems; and situation awareness systems that require GPS-denied location capabilities. For more information visit www.trxsystems.com.,25-100,$1-10M,Press Release,http://bit.ly/bQ74ys,With appointment of the CEO; Carole Teolis stepped into the position of the Chief Technology Officer,Dr. Teolis has over 15 years experience in technical management and is an expert in signal processing and control systems design. Dr. Teolis is responsible for the long term vision and technical direction of TRX and she oversees all research and development activities including the team developing the TRX Sentinel Tracking System. Dr. Teolis has also secured over $6 Million in funding for TRX GPS denied tracking system development; secured a TRX beta contract with the Maryland Fire and Rescue Institute; and secured a TSWG commercialization contract.,TRX Systems Inc. develops precise; infrastructure-free location and tracking products that deliver real-time 3D location and status of personnel  in environments without GPS coverage. TRX products are the first to deliver the precision required to improve situational awareness and safety for first responders; dismounted soldiers; and security personnel (including those inspecting for radiation; chemical; and other threats); and to effectively support personnel training applications. TRX Navigation Engine software can easily be integrated with partner sensors; communication systems; and situation awareness systems that require GPS-denied location capabilities. For more information visit www.trxsystems.com.,http://www.prweb.com/releases/2010/07/prweb4293054.htm
David,,Jones,Vice President of Information Technology,TTI Exploration Adds To Executive Team,TTI Exploration,www.ttiexploration.com,Agriculture & Mining : Agriculture & Mining Other,Ashford Crossing II building; 1880 S. Dairy Ashford Road suite 545,Houston,TX,77077,USA,949.885.0264,djones@ttiexploration.com,7/30/2010,7/30/2010,Appointment,"TTI Exploration Adds To Executive Team                                                                                                                                                                                              30 July 2010                                                                                                                                                                                             Manufacturing Close-Up                                                                                                                                                                                             TTI Exploration; a privately-held geosciences technology company based in Houston; announced that Roger Peterson has joined the Company as Vice President of Human Resources; and David Jones has joined the Company as Vice President of Information Technology.                                                                                                                                                                                             In a release; the company said that both Peterson and Jones will report to Jim Hollis; President and CEO of TTI Exploration.                                                                                                                                                                                             Hollis said: ""We are rapidly expanding our capacity and capability to meet both existing demand and anticipated demand for the benefits of our innovative technologies and methodologies. Combining the most talented people with the most sophisticated processing; modeling and networking solutions are the core of our business and are essential to achieving the Company's objectives. We are fortunate to have two such distinguished professionals as Roger and David join our team and lead our human resource and information technology efforts respectively. Both men have a track record of finding the right people and empowering them with the organizational structure and tools to succeed.""                                                                                                                                                                                             Prior to joining TTI Exploration; Peterson was Vice President; Human Resources; for Phoenix Footwear Group. His experience includes recruiting and talent acquisition; organizational development; and compensation and benefits; across multiple disciplines; locations and cultures. Prior to Phoenix Footwear; he was with R.J. Peterson and Associates and Alcoa Global Fasteners. His career in human resources includes stops at The Bisys Group; Precision Castparts; Honeywell; Union Texas Petroleum and Amoco (now British Petroleum).                                                                                                                                                                                             Prior to joining TTI Exploration; Jones was Chief Architect for Crescent Enterprise Solutions. His experience includes IT infrastructure and optimization; enterprise solutions; and cloud computing. Prior to Crescent Enterprise Solutions; he was with MSC Software as Vice President; Enterprise Solutions and Services. Before MSC; he was with Sun Microsystems as Chief Technologist; Global Data Center Solutions Practice. Jones began his career with Chevron where he worked as an HPC engineering analyst. Jones has 20 years of experience in architecture; engineering and IT management.",0 - 25,$1 - 10M,News,,TTI Exploration appointed David Jones as Vice President of Information Technology,Prior to joining TTI Exploration; Jones was Chief Architect for Crescent Enterprise Solutions. His experience includes IT infrastructure and optimization; enterprise solutions; and cloud computing. Prior to Crescent Enterprise Solutions; he was with MSC Software as Vice President; Enterprise Solutions and Services.,TTI Exploration; Inc. is a technology-driven exploration company that develops proprietary technologies and methodologies which enable customers and partners to more rapidly; cost-effectively and accurately explore for natural resources; while minimizing the environmental impact; risk and cycle-time.  The company has combined new data acquisition; processing and interpretation technologies and methodologies into a fully integrated exploration system; which is being successfully deployed in regions of North America and soon South America.  ,http://www.ttiexploration.com/newsevents/7-news/59-tti-exploration-continues-to-strengthen-executive-team.html
