First name,Middle Initial,last name,title,headline,company name,company website,Industry,address,city,state,zip code,country,phone,email,Date of announcement,effective date,type,The full text of the press release,Company Size – Revenue,Company Size – Employees,source,short url,what happened,about person,about company,more link
Laurence,,O’Hagan,Chief Technology Officer,Electronic Printing and Customer Communications Veteran Laurence O’Hagan Joins StreamServe as Chief Technology Officer,StreamServe,www.streamserve.com,Business Services : Management Consulting,1 Van de Graaff Dr,Burlington,MA,1803,USA,781.761.6600,laurence.ohagan@streamserve.com,7/20/2010,7/20/2010,Appointment,Electronic Printing and Customer Communications Veteran Laurence O’Hagan Joins StreamServe as Chief Technology Officer                                                                                                                                                                                              July 20; 2010                                                                                                                                                                                             O’Hagan will leverage his past experience to drive the strategic vision and innovative planning behind StreamServe’s newest business communications solutions                                                                                                                                                                                              BURLINGTON; Mass.--(BUSINESS WIRE)--StreamServe; a leading provider of business communication solutions for document efficiency and customer experience management; announces the appointment of Laurence O’Hagan to the position of Chief Technology Officer. In this role; O’Hagan will be responsible for driving the strategic vision and planning behind StreamServe’s innovative solutions; product development and technical support.                                                                                                                                                                                              “Through his technical expertise; as well as his product and market vision; he will help us drive our product planning and developments to extend our technology into newer areas; such as cloud-based offerings.”                                                                                                                                                                                             O’Hagan brings a tremendous amount of senior technical experience and visionary leadership to StreamServe; and is considered an industry expert in the field of document automation and related technologies. He was most recently Chief Technology Officer for the Customer Communications Management division of Pitney Bowes Business Insight (PBBI); a position he was appointed to in 2004; when Pitney Bowes acquired Group 1 Software. At PBBI; he conceived and architected DOC1; the company’s core flagship solution for Customer Communications Management; as well as other pivotal products; including EngageOne Interactive and Content Author. In 2009; he additionally assumed the Global Portfolio Directorship for Customer Communications Management; responsible for its vision and strategy.                                                                                                                                                                                              O’Hagan was Chief Technology Officer of Customer Communications Systems at Group 1 Software between 1994 through 2004. He also held the position of President and Technical Director at Archetype; Inc.; from 1986 to 1994. O’Hagan attended University College of London; where he was trained as a physicist.                                                                                                                                                                                              “We are absolutely thrilled with Laurence’s new role with StreamServe;” commented Dennis Ladd; StreamServe’s president and CEO. “Through his technical expertise; as well as his product and market vision; he will help us drive our product planning and developments to extend our technology into newer areas; such as cloud-based offerings.”                                                                                                                                                                                              “StreamServe is well known for how it’s innovative and flexible customer communications management solutions integrate seamlessly with larger partner offerings; such as SAP and Adobe;” said O’Hagan. “I look forward to leveraging my past technical experience to advance StreamServe’s product offerings and to further propel the company’s leadership in the marketplace.”                                                                                                                                                                                              About StreamServe                                                                                                                                                                                              StreamServe is a leading provider of enterprise business communication solutions. Simple to deploy and maintain; the company’s dynamic composition; document process automation and enterprise output management solutions meet the demanding challenges of today’s global businesses for producing and delivering highly customized documents in any format.                                                                                                                                                                                              StreamServe’s advanced software solutions ease the process of composing and automating business communications; enabling organizations to increase the value and profitability of their business relationships. This is done all while leveraging existing business applications such as ERP; CRM and ECM.                                                                                                                                                                                              The company was founded in 1997 and is headquartered in Burlington; Mass.; with 14 offices worldwide. StreamServe serves more than 5;000 customers in 130 countries; primarily in the financial services; utilities; manufacturing; distribution and telecom sectors. Customers include BMW; CLP Power Hong Kong; AmerisourceBergen; and Siemens Financial. StreamServe’s strategic partners include Adobe Systems; IBM; InfoPrint Solutions Company; Lawson and SAP AG. To learn how StreamServe’s business communications solutions can help drive efficiency and improve costs within your organization; please visit StreamServe online at http://www.streamserve.com; or join the conversation on StreamShare™; StreamServe’s online community forum: http://streamshare.streamserve.com/.                                                                                                                                                                                              StreamServe; StreamShare; and the StreamServe logo are all trademarks of StreamServe Inc. Some software products marketed by StreamServe Inc. and its distributors contain proprietary software components of other software vendors. All other product and service names mentioned are the trademarks of their respective companies. ©StreamServe Inc. 2010                                                                                                                                                                                              Photos/Multimedia Gallery Available: http://www.businesswire.com/cgi-bin/mmg.cgi?eid=6366157&lang=en                                                                                                                                                                                              Contacts                                                                                                                                                                                              StreamServe contacts:                                                                                                                                                                                             Peter J. Gorman; 781-761-6659 Mobile: 617-669-4329                                                                                                                                                                                              Sr. Director; Corporate Communications                                                                                                                                                                                             Email: peter.gorman@streamserve.com                                                                                                                                                                                             Twitter: http://twitter.com/StreamServe                                                                                                                                                                                             Facebook: http://bit.ly/dkOpQG                                                                                                                                                                                             StreamShare: http://streamshare.streamserve.com                                                                                                                                                                                             Web: http://www.streamserve.com,25 - 100,$1 - 10M,Press Release,,StreamServe appointed Laurence O’Hagan as Chief Technology Officer,Laurence O’Hagan was most recently Chief Technology Officer for the Customer Communications Management division of Pitney Bowes Business Insight (PBBI); a position he was appointed to in 2004; when Pitney Bowes acquired Group 1 Software.,StreamServe is a leading provider of enterprise business communication solutions. Simple to deploy and maintain; the company’s dynamic composition; document process automation and enterprise output management solutions meet the demanding challenges of today’s global businesses for producing and delivering highly customized documents in any format. ,http://www.businesswire.com/news/home/20100720006504/en/Electronic-Printing-Customer-Communications-Veteran-Laurence-O%E2%80%99Hagan
Bernard,,Briggs,Chief Technology Officer,T3 Names Bernard Briggs Chief Technology Officer,T3,www.t-3.com,Business Services : Business Services Other,1806 Rio Grande St,Austin,TX,78701,USA,512.499.8811,bernard.briggs@t-3.com,7/13/2010,7/13/2010,Appointment,"T3 Names Bernard Briggs Chief Technology Officer                                                                                                        July 13; 2010                                                                                                                                                                                             AUSTIN; Texas — July 13; 2010– Substantiating its leadership position in technology and new media; T3 has hired new media expert Bernard Briggs as the agency’s first chief technology officer.                                                                                                                                                                                                                                                                                                                                                                                          Briggs brings over 16 years of experience to T3 and will oversee all marketing technology projects; working as the agency’s technical expert for all accounts. Briggs will provide technical support across practices; assisting in strategic sales efforts and working collaboratively with the creative and media departments to concept and develop best-in-class interactive work.                                                                                                                                                                                                                                                                                                                                                                                          “T3 strives to be technologically ahead as our industry continues to grow at unprecedented speed. Bernard has a breadth of knowledge and experience that will be invaluable to the organization; as well as providing innovative technological solutions to our clients;” said T3 president and CEO Gay Gaddis.                                                                                                                                                                                                                                                                                                                                                                                          Briggs said; ""The T3 team and their accomplishments are extremely impressive. The agency generates a tremendous amount of innovation and intellectual capital. I'm thrilled to join the team and invest my energy and passion into leveraging this to aggressively assert our leadership role in the application of technology to do what we do best; connect individuals and brands.""                                                                                                                                                                                                                                                                                                                                                                                          Briggs previously served as a consultant in the enterprise and consumer software solutions industry; overseeing all software life-cycle activities and providing executive-level support as a “virtual CTO.” Before launching his consultancy; Briggs held a variety of management roles at frog Design; Dell Inc; Neverfail Group Ltd and Trilogy.                                                                                                                                                                                                                                                                                                                                                                                          About T3                                                                                                                                                                                             T3; an agency with offices in Austin; New York and San Francisco; specializes in innovative marketing campaigns that cut across all media channels. As a collaborative think tank; T3 works with clients including ConocoPhillips Lubricants; Facebook; Intel; JCPenney; John Deere; JPMorgan Chase; Livescribe; Microsoft; Oriental Trading Company; Universal and UPS.                                                                                                                                                                                                                                                                                                                                                                                          Founded by CEO Gay Gaddis in 1989; T3 is independent and the largest advertising agency wholly owned by a woman in the United States. T3 ranks among ADWEEK's Top 100 Agencies and Advertising Age's Top 100 U.S. Marketing Services Agencies lists.",100 - 250,$10 - 50M,Company Announcement,,T3 appointed Bernard Briggs as Chief Technology Officer,Bernard Briggs previously served as a consultant in the enterprise and consumer software solutions industry; overseeing all software life-cycle activities and providing executive-level support as a “virtual CTO.” Before launching his consultancy; Briggs held a variety of management roles at frog Design; Dell Inc; Neverfail Group Ltd and Trilogy.,T3; an agency with offices in Austin; New York and San Francisco; specializes in innovative marketing campaigns that cut across all media channels. As a collaborative think tank; T3 works with clients including ConocoPhillips Lubricants; Facebook; Intel; JCPenney; John Deere; JPMorgan Chase; Livescribe; Microsoft; Oriental Trading Company; Universal and UPS.                                                                                                           Founded by CEO Gay Gaddis in 1989; T3 is independent and the largest advertising agency wholly owned by a woman in the United States. T3 ranks among ADWEEK's Top 100 Agencies and Advertising Age's Top 100 U.S. Marketing Services Agencies lists.,http://www.t-3.com/news/press_releases/t3_names_bernard_briggs_chief_technology_officer
