First Name,Last Name,Title,Company Name,Headline,What Happened,About Person,About Company
Kevin,Hart,Chief Information Officer,Clearwire,Kevin Hart was Appointed as Chief Information Officer at Clearwire,Las Vegas; NV-based Clearwire appointed Kevin Hart as Chief Information Officer.,Kevin Hart was previously the Chief Information Officer at Level 3 Communications.,Clearwire Communications; LLC; an operating subsidiary of Clearwire Corporation (NASDAQ:CLWR); offers a robust suite of advanced high-speed Internet services to consumers and businesses.
Kevin,Goldstein,Chief Technology Officer,Trycera Financial; Inc.,Kevin Goldstein was Appointed as Chief Technology Officer at Trycera Financial; Inc.,South Jordan; UT-based Trycera Financial; Inc. appointed Kevin Goldstein as Chief Technology Officer.,Kevin Goldstein was previously the Chief Technology Officer of an FCRA compliant credit bureau; overseeing the ongoing development of the company's systems architecture in order to assure fair and accurate data collection and adaptability to consumer and lender needs; while minimizing transaction costs and maximizing data security.,Trycera Financial; Inc. is a financial services company specializing in the delivery of prepaid card programs; prepaid card program management; alternative credit products and bill payment reporting. The Company also markets a diverse suite of personal financial management solutions and pay as you go services that allow consumers the ability to have recurring and non traditional payment information such as rent; utilities; insurance and wireless phone service payments reported to national credit reporting agencies.
Kevin,Fallon,Vice President of Technology,Badger Licensing,Kevin Fallon was Promoted to Vice President of Technology at Badger Licensing,Cambridge; MA-based Badger Licensing promoted Kevin Fallon to Vice President of Technology.,Kevin Fallon was previously GLobal Licensing Manager at Badger Technology,Badger Licensing; headquartered in Cambridge; Mass.; is a joint venture of affiliates of The Shaw Group and ExxonMobil Chemical Company. Badger Licensing is principally engaged in marketing; licensing; and developing technologies for ethylbenzene; styrene monomer; cumene; and bisphenol A. 
Kevin,Bott,Chief Information Officer,Ryder System,Kevin Bott Retired as Chief Information Officer at Ryder System,Miami; FL-based Ryder System announced retirement of Kevin Bott as Chief Information Officer.,Kevin Bott; prior to his position of a CIO; as the VP; Product and Technology Management at Ryder Integrated Logistics  ,Ryder System; Inc. is a FORTUNE 500 commercial transportation; logistics and supply chain management solutions company.
Mark,Kerzner,Chief Technology Officer,Exobox,Mark Kerzner was Appointed as Chief Technology Officer at Exobox,Houston; TX-based Exobox appointed Mark Kerzner as Chief Technology Officer.,Kerzner previously worked at Exobox as a senior software developer; and also acted as a consultant to the company. He has more than 20 years of experience in software development and has held posts at Merrill Lynch; Shell; Halliburton and Dresser Industries.,Exobox Technologies Corp. develops information risk management and security solutions that help organizations protect and recover their most valuable information assets. 
Kenneth,Pierce,Chief Information Officer,The University of Texas at San Antonio,Kenneth Pierce was Appointed as Chief Information Officer at The University of Texas at San Antonio,San Antonio; TX-based The University of Texas at San Antonio appointed Kenneth Pierce as Chief Information Officer.,Kenneth Pierce was previously at University of Texas at El Paso where; as chief information officer; he directed a staff of more than 90 full-time employees and 25 student employees. ,UTSA A comprehensive; four-year public university serving the San Antonio metropolitan area; South Texas and the Rio Grande Valley.
Kenneth,McCollum,Chief Information Officer,St. Joseph's College,Kenneth McCollum was Appointed as Chief Information Officer at St. Joseph's College,Brooklyn; NY-based St. Joseph's College appointed Kenneth McCollum as Chief Information Officer.,Kenneth McCollum was previously associate vice chancellor for information technology and chief technology officer at the University of North Carolina at Greensboro.,Since 1916; St. Joseph's College has provided an affordable liberal arts education to a diverse group of students.
Kenneth,Gall,Chief Technology Officer,Still River Systems; Inc.,Kenneth Gall was Appointed as Chief Technology Officer at Still River Systems; Inc.,Littleton; MA-based Still River Systems; Inc. appointed Kenneth Gall as Chief Technology Officer.,Kenneth Gall was previously Director of Radiation Therapy Physics at UT Southwestern Medical Center.,Still River Systems is dedicated to providing physicians and their patients access to high quality; cost-effective proton therapy solutions; and to helping establish this superior treatment modality as a standard of care for patients worldwide.
Ken,Stafford,Chief Information Officer,K State,Ken Stafford was Appointed as Chief Information Officer at K State,Manhattan; KS-based K State appointed Ken Stafford as Chief Information Officer.,Ken Stafford was previously vice president for administration and finance at the Maryland Institute for Agriculture and Natural Resources.,Kansas State University ranks as one of the nation’s “cutting-edge schools;” according to a guidebook that pinpoints today’s hottest majors and the innovative colleges that offer them.
Ken,Ruby,Chief Technology Officer,MCA,Ken Ruby became Chief Technology Officer at MCA,Houston; TX-based MCA appointed Ken Ruby as Chief Technology Officer.,Ken Ruby was previously the CFO at MCA.,Located in Houston and founded in 1995; MCA puts the power of healthcare finance smarts and IT to work for providers as they navigate complex payor and reimbursement relationships; and recover reimbursement owed.
Ken,Reiter,Chief Technology Officer,Supply Vision,Ken Reiter was Appointed as Chief Technology Officer at Supply Vision,Arlington Heights; IL-based Supply Vision appointed Ken Reiter as Chief Technology Officer.,Ken Reiter was previously the founder and president of Web Freight Pro.,Supply Vision Inc. is a technology company providing Software as a Service (SaaS) solutions to the supply chain industry
Ken,Piddington,Chief Information Officer,Global Partners,Ken Piddington was Promoted to Chief Information Officer at Global Partners,Waltham; MA-based Global Partners promoted Ken Piddington to Chief Information Officer.,Ken Piddington was previously Director Applications and Software Development at Global Partners LP,Global Partners LP is a leader in the storage; distribution and marketing of gasoline; distillates and residual oil to wholesalers; retailers and commercial customers throughout the Northeast.
Ken,Kerrick,Vice President of Information Technology,Nolte Associates Inc.,Ken Kerrick was Appointed as Vice President of Information Technology at Nolte Associates Inc.,Sacramento; CA-based Nolte Associates Inc. appointed Ken Kerrick as Vice President of Information Technology.,Ken Kerrick was previously the Vice President; Information Technology at Delta Health Systems.,Nolte is a full service engineering firm with capabilities and expertise to successfully complete your infrastructure project.
Ken,Harvey,Chief Technology and Services Officer,HSBC Bank USA,Ken Harvey was Promoted to Chief Technology and Services Officer at HSBC Bank USA,New York; NY-based HSBC Bank USA promoted Ken Harvey to Chief Technology and Services Officer.,Ken Harvey was previously the Group CIO at HSBC Bank USA.,HSBC's Principles and Values   Through loyal and committed employees who make lasting customer relationships and international teamwork easier to achieve.
Ken,Hanson,Director of Computer & Information Systems,SSOE Group,Ken Hanson Retired as Director of Computer & Information Systems at SSOE Group,Toledo; OH-based SSOE Group announced retirement of Ken Hanson as Director of Computer & Information Systems.,Ken Hanson is currently a Management Consulting Professional,SSOE Group is an international EPCM firm ranked eleventh among the largest engineering and architecture firms (Building Design + Construction; 2009). 
Kenneth,Day,Chief Technology Officer,Dot Hill Systems Corp.,Kenneth Day was Appointed as Chief Technology Officer at Dot Hill Systems Corp.,Longmont; CO-based Dot Hill Systems Corp. appointed Kenneth Day as Chief Technology Officer.,Ken Day has more than 30 years as a respected industry visionary in the architecture; design; and execution of information technology solutions. ,Dot Hill Systems Corp. is a recognized leader in software and hardware solutions for storing; sharing; protecting and managing data.
Kenneth,Cluff,Chief Technology Officer,MyNewPlace,Kenneth Cluff was Promoted to Chief Technology Officer at MyNewPlace,San Francisco; CA-based MyNewPlace promoted Kenneth Cluff to Chief Technology Officer.,Ken Cluff was previously Software Development Consultant at homestore.,MyNewPlace is one of the largest apartment and rental homes Web sites in the United States - with over six million available rental units.
Ken,Citron,Chief Information Officer,Rodale; Inc.,Ken Citron was Promoted to Chief Information Officer at Rodale; Inc.,Emmaus; PA-based Rodale; Inc. promoted Ken Citron to Chief Information Officer.,Ken Citron was previously the SVP Information Systems at Sony Music Inc.,Rodale is the authoritative source for trusted content in health; fitness; and wellness around the world.
Ken,Chatfield,Chief Information Officer,Health Management Associates,Ken Chatfield was Appointed as Chief Information Officer at Health Management Associates,Naples; FL-based Health Management Associates appointed Ken Chatfield as Chief Information Officer.,Ken Chatfield was previously enior technology executive over the past 22 years and has been with several top firms; most recently with Versata Software; Inc. based in Austin; Texas. ,Health Management enables America's best local health care by providing the people; processes; capital and expertise necessary for its hospital and physician partners to fulfill their local missions of delivering superior health care services. 
Ken,Chaisson,Vice President of Information Technology,Dunkin Donuts,Ken Chaisson was Appointed as Vice President of Information Technology at Dunkin Donuts,Canton; MA-based Dunkin Donuts appointed Ken Chaisson as Vice President of Information Technology.,Ken Chaisson most recently was the vice president of information technology for Legal Sea Foods.,With more than 13;000 franchises in 50 countries worldwide; Dunkin' Brands; Inc. is renowned for its leadership in the quick quality restaurant category.
Ken,Braud,Chief Information Officer,Halliburton,Ken Braud was Appointed as Chief Information Officer at Halliburton,Houston; TX-based Halliburton appointed Ken Braud as Chief Information Officer.,Ken Braud previously held various technology positions at Halliburton.,Formed in 1919 Halliburton is a global company that specializes in oil well site services; engineering; construction; technology and various other fields. 
Kelly,Schmitz,Vice President of Information Technology,ARIAD Pharmaceuticals; Inc.,Kelly Schmitz was Appointed as Vice President of Information Technology at ARIAD Pharmaceuticals; Inc.,Cambridge; MA-based ARIAD Pharmaceuticals; Inc. appointed Kelly Schmitz as Vice President of Information Technology.,Kelly Schmitz was previously the Vice President; Solutions Practice at Maxiom Consulting Group.,ARIAD is a pharmaceutical company whose vision is to transform the lives of cancer patients with breakthrough medicines.
Kelly,Moyer,Director of Information Technology,Seminole Casino Coconut Creek,Kelly Moyer was Appointed as Director of Information Technology at Seminole Casino Coconut Creek,Coconut Creek; FL-based Seminole Casino Coconut Creek appointed Kelly Moyer as Director of Information Technology.,Kelly Moyer was previously the Vice President; Information Technology at Sunrise Sports & Entertainment/Florida Panthers Hockey Club.,Visit the Seminole Player's Club at any of our casinos to sign up today.
Keith,Tuskey,Chief Technology Officer,Advertising Specialty Institute,Keith Tuskey was Promoted to Chief Technology Officer at Advertising Specialty Institute,Trevose; PA-based Advertising Specialty Institute promoted Keith Tuskey to Chief Technology Officer.,Keith Tuskey was previously the Director of product development.,The Advertising Specialty Institute; or ASI; has been providing award-winning products and services to the advertising specialty and promotional products industry for over 50 years.
Keith,Thibodeaux,Chief Information Officer,St. Mary Parish School Board,Keith Thibodeaux Resigned as Chief Information Officer at St. Mary Parish School Board,Centerville; LA-based St. Mary Parish School Board accepted resignation of Keith Thibodeaux as Chief Information Officer.,Keith Thibodeaux previously held various technology positions at the St. Mary Parish school.,The St. Mary Parish school district represents a highly progressive; dynamic; educational organization focused on the academic achievement of all students.
Keith,Radousky,Chief Technology Officer,Quintel Technology Limited,Keith Radousky was Appointed as Chief Technology Officer at Quintel Technology Limited,Menlo Park; CA-based Quintel Technology Limited appointed Keith Radousky as Chief Technology Officer.,Keith Radousky was previously the president of Wireless Industry Systems Expertise and before that was a VP with NextG Networks. ,Quintel is a leading innovator in the design; development; and delivery of network-efficient antenna solutions for wireless operators worldwide. The company's products enable global wireless operators to independently deploy and optimize multiple air interfaces or services on a single standard antenna platform.
Keith,Nelson,Chief Information Officer,The State University of New York's Hudson Valley Community College,Keith Nelson was Appointed as Chief Information Officer at The State University of New York's Hudson Valley Community College,Troy; NY-based The State University of New York's Hudson Valley Community College appointed Keith Nelson as Chief Information Officer.,Keith Nelson was previously the Director of Telecommunications and Networking at The University of Texas at Austin.,Hudson Valley Community College serves more than 14;000 students each semester; and employs more than 630 full- and part-time faculty members.
Keith,Neal,Chief Technology Officer,Meez,Keith Neal was Promoted to Chief Technology Officer at Meez,San Francisco; CA-based Meez promoted Keith Neal to Chief Technology Officer.,Keith Neal was previously Senior Software Engineer at Pulse.,Meez is a leading social entertainment community with over eight million users. It allows users to create 3D avatars; play casual games; share media; and connect with friends in a compelling virtual world.
Keith,Hicks,Chief Information Officer,Wencor Group,Keith Hicks was Appointed as Chief Information Officer at Wencor Group,Springville; UT-based Wencor Group appointed Keith Hicks as Chief Information Officer.,Keith Hicks was previously the Owner/Consultant at IT Consulting Services,Wencor is a worldwide industry leader in the manufacture and delivery of commercial aircraft parts.
Keith,Durbin,Director of Information Technology,Metropolitan Government of Nashville,Keith Durbin was Appointed as Director of Information Technology at Metropolitan Government of Nashville,Nashville; TN-based Metropolitan Government of Nashville appointed Keith Durbin as Director of Information Technology.,Keith Durbin was previously the Councilperson; District 18 at Metro Nashville Davidson County.,The Metropolitan Council is the legislative body of Nashville and Davidson County.
Keith,Barraclough,Chief Technology Officer,Next Issue Media,Keith Barraclough was Appointed as Chief Technology Officer at Next Issue Media,New York; NY-based Next Issue Media appointed Keith Barraclough as Chief Technology Officer.,Keith Barraclough was previously the general manager of Nokia's Ovi.com services portal; heading up development of that company's email; IM and social application and service offerings.,Next Issue Media is a revolutionary end-to-end publishing platform founded by five leading global publishers and designed to develop; market and deliver interactive magazine and newspaper content to consumers via the digital device of their choice.
Kazuhiro,Gomi,Chief Technology Officer,NTT America,Kazuhiro Gomi was Promoted to Chief Technology Officer at NTT America,New York; NY-based NTT America promoted Kazuhiro Gomi to Chief Technology Officer.,Kazuhiro Gomi was previously the Chief Operating Officer at NTT America.,Headquartered in New York with branch offices spread across the United States; NTT America is leading the North American sales and marketing effort of NTT Communications Group.
Kayne,Grau,Vice President of Technology,Cars.com,Kayne Grau was Promoted to Vice President of Technology at Cars.com,Chicago; IL-based Cars.com promoted Kayne Grau to Vice President of Technology.,Kayne Grau joined Cars.com in 2008 as the director of development; in 2009; he added technical operations and quality assurance to his responsibilities.,Cars.com is the leading destination for online car shoppers; offering credible; easy to understand information from consumers and experts to help buyers formulate opinions on what to buy; where to buy and how much to pay for a car.
Kay,Long,Chief Information Officer,Broken Arrow Public Schools,Kay Long was Promoted to Chief Information Officer at Broken Arrow Public Schools,Broken Arrow; OK-based Broken Arrow Public Schools promoted Kay Long to Chief Information Officer.,Kay Long previously held various technology positions at the Broken Arrow Public School district.,Broken Arrow Public Schools is the public school district of Broken Arrow; Oklahoma. The district has an enrollment of 16193 as of October 2008
Katrina,Lane,Vice President; Operations,Harrah's Entertainment,Katrina Lane was Promoted to Vice President; Operations at Harrah's Entertainment,Las Vegas; NV-based Harrah's Entertainment promoted Katrina Lane to Vice President; Operations.,Katrina Lane was previously the VP of channel marketing at Harrah's.,Founded in 1937; Harrahs is the worlds largest casino entertainment provider in the world. It operates in many countries but it has the majority of its establishments built in the United States of America and the United Kingdom. 
Kathy,Owen,Chief Information Officer,Unum,Kathy Owen was Promoted to Chief Information Officer at Unum,Chattanooga; TN-based Unum promoted Kathy Owen to Chief Information Officer.,Kathy Owen was previously the senior vice president of Information Technology Business Applications.,Unum (www.unum.com); formerly UnumProvident; is one of the leading providers of employee benefits products and services in the United States and the United Kingdom. 
Kathy,Claypatch,Senior Vice President; Information Technology,Apriva,Kathy Claypatch was Appointed as Senior Vice President; Information Technology at Apriva,Scottsdale; AZ-based Apriva appointed Kathy Claypatch as Senior Vice President; Information Technology.,Kathy Claypatch was previously the VP; Technology Services at  TSYS.,Founded in 1999; Apriva is the leading wireless solutions provider integrating the hardware; software and network infrastructure required to develop and deploy high-performance high-reliability solutions in the Point of Sale (POS) and Secure Mobile Messaging markets.
Kathryn,Cioffi,Director of Technology,Sacred Heart Academy,Kathryn Cioffi was Appointed as Director of Technology at Sacred Heart Academy,Hamden; CT-based Sacred Heart Academy appointed Kathryn Cioffi as Director of Technology.,Kathryn Cioffi has a bachelor's degree from Georgetown University and a master's degree from Fairfield University. She worked for the Diocese of Bridgeport Cathedral cluster schools; and most recently was with the Weston school system.,Sacred Heart Academy; founded by the Apostles of the Sacred Heart of Jesus in the Roman Catholic Tradition and committed to the expression of strong Christian values and intellectual growth; provides a challenging college preparatory education for young women.
Kathleen,McLean,Chief Information Officer,FairPoint Communications,Kathleen McLean was Appointed as Chief Information Officer at FairPoint Communications,Charlotte; NC-based FairPoint Communications appointed Kathleen McLean as Chief Information Officer.,Kathleen McLean was previously a senior vice president of Customer Service in Verizon Partner Solutions.,FairPoint Communications delivers modern communications technology with respect; commitment; and a can-do spirit.
Kathi,Mehall,Vice President of Technology,Urban Science,Kathi Mehall was Appointed as Vice President of Technology at Urban Science,Detroit; MI-based Urban Science appointed Kathi Mehall as Vice President of Technology.,Kathi Mehall was previously VP & CIO Corporate Services at GMAC.,Urban Science is a software leveraging consulting firm with primary (although not exclusive) applications in the automotive and financial services areas.
Kate,Taylor,Vice president; strategic planning - technology,The New York Times Company,Kate Taylor was Appointed as Vice president; strategic planning - technology at The New York Times Company,New York; NY-based The New York Times Company appointed Kate Taylor as Vice president; strategic planning - technology.,Kate Taylor was previously a consultant for companies such as Time Warner; Viacom; News Corporation and Sony. From 2005 to 2008; Ms. Taylor was a director in the strategy practice for Archstone Consulting; a strategy and operations firm based in Stamford; Conn. ,The New York Times Company; a leading media company with 2008 revenues of $2.9 billion; includes The New York Times; the International Herald Tribune; The Boston Globe; 15 other daily newspapers; WQXR-FM and more than 50 Web sites; including NYTimes.com; Boston.com and About.com. 
Kate,Jackson,Chief Technology Officer,Westinghouse Electric Corp,Kate Jackson was Appointed as Chief Technology Officer at Westinghouse Electric Corp,Monroeville; PA-based Westinghouse Electric Corp appointed Kate Jackson as Chief Technology Officer.,Kate Jackson was previously the vice president; strategy for Research & Technology; following 17 years at the Tennessee Valley Authority (TVA); where she held a number of executive roles involving leadership of key technology; research and environmental initiatives. ,Provides fuel; services; technology; plant design and equipment to utility customers and others in the worldwide commercial nuclear electric power industry.
Karen,Salem,Chief Information Officer,Ingram Micro Inc.,Karen Salem Resigned as Chief Information Officer at Ingram Micro Inc.,Santa Ana; CA-based Ingram Micro Inc. accepted resignation of Karen Salem as Chief Information Officer.,Karen Salem was previously the Senior vice president and chief information officer.,Ingram Micro Inc. is the worlds largest technology distributor and a leading technology sales; marketing and logistics company.
Karen,Robinson,Interim Chief Technology Officer,State of Texas,Karen Robinson was Appointed as Interim Chief Technology Officer at State of Texas,Austin; TX-based State of Texas appointed Karen Robinson as Interim Chief Technology Officer.,Karen Robinson was previously the director of administration and technology for Texas Gov. Rick Perry,Texas is the second-largest U.S. state by both area and population; and the largest state in the contiguous United States.
Karen,Robinson,Chief Information Officer,Department of Information Resources,Karen Robinson was Appointed as Chief Information Officer at Department of Information Resources,Austin; TX-based Department of Information Resources appointed Karen Robinson as Chief Information Officer.,Karen Robinson was previously serving as Gov. Rick Perry's technology adviser.,Department of Information Resources oversees and assists in managing the information resources assets of Texas State Government.
Karen,Renner,Chief Information Officer,Novelis,Karen Renner was Appointed as Chief Information Officer at Novelis,Atlanta; GA-based Novelis appointed Karen Renner as Chief Information Officer.,Karen Renner was previously with eneral Electric Company where she spent the last 18 years in progressively senior IT leadership roles including CIO of GE Energy Shared Services and CIO; GE Security. Most recently; Ms. Renner served as CIO; GE Digital Energy.,Novelis Inc. is the global leader in aluminum rolled products and aluminum can recycling. The Company operates in 11 countries; has approximately 11;600 employees and reported revenue of $8.7 billion in fiscal year 2010.
Karen,Kemerling,Vice President of Information Technology,Association of Operative Registered Nurses,Karen Kemerling was Appointed as Vice President of Information Technology at Association of Operative Registered Nurses,Denver; CO-based Association of Operative Registered Nurses appointed Karen Kemerling as Vice President of Information Technology.,Karen Kemerling was previously the VP- Information Technology at AAI Acquisition; Inc.,The Association of periOperative Registered Nurses (AORN) is the national association committed to improving patient safety in the surgical setting.
