First Name,Last Name,Title,Company Name,Headline,What Happened,About Person,About Company
Karen,Chamberlain,Chief Information Officer,The Hartford Financial Services Group,Karen Chamberlain was Appointed as Chief Information Officer at The Hartford Financial Services Group,Hartford; CT-based The Hartford Financial Services Group appointed Karen Chamberlain as Chief Information Officer.,Karen Chamberlain was previously the SVP/CTO Chase Insurance at JP Morgan Chase.,  The Hartford is a leading provider of life insurance; group and employee benefits; automobile and homeowners insurance and business insurance - as well as investment products; annuities; mutual funds; and college savings plans. 
Karen,Alber,Chief Information Officer,The H.J. Heinz Company,Karen Alber was Promoted to Chief Information Officer at The H.J. Heinz Company,Pittsburgh; PA-based The H.J. Heinz Company promoted Karen Alber to Chief Information Officer.,Karen Alber was previously Vice President Enterprise Systems Change Management at  PepsiCo  ,Heinz is a $10 billion global company; whose products enjoy #1 or #2 market share in more than 50 countries; sells 650 million bottles of its iconic Ketchup every year; with top 15 power brands account for more than two-thirds of its annual sales. Heinz employs approximately 32;500 people around the globe
Kadeer,Beg,Chief Technology Officer,Prolifics,Kadeer Beg was Promoted to Chief Technology Officer at Prolifics,New York; NY-based Prolifics promoted Kadeer Beg to Chief Technology Officer.,Kadeer Beg was previously SOA Specialist at Aetna.,One of the keys to our longevity is the solid relationships we have built with our partners and customers.
Juzer,Jangbarwala,Chief Technology Officer,R.G. Global Lifestyles; Inc.,Juzer Jangbarwala Resigned as Chief Technology Officer at R.G. Global Lifestyles; Inc.,Anaheim; CA-based R.G. Global Lifestyles; Inc. accepted resignation of Juzer Jangbarwala as Chief Technology Officer.,Juzer Jangbarwala was previously the Chairman of the Board of R.G. Global Lifestyles; Inc.,RG Global Lifestyles; Inc. develops and markets innovative technologies for water purification and wastewater treatment.
Junzo,Kawakami,Chief Technology Officer,Hitachi,Junzo Kawakami was Promoted to Chief Technology Officer at Hitachi,Brisbane; CA-based Hitachi promoted Junzo Kawakami to Chief Technology Officer.,Junzo Kawakami was previously the Executive Officer of Quality Assurance & Production Technology at Hitachi Ltd.,Hitachi; Ltd.; (NYSE: HIT / TSE: 6501) headquartered in Tokyo; Japan; is a leading global electronics company with approximately 390;000 employees worldwide.
Xiao,Jun,Chief Technology Officer,Northport Network Systems,Xiao Jun Resigned as Chief Technology Officer at Northport Network Systems,Seattle; WA-based Northport Network Systems accepted resignation of Xiao Jun as Chief Technology Officer.,Jun Xiao has been an employee of Northport Beigang since April 2004. He obtained a Masters degree in Multimedia and Virtual Reality in 2002 from Leuven Engineering College in Belgium and also holds a 1992 degree in Computer Science and Engineering from Huazhong University of Science and Technology. From 1996 to 1998 he was Vice Chief Engineer of the spaceflight group at Guangyu Group in Shenzhen; China. From 1998 until 2000 he was Vice General Manager of Beijing Yuanchao Information Technology Ltd. where he assisted in the development of China's first business image processing software. ,Northport Network Systems Inc. is a China based technology company which operates a series of highly diverse and opportunistic business divisions in Asia.
Julie,Olson,Chief Technology Officer,Mersana Therapeutics,Julie Olson became Chief Technology Officer at Mersana Therapeutics,Cambridge; MA-based Mersana Therapeutics appointed Julie Olson as Chief Technology Officer.,Julie Olson was previously the CEO of Mersana.,Mersana Therapeutics; Inc.; a cancer therapeutics company; develops oncology agents. Its product includes XMT-1001; a linkage to improve efficacy and safety relative to other products. 
