First Name,Last Name,Title,Company Name,Headline,What Happened,About Person,About Company
Gary,Czubak,Chief Technology Officer,Network Engineering Technologies,Gary Czubak was Appointed as Chief Technology Officer at Network Engineering Technologies,Middleton; WI-based Network Engineering Technologies appointed Gary Czubak as Chief Technology Officer.,Gary Czubak was previously the Vice President; Operations at BuySide; Inc.,NET provides a comprehensive suite of professional services from network design and engineering services to remote; onsite and logistical solutions.
Gary,Boyd,Vice President of Information Technology,Sterling Life Insurance,Gary Boyd was Appointed as Vice President of Information Technology at Sterling Life Insurance,Boise; ID-based Sterling Life Insurance appointed Gary Boyd as Vice President of Information Technology.,Gary Boyd was previously the Vice president  of IT to chief administrative officer at Sterling Life Insurance Company.,Established in 1958; Sterling Life Insurance Company is rated A- (Excellent) by A.M. Best; and is dedicated to providing a variety of affordable healthcare solutions to Medicare beneficiaries.
Scott,Arvidson,Chief Information Officer,Kansas City Southern,Scott Arvidson Resigned as Chief Information Officer at Kansas City Southern,Kansas City; MO-based Kansas City Southern accepted resignation of Scott Arvidson as Chief Information Officer.,Gary Arvidson was also EVP and Chief Operating Officer for the U.S. rail unit; Kansas City Southern Railway.,We honor and carry on the unique legacy of KCSits ambitious; entrepreneurial spirit and Can-Do attitude.
Garry,Mahoney,Chief Technology Officer,INTECSEA,Garry Mahoney was Appointed as Chief Technology Officer at INTECSEA,Houston; TX-based INTECSEA appointed Garry Mahoney as Chief Technology Officer.,Garry Mahoney was previously the Director in the ENI/Saipem group.,INTECSEA is a leading engineering and project management company serving the international oil and gas industry with over 800 employees and offices in Houston; Rio de Janeiro; London; Delft; Kuala Lumpur; Singapore; Perth; and Melbourne.
Ganesh,Sundaram,Vice President of Information Technology,Cambridge Nanotech Inc,Ganesh Sundaram was Promoted to Vice President of Information Technology at Cambridge Nanotech Inc,Cambridge; MA-based Cambridge Nanotech Inc promoted Ganesh Sundaram to Vice President of Information Technology.,Ganesh Sundaram was previously the Product Manager at Veeco Instruments.,Cambridge NanoTech delivers Atomic Layer Deposition (ALD) systems capable of depositing ultra-thin films that are used in a wide variety of research and industrial applications.
Ganesan,Ravishanker,Chief Information Officer,Pace University,Ganesan Ravishanker was Appointed as Chief Information Officer at Pace University,New York; NY-based Pace University appointed Ganesan Ravishanker as Chief Information Officer.,Ganesan Ravishanker was previously Associate VP for Information Technology Services at Wesleyan University.,Pace University is an educational institution that offers bachelors; masters; and doctoral degree courses in art; banking; biology; chemistry; economics; mathematics; business management; philosophy; and nursing.
Gabrielle,Wolfson,Chief Information Officer,Integra LifeSciences Holdings Corporation,Gabrielle Wolfson was Appointed as Chief Information Officer at Integra LifeSciences Holdings Corporation,Plainsboro; NJ-based Integra LifeSciences Holdings Corporation appointed Gabrielle Wolfson as Chief Information Officer.,Gabrielle Wolfson was previously the Vice President and Chief Information Officer at Par Pharmaceuticals (Par).,Integra LifeSciences Holdings Corporation; a world leader in regenerative medicine; is a global medical device company dedicated to improving the quality of life for millions of patients every year.
Martha,Morphy,Chief Information Officer,National Archives and Records Administration,Martha Morphy Retired as Chief Information Officer at National Archives and Records Administration,College Park; MD-based National Archives and Records Administration announced retirement of Martha Morphy as Chief Information Officer.,From 1998 until her appointment as Assistant Archivist for Information Services in 2006; Martha Morphy was a senior member of NARA's IT management team. ,The National Archives and Records Administration (NARA) is the nation's record keeper. Of all documents and materials created in the course of business conducted by the United States Federal government; only 1%-3% are so important for legal or historical reasons that they are kept by us forever. 
Fred,Tomczyk,Chief Executive Officer,TD Ameritrade Holding Corp.,Fred Tomczyk was Promoted to Chief Executive Officer at TD Ameritrade Holding Corp.,Omaha; NE-based TD Ameritrade Holding Corp. promoted Fred Tomczyk to Chief Executive Officer.,Fred Tomczyk was previously the Vice chair of corporate operations for TD Bank Group (TDBG).,TD AMERITRADE Holding Corporation; through its subsidiaries; provides securities brokerage services and technology-based financial services in the United States.
Fred,Salchli,Chief Information Officer,Duo Consulting,Fred Salchli was Appointed as Chief Information Officer at Duo Consulting,Chicago; IL-based Duo Consulting appointed Fred Salchli as Chief Information Officer.,Fred Salchi was previously the Senior Systems Engineer at SeatonCorp.,Duo Consulting helps accounting; architecture; financial; law and other professional service firms make the most of their online presence. 
Fred,Koller,Chief Technology Officer,Cyntellect,Fred Koller was Appointed as Chief Technology Officer at Cyntellect,San Diego; CA-based Cyntellect appointed Fred Koller as Chief Technology Officer.,Fred Koller was previously President & CEO at Cyntellect,Cyntellect is dedicated to setting new standards in cell analysis; purification; and processing technology.
Fred,Killeen,Chief Technology Officer,General Motors,Fred Killeen was Appointed as Chief Technology Officer at General Motors,Detroit; MI-based General Motors appointed Fred Killeen as Chief Technology Officer.,Fred Killeen was previously the Managing Consultant at Hewlett-Packard.,General Motors is the the world's #1 maker of cars and trucks; with brands such as Buick; Cadillac; Chevrolet; GMC; Pontiac; Saab; and Saturn. 
Fred,Barrett,Vice President of Information Systems,OnAsset Intelligence,Fred Barrett was Appointed as Vice President of Information Systems at OnAsset Intelligence,Irving; TX-based OnAsset Intelligence appointed Fred Barrett as Vice President of Information Systems.,Fred Barrett was previously the Founder; VP Product Development at RFTrax; Inc.,OnAsset Intelligence is a leading service provider of remote monitoring and freight intelligence solutions.
Fred,Appelman,Chief Technology Officer,Nedstat,Fred Appelman was Appointed as Chief Technology Officer at Nedstat,Reston; VA-based Nedstat appointed Fred Appelman as Chief Technology Officer.,Fred Appelman was previously the CTO of Nedstat,comScore; Inc. (NASDAQ: SCOR) is a global leader in measuring the digital world and preferred source of digital marketing intelligence. comScore helps its clients better understand; leverage and profit from the rapidly evolving digital marketing landscape by providing solutions in the measurement and evaluation of online audiences; advertising effectiveness; social media; search; video; mobile; e commerce ; and a broad variety of other emerging forms of digital behavior.
Franklin,Fasano,Chief Information Officer,National Cooperative Bank,Franklin Fasano was Promoted to Chief Information Officer at National Cooperative Bank,Washington; DC-based National Cooperative Bank promoted Franklin Fasano to Chief Information Officer.,Franklin Fasano was previously the Chief Technology Officer (CTO) for NCB.,NCB; FSB (NCB) enables cooperative endeavors to grow and succeed.
Frank,Powell,Chief Technology Officer,GLS Companies,Frank Powell was Appointed as Chief Technology Officer at GLS Companies,Minneapolis; MN-based GLS Companies appointed Frank Powell as Chief Technology Officer.,Frank Powell was previously President at Vis-Solutions,A full service commercial printer featuring digital prepress; printing and post press equipment.
Frank,LoMedico,Chief Information Officer,DST Retirement Solutions,Frank LoMedico was Appointed as Chief Information Officer at DST Retirement Solutions,Kansas City; MO-based DST Retirement Solutions appointed Frank LoMedico as Chief Information Officer.,Frank LoMedico was previously the Principal at Strategic Resolve LLC,DST Systems; Inc. provides sophisticated information processing and computer software services and products that help clients improve productivity; increase efficiency; and provide higher levels of customer service.
Frank,Kist,Chief Information Officer,QinetiQ North America,Frank Kist was Appointed as Chief Information Officer at QinetiQ North America,Arlington; VA-based QinetiQ North America appointed Frank Kist as Chief Information Officer.,Frank Kist was previously the CIO at SRA International; Inc.,An independent; innovative defense and security  technology solutions provider; QinetiQ North America's 50-year legacy of customer intimacy and proven performance continues in our globally honored technological capabilities and solutions.
Frank,Johnson,Chief Information Officer,Georgian Court University,Frank Johnson was Appointed as Chief Information Officer at Georgian Court University,Lakewood; NJ-based Georgian Court University appointed Frank Johnson as Chief Information Officer.,Frank Johnson was previously the network team leader and director of user services at Monmouth University.,Founded in 1908 and sponsored by the Sisters of Mercy; Georgian Court University is a comprehensive university with a strong liberal arts core and a special concern for women.
Frank,Baitman,Chief Information Officer,Social Security Administration,Frank Baitman was Appointed as Chief Information Officer at Social Security Administration,Windsor Mill; MD-based Social Security Administration appointed Frank Baitman as Chief Information Officer.,Frank Baitman was previously director of corporate strategy at IBM.,We deliver services through a nationwide network of over 1;400 offices that include regional offices; field offices; card centers; teleservice centers; processing centers; hearing offices; the Appeals Council; and our State and territorial partners; the Disability Determination Services.
Frank,Ambrose,Senior VP of Global Technology,Linden Lab,Frank Ambrose was Appointed as Senior VP of Global Technology at Linden Lab,San Francisco; CA-based Linden Lab appointed Frank Ambrose as Senior VP of Global Technology.,Frank Ambrose was previously the Sr. Vice President at America Online.,Linden Research; Inc. designs and develops a 3D online/3D/virtual world called Second Life or Second Life Grid.
Francis,Correra,Chief Information Officer,Pangea Media,Francis Correra was Appointed as Chief Information Officer at Pangea Media,Watertown; MA-based Pangea Media appointed Francis Correra as Chief Information Officer.,Francis Chip Correra was previously CTO at Spring Partners; a consumer software company.,Pangea Media is an online marketing company and the leading provider of quiz-based advertising solutions for advertisers and publishers.
Fran,Sullivan,Chief Information Officer,Wolters Kluwer,Fran Sullivan was Appointed as Chief Information Officer at Wolters Kluwer,Riverwoods; IL-based Wolters Kluwer appointed Fran Sullivan as Chief Information Officer.,Fran Sullivan was previously the Director of Engineering at Omgeo; LLC.,Wolters Kluwer is The Professional's First Choice for information; tools; and solutions that help professionals make their most critical decisions effectively and improve their productivity.
Andy,Fraley,Chief Technology Officer,Snap Retail,Andy Fraley was Appointed as Chief Technology Officer at Snap Retail,Pittsburgh; PA-based Snap Retail appointed Andy Fraley as Chief Technology Officer.,Fraley co founded CoManage with business partner Dave Nelsen and served as the Chief Technology Officer.,Snap Retail is a marketing technology company that creates social media and emarketing tools for independent retailers.
Christopher,Yates,senior vice president of platform and technology,Trion,Christopher Yates was Appointed as senior vice president of platform and technology at Trion,Greensboro; NC-based Trion appointed Christopher Yates as senior vice president of platform and technology.,Formerly CTO for Electronic Arts; Yates most recently spent seven years at Sony; where he led the development and operation of Sony's Network Platform; the infrastructure that supports PlayStation Network content.,Trion Worlds is the premier publisher and developer of connected video games.
Mike,Logan,Dean of Information Technology,Western Iowa Tech Community College.,Mike Logan was Appointed as Dean of Information Technology at Western Iowa Tech Community College.,Sioux City; IA-based Western Iowa Tech Community College. appointed Mike Logan as Dean of Information Technology.,For the past seven years; Logan was executive director; technology and information services for Northwest Iowa Community College; Sheldon. Earlier; he was director; technology services; for Terra Industries in Sioux City.,Western Iowa Tech Community College is located in Sioux City; Iowa and offers over 60 credit programs varying from Auto Body to Vet Assistant.
Andy,Morgan,Chief Technology Officer,Godengo,Andy Morgan was Appointed as Chief Technology Officer at Godengo,Emeryville; CA-based Godengo appointed Andy Morgan as Chief Technology Officer.,For five years; Andy Morgan has been with Internet Broadcasting (IB); an established player in the local-media services business; delivered via a SaaS model with a focus on hosting; operating; and managing websites for nearly 100 local media properties.,Godengo provides print and web publishers a strong online presence and networked advertising inventory; enabling them to more effectively compete online.  Godengo's Rivista content management system (CMS) is designed from the ground up for multiplying traffic volume; enhancing SEO; and increasing magazine publishers' web site profits. Typically; publications using Rivista see 2-3X web traffic increases after just six months. The Godengo Online Ad Network harnesses an affluent; upscale consumer audience that reads the premier city; regional; and lifestyle publications; providing advertisers national reach with deep expertise in local markets.  Please visit www.godengo.com.
Florian,Schattenmann,Chief Technology Officer,SulphCo,Florian Schattenmann was Appointed as Chief Technology Officer at SulphCo,Houston; TX-based SulphCo appointed Florian Schattenmann as Chief Technology Officer.,Florian Schattenmann was previously the Global Technology Manager at Momentive Performance Materials.,SulphCo; Inc.; headquartered in Houston; Texas; was founded in 1999.  The original patents relating to our technology resulted from the research efforts of several scientists at the University of Southern California.
Eyal,Pfeifel,Chief Technology Officer,Magic Software Enterprises,Eyal Pfeifel was Appointed as Chief Technology Officer at Magic Software Enterprises,Laguna Hills; CA-based Magic Software Enterprises appointed Eyal Pfeifel as Chief Technology Officer.,Eyal Pfeifel was previously VP Product Management at Ai Research and Technology.,Magic Software Enterprises Ltd. (NASDAQ: MGIC) is a provider of multiple-mode application platform solutions  including Full Client; Rich Internet Applications (RIA) or Software-as-a-Service (SaaS) deployment modes - and business and process integration solutions.
Vish,Nandlall,Chief Technology Officer,Extreme Networks,Vish Nandlall was Appointed as Chief Technology Officer at Extreme Networks,Santa Clara; CA-based Extreme Networks appointed Vish Nandlall as Chief Technology Officer.,Extreme Networks of Santa Clara; Calif.; founded in 1996; is a publicly listed company that designs; builds; and installs sophisticated Ethernet solutions that meet the toughest challenges in network connectivity and IP-based communications.,CTO Carrier Networks at Nortel Networks
Evon,Jones,Chief Information Officer,Liz Claiborne,Evon Jones was Appointed as Chief Information Officer at Liz Claiborne,New York; NY-based Liz Claiborne appointed Evon Jones as Chief Information Officer.,Evon Jones was previously with Bausch & Lomb as corporate vice president and chief information officer.,Liz Claiborne Inc. designs and markets a global portfolio of retail-based premium brands including Juicy Couture; Kate Spade; Lucky Brand Jeans and Mexx.
Erkan,Akyuz,Executive Vice President of Engineering,Vital Images,Erkan Akyuz was Appointed as Executive Vice President of Engineering at Vital Images,Hopkins; MN-based Vital Images appointed Erkan Akyuz as Executive Vice President of Engineering.,Erkan Akyuz was previously Professor at Conestoga College Institute of Technology and Advanced Learning.,Vital Images is the industry leader in advanced visualization for multi modal imaging in both radiology and cardiology.
Erich,Matola,Chief Information Officer,University of Wisconsin Platteville,Erich Matola was Appointed as Chief Information Officer at University of Wisconsin Platteville,Platteville; WI-based University of Wisconsin Platteville appointed Erich Matola as Chief Information Officer.,Erich Matola was previously position of chief information officer at Alliant International University in San Diego.,The University of Wisconsin-Platteville is an accredited; state university that was founded in 1866. Today; more than 6;000 students are enrolled on campus and another 3;000 in distance learning programs. As part of the University of Wisconsin System; you can earn your degree from one of the top public university systems in the world
Phil,Morris,Chief Technology Officer,Platform Computing,Phil Morris was Appointed as Chief Technology Officer at Platform Computing,Markham; ON-based Platform Computing appointed Phil Morris as Chief Technology Officer.,Erich Matola was previously chief information officer in public and private institutions of higher education.,The University of Wisconsin-Platteville is an accredited; state university that was founded in 1866. Today; more than 6;000 students are enrolled on campus and another 3;000 in distance learning programs. As part of the University of Wisconsin System; you can earn your degree from one of the top public university systems in the world.
Eric,Sundby,Vice President - Information Technology,Genuine Parts Company,Eric Sundby was Promoted to Vice President - Information Technology at Genuine Parts Company,Atlanta; GA-based Genuine Parts Company promoted Eric Sundby to Vice President - Information Technology.,Eric Sundby was previously Senior Director of Information Technology and has been with the Company eight years. ,Genuine Parts Company (GPC) is a service organization engaged in the distribution of automotive replacement parts; industrial replacement parts; office products and electrical/electronic materials. 
Eric,Rosenfeld,Chief Information Officer,Dr. First Corporation,Eric Rosenfeld was Appointed as Chief Information Officer at Dr. First Corporation,Rockville; MD-based Dr. First Corporation appointed Eric Rosenfeld as Chief Information Officer.,Eric Rosenfeld was previously Sr. Vice President of Information Systems / Onlife Health (was Gordian Health Solutions) at BlueCross BlueShield of Tennessee.,For over a decade; DrFirst has been a pioneer in the health IT industry; becoming the leader in standalone electronic prescribing (e-prescribing).
Eric,Rinn,Vice President of Information Technology,StarTex Power,Eric Rinn was Appointed as Vice President of Information Technology at StarTex Power,Houston; TX-based StarTex Power appointed Eric Rinn as Vice President of Information Technology.,Eric Rinn was previously Technology Leader at Spark Energy,StarTex Power was founded in 2004 by a team of deregulation experts with the idea of creating a product focused on exceptional customer service.
Eric,Peebles,Chief Technology Officer,Sofbang,Eric Peebles was Appointed as Chief Technology Officer at Sofbang,Burr Ridge; IL-based Sofbang appointed Eric Peebles as Chief Technology Officer.,Eric Peebles was previously the Chief Technology Officer at Blackwell Consulting Services.,Sofbang is a global professional services consulting firm. We help companies capture and master opportunities; created by and associated with change.
Eric,Lindgren,Chief Information Officer,PerkinElmer,Eric Lindgren was Appointed as Chief Information Officer at PerkinElmer,Waltham; MA-based PerkinElmer appointed Eric Lindgren as Chief Information Officer.,Eric Lindgren was previously the VP CIO at Honeywell ECC.,PerkinElmer; Inc. is a global leader focused on improving the health and safety of people and their environment.
Eric,Kammerzelt,Vice President of Technology,Cygnus Business Media,Eric Kammerzelt was Appointed as Vice President of Technology at Cygnus Business Media,Fort Atkinson; WI-based Cygnus Business Media appointed Eric Kammerzelt as Vice President of Technology.,Eric Kammerzelt has directed many of the company digital assets; most recently as the lead project manager behind the proprietary Base 2.0 system. He was named to the Folio 40 in March of this year.,Cygnus Business Media publishes 80 business to business media products including trade magazines; directories and cards; and produces 50 trade shows within 15 major markets.
Eric,Huynh,Chief Technology Officer,Social Gaming Network Inc.,Eric Huynh was Appointed as Chief Technology Officer at Social Gaming Network Inc.,Palo Alto; CA-based Social Gaming Network Inc. appointed Eric Huynh as Chief Technology Officer.,Eric Huynh was previously the CTO of Worldwide Studios for Vivendi Games Mobile.,SGN is the largest developer of social networking games and applications.
Eric,Foster,Vice President; Information Technology,Baxter International,Eric Foster was Appointed as Vice President; Information Technology at Baxter International,Deerfield; IL-based Baxter International appointed Eric Foster as Vice President; Information Technology.,Eric Foster was previously the CTO at Publicis Groupe.,  Baxter International Inc is a health care company which provides various products services and therapies for patients suffering from a wide range of complex medical conditions such as kidney diseases; cancer; trauma; hemophilia; immune disorders and many more. 
Eric,Feng,Chief Technology Officer,Hulu,Eric Feng Resigned as Chief Technology Officer at Hulu,Los Angeles; CA-based Hulu accepted resignation of Eric Feng as Chief Technology Officer.,Eric Feng was previously the Founder and General Manager at Mojiti ,Hulu.com is an online video service that offers hit TV shows including Family Guy and 30 Rock.
Eric,Burger,Chief Technology Officer,NeuStar,Eric Burger was Terminated as Chief Technology Officer at NeuStar,Sterling; VA-based NeuStar terminated Eric Burger as Chief Technology Officer.,Eric Burger was previously Vice Chair - Committee on Communications Policy at IEEE-USA ,NeuStar; Inc. (NYSE: NSR) is a provider of surveillance; clearinghouse; and directory services to the global communications and Internet industry.
Eric,Burger,Chief Technology Officer,NeuStar,Eric Burger was Appointed as Chief Technology Officer at NeuStar,Sterling; VA-based NeuStar appointed Eric Burger as Chief Technology Officer.,Eric Burger was previously the General manager of the Communications Products Division at BEA Systems; Inc.,NeuStar; Inc. (NYSE: NSR) solves complex communications challenges and provides market-leading; innovative solutions and directory services that enable trusted communication across networks; applications; and enterprises around the world. Visit us online at www.neustar.biz.
Eric,Barker,Chief Information Officer,LANtec,Eric Barker was Appointed as Chief Information Officer at LANtec,Baton Rouge; LA-based LANtec appointed Eric Barker as Chief Information Officer.,Eric Barker was previously an IT instructor.,LANtec provides computer training solutions to Louisiana's workforce with locations in Baton Rouge; Lafayette; and Lake Charles.
Enzo,Micali,Global Executive Vice President of Technology and ,Harris Interactive,Enzo Micali was Appointed as Global Executive Vice President of Technology and  at Harris Interactive,Rochester; NY-based Harris Interactive appointed Enzo Micali as Global Executive Vice President of Technology and .,"Enzo Micali was previously the EVP of Operations & Technology / CIO at TNS - ""Taylor; Nelson; Sofres"".",Harris Interactive is a professional services firm that serves clients in many industries and many countries.
Enis,Simsek,Chief Technology Officer,LifeYield,Enis Simsek was Appointed as Chief Technology Officer at LifeYield,Boston; MA-based LifeYield appointed Enis Simsek as Chief Technology Officer.,Enis Simsek was previously the Software Engineering Director & Assistant Vice President at AIR Worldwide.,LifeYield builds software solutions for financial advisors to increase their client's investment returns and income distributions.
Emma,Garrison-Alexander,Assistant Administrator for the Office of Informat,Transportation Security Administration,Emma Garrison-Alexander was Appointed as Assistant Administrator for the Office of Informat at Transportation Security Administration,Vienna; VA-based Transportation Security Administration appointed Emma Garrison-Alexander as Assistant Administrator for the Office of Informat.,Emma Garrison-Alexander was previously the Deputy for Counterterrorism for Signals Intelligence (SIGINT).,We are the Transportation Security Administration; formed immediately following the tragedies of Sept. 11.
