First Name,Last Name,Title,Company Name,Headline,What Happened,About Person,About Company
Jan,Uddenfeldt,Chief Technology Officer,Sony Ericsson,Jan Uddenfeldt was Promoted to Chief Technology Officer at Sony Ericsson,Research Triangle Park; NC-based Sony Ericsson promoted Jan Uddenfeldt to Chief Technology Officer.,Jan Uddenfeldt was previously a Senior Vice President at Sony Ericsson,Sony Ericsson; a 50:50 joint venture of Sony Corporation and Telefonaktiebolaget LM Ericsson; was established in October 2001. 
Jan,Marshall,Chief Information Officer,Southwest Airlines,Jan Marshall was Promoted to Chief Information Officer at Southwest Airlines,Dallas; TX-based Southwest Airlines promoted Jan Marshall to Chief Information Officer.,Jan Marshall was previously the Chief Development Officer at Southwest Airline.,Southwest Airlines Co. is a low fare airline hubbed in Dallas; Texas and the largest airline in the United States.
Jan,Bertsch,Chief Information Officer,Chrysler,Jan Bertsch was Appointed as Chief Information Officer at Chrysler,Auburn Hills; MI-based Chrysler appointed Jan Bertsch as Chief Information Officer.,Jan Bertsch was previously the Vice President and Chief Information Officer at Chrysler.,Chrysler LLC is an American automobile manufacturer headquartered in the Detroit suburb of Auburn Hills; Michigan; first organized as Chrysler Corporation in 1925.
Nassim,Jammal,Chief Technology Officer,Dogtek,Nassim Jammal was Appointed as Chief Technology Officer at Dogtek,Clearwater; FL-based Dogtek appointed Nassim Jammal as Chief Technology Officer.,Jammal; had most recently served since June 2008 as a project chief and senior engineer at Pertimm; a privately held technology company out of France where he was responsible for the complete integration of their semantic search engine for clients such as NASA; EADS; Meetic; and Pages Jaunes.,DOGTEK; state of the art electronic training collars; no-bark collars and electronic fencing systems. DOGTEK is 100% dedicated to bringing you industry leading; quality products along with exceptional customer service. 
Jamey,Pennington,Chief Information Officer,JPS Health Network,Jamey Pennington Resigned as Chief Information Officer at JPS Health Network,Fort Worth;; TX-based JPS Health Network accepted resignation of Jamey Pennington as Chief Information Officer.,Jamey Pennington was previously the AVP Information Systems / CIO at Blue Ridge HealthCare.,JPS Health Network is Tarrant Countys tax supported health care system. It has served the area for more than a century with the mission of improving the health status of the families and individuals in the communities they serve.
James,West,Chief Technology Officer,FARO Technologies,James West Resigned as Chief Technology Officer at FARO Technologies,Lake Mary; FL-based FARO Technologies accepted resignation of James West as Chief Technology Officer.,James West was previously the Vice President of Engineering and General Manager of Laser Division at FARO Technologies Inc.,With more than 20;000 installations and 10;000 customers globally; FARO Technologies; Inc. designs; develops; and markets portable; computerized measurement devices and software used to create digital models  or to perform evaluations against an existing model  for anything requiring highly detailed 3-D measurements; including part and assembly inspection; factory planning and asset documentation; as well as specialized applications ranging from surveying; recreating accident sites and crime scenes to digitally preserving historical sites.
James,Szmak,Chief Information Officer,The Juvenile Diabetes Research Foundation,James Szmak was Appointed as Chief Information Officer at The Juvenile Diabetes Research Foundation,New York; NY-based The Juvenile Diabetes Research Foundation appointed James Szmak as Chief Information Officer.,James Szmak was previously Director of the America's IT for California-based Cisco Systems; Inc.,Juvenile Diabetes Research Foundation International Inc. (JDRF) is a not-for-profit organization that focuses on juvenile diabetes cure research and development services. The organization offers grants for diabetes clinical trials to laboratories; educational institutions; and pharmaceutical and medical research companies
