First Name,Last Name,Title,Company Name,Headline,What Happened,About Person,About Company
Elizabeth,Hackenson,Chief Information Officer,AES Corporation,Elizabeth Hackenson was Appointed as Chief Information Officer at AES Corporation,Arlington; VA-based AES Corporation appointed Elizabeth Hackenson as Chief Information Officer.,Elizabeth Hackenson was previously Senior Vice President and CIO at Alcatel Lucent,The AES Corporation is a global power company with generation and distribution businesses.
Elizabeth,DelNegro,Chief Information Officer,Federal Acquisition Service (FAS); U.S. General Services Administration,Elizabeth DelNegro was Appointed as Chief Information Officer at Federal Acquisition Service (FAS); U.S. General Services Administration,Washington; DC-based Federal Acquisition Service (FAS); U.S. General Services Administration appointed Elizabeth DelNegro as Chief Information Officer.,Elizabeth DelNegro was previously the Acting Assistant Commissioner for the Office of Strategic Business Planning and Process Improvement (QP) of FAS., GSA provides financial; accounting; and administrative services for external customers.
Eli,Fogel,Chief Technology Officer,DSP Group,Eli Fogel Resigned as Chief Technology Officer at DSP Group,San Jose; CA-based DSP Group accepted resignation of Eli Fogel as Chief Technology Officer.,Eli Fogel joined us in July 2003 as Senior Vice President & Chief Technology Officer. Mr. Fogel served as Senior Vice President for Engineering & Chief Technology Officer at DSP Communication from 1996 to 1999 (later acquired by Intel). At Intel; Mr. Fogel served as the Chief Technology Officer of the Cellular Communication Division.,DSP Group; Inc. is a fabless semiconductor company; offering advanced chipset solutions for a variety of applications. DSP Group is a world leader in the short-range wireless communication market; enabling home networking convergence for voice; video and; data. 
Elaine,Bultemeier,Chief Technology Officer,Warsaw Community Schools,Elaine Bultemeier was Appointed as Chief Technology Officer at Warsaw Community Schools,Atwood; IN-based Warsaw Community Schools appointed Elaine Bultemeier as Chief Technology Officer.,Elaine Bultemeier was previously a technician at Warsaw Community Schools ,Warsaw Community Schools is a K-12 district located in Warsaw; Indiana.
Eisuke,Tsuyuzaki,Chief Technology Officer,Panasonic,Eisuke Tsuyuzaki was Appointed as Chief Technology Officer at Panasonic,Secaucus; NJ-based Panasonic appointed Eisuke Tsuyuzaki as Chief Technology Officer.,Eisuke Tsuyuzaki was previously the Managing director of Panasonic Hollywood Laboratory.,Panasonic Corporation is one of the largest electronic product manufacturers in the world; comprised of over 556 companies. It manufactures and markets a wide range of products under the Panasonic brand to enhance and enrich lifestyles all around the globe.
Edward,Fraga,Director of Information Services,Glendale City,Edward Fraga was Appointed as Director of Information Services at Glendale City,Glendale; CA-based Glendale City appointed Edward Fraga as Director of Information Services.,Edward Fraga was previously the Vice-President of Gartner Consulting.,Convenient to the greater Los Angeles region; Glendale is one of Southern Californias leading office markets featuring a wide range of properties; floor plans; and amenities.
Edward,Driesse,Chief Information Officer,Louisiana Governor's office,Edward Driesse was Appointed as Chief Information Officer at Louisiana Governor's office,Baton Rouge; LA-based Louisiana Governor's office appointed Edward Driesse as Chief Information Officer.,Edward Driesse was previously the chief information officer for AECOM Technology Corp.; a global design and management services company in Los Angeles; where he managed a budget of $50 million and a staff of 260.,State govenrment of Louisiana; a state located in the southern region of the United States of America. Its capital is Baton Rouge and largest city is New Orleans.
Edward,Christensen,vice president of information management,Monmouth University,Edward Christensen was Appointed as vice president of information management at Monmouth University,Long Branch; NJ-based Monmouth University appointed Edward Christensen as vice president of information management.,Edward Christensen is a faculty member at Monmouth University and was formerly associate dean of the Leon Hess Business School.,Monmouth University has a comprehensive general education curriculum and a life and career advising center. Located in West Long Branch.
Ed,Stalcup,Head IT Practice,RiskProNet,Ed Stalcup was Appointed as Head IT Practice at RiskProNet,Menlo Park; CA-based RiskProNet appointed Ed Stalcup as Head IT Practice.,Ed Stalcup was previously Vice President - chief information officer at Gateway Insurance Agency; Inc.,RiskProNet International is headquartered in Menlo Park; Calif.
Ed,Monfort,Chief Technology Officer,GT Legend Automotive Holdings,Ed Monfort was Appointed as Chief Technology Officer at GT Legend Automotive Holdings,Fullerton; CA-based GT Legend Automotive Holdings appointed Ed Monfort as Chief Technology Officer.,Ed Monfort previously patented a cryogenic thermal cycling technology for tempering metal; and built the Ronaele Mustang; the first high-performance electric car. ,0
Ed,Mitchell,Chief Technology Officer,Trade Wings,Ed Mitchell was Appointed as Chief Technology Officer at Trade Wings,Portsmouth; NH-based Trade Wings appointed Ed Mitchell as Chief Technology Officer.,Ed Mitchell was previously a partner at Cane Systems.,Trade Wings is a global Reuse Optimization? software; consulting and outsourcing partner to the largest Telecom manufacturers; carriers and operators.
Ed,Goddin,Chief Technology Officer,SharePoint360,Ed Goddin was Appointed as Chief Technology Officer at SharePoint360,Los Angeles; CA-based SharePoint360 appointed Ed Goddin as Chief Technology Officer.,Ed Goddin was previously the Vice president of Information Technology at Intuit.,SharePoint360 is a leading consulting and hosting provider based in San Diego; CA.
Ed,Crump,Vice President of Technology,BitGravity,Ed Crump was Appointed as Vice President of Technology at BitGravity,Burlingame; CA-based BitGravity appointed Ed Crump as Vice President of Technology.,Ed Crump was previously the VP of Technology at Tadpole Computing.,BitGravity has built the first global video delivery network optimized to deliver affordable; video on demand; live broadcasts; and interactive applications in standard and high-definition.
Ed,Boyd,Chief Technology Officer,Teknovus,Ed Boyd was Promoted to Chief Technology Officer at Teknovus,Petaluma; CA-based Teknovus promoted Ed Boyd to Chief Technology Officer.,Ed Boyd was previously the VP of Advanced Technology at Terawave Communications.,Teknovus; Inc.; a fabless semiconductor and software solutions company; develops and supplies Ethernet passive optical network (EPON) chipsets and embedded software for the fiber to the home market.
Dwight,Gibbs,senior vice president-technology,Input,Dwight Gibbs was Appointed as senior vice president-technology at Input,Reston; VA-based Input appointed Dwight Gibbs as senior vice president-technology.,Dwight Gibbs was previously the Chief technology officer for Legg Mason Capital Management.,INPUT is the authority on government business. Established in 1974; INPUT helps companies develop federal; state; and local government business and helps public sector organizations achieve their objectives.
Dwain,Wilcox,Chief Information Officer,Georgia Gulf Corporation,Dwain Wilcox was Appointed as Chief Information Officer at Georgia Gulf Corporation,Atlanta; GA-based Georgia Gulf Corporation appointed Dwain Wilcox as Chief Information Officer.,Dwain Wilcox was previously at CHEP; Millipore; and Serologicals Corporation where he oversaw several major technology transformations; acquisition integrations; and global ERP implementations. ,Georgia Gulf Corporation is a leading; integrated North American manufacturer of two chemical lines; chlorovinyls and aromatics; and manufactures vinyl-based building and home improvement products. 
Nick,Keefe,Vice President of Information Technology,Billy Casper Golf,Nick Keefe was Promoted to Vice President of Information Technology at Billy Casper Golf,Vienna; VA-based Billy Casper Golf promoted Nick Keefe to Vice President of Information Technology.,During his six years with BCG; most recently Director of IT; Keefe has pushed the firm to the cutting-edge of technology; including the most comprehensive customer data-capture and marketing platform in the golf industry. ,BCG directs all aspects of golf course and property maintenance; staffing and training; clubhouse operations; food-and-beverage; merchandising; golf instruction; marketing and public relations; special events and financial management.
Duncan,Roweth,Chief Technology Officer,Cray,Duncan Roweth was Appointed as Chief Technology Officer at Cray,Seattle; WA-based Cray appointed Duncan Roweth as Chief Technology Officer.,Duncan Roweth was previously the Head of Software Research and Development at Quadrics Senior Software Engineer at Meiko.,A global leader in supercomputing; Cray provides innovative systems that enable scientists and engineers in government; industry and academia to meet both existing and future computational challenges.
Du,Nguyen,Vice Persident of Information Technology,SouthWest Water Company,Du Nguyen was Promoted to Vice Persident of Information Technology at SouthWest Water Company,Los Angeles; CA-based SouthWest Water Company promoted Du Nguyen to Vice Persident of Information Technology.,Du Nguyen was previously Director; Enterprise Financial Systems at  Calpine Corp  ,SouthWest Water Company provides a broad range of operations; maintenance and management services; including water production; treatment and distribution; wastewater collection and treatment; customer service; and utility infrastructure construction management. 
Carole,Teolis,Chief Technology Officer,TRX Systems Hires Carol Politi As CEO,Carole Teolis was Appointed as Chief Technology Officer at TRX Systems Hires Carol Politi As CEO,Greenbelt; MD-based TRX Systems Hires Carol Politi As CEO appointed Carole Teolis as Chief Technology Officer.,Dr. Teolis has over 15 years experience in technical management and is an expert in signal processing and control systems design. Dr. Teolis is responsible for the long term vision and technical direction of TRX and she oversees all research and development activities including the team developing the TRX Sentinel Tracking System. Dr. Teolis has also secured over $6 Million in funding for TRX GPS denied tracking system development; secured a TRX beta contract with the Maryland Fire and Rescue Institute; and secured a TSWG commercialization contract.,TRX Systems Inc. develops precise; infrastructure-free location and tracking products that deliver real-time 3D location and status of personnel  in environments without GPS coverage. TRX products are the first to deliver the precision required to improve situational awareness and safety for first responders; dismounted soldiers; and security personnel (including those inspecting for radiation; chemical; and other threats); and to effectively support personnel training applications. TRX Navigation Engine software can easily be integrated with partner sensors; communication systems; and situation awareness systems that require GPS-denied location capabilities. For more information visit www.trxsystems.com.
Changwan,Son,Director of Technology,Solar3D,Changwan Son was Appointed as Director of Technology at Solar3D,Santa Barbara; CA-based Solar3D appointed Changwan Son as Director of Technology.,Dr. Son is an internationally published and recognized expert in the field of photonics and optoelectronic devices. ,Solar3D; Inc. is developing a breakthrough 3-dimensional solar cell technology to maximize the conversion of sunlight into electricity.
Skott,Ahn,Chief Technology Officer,LG Electronics,Skott Ahn became Chief Technology Officer at LG Electronics,Englewood Cliffs; NJ-based LG Electronics appointed Skott Ahn as Chief Technology Officer.,Dr. Skott Ahn; formerly President and CEO of LG's MC Company; will take over the role of Chief Technology Officer (CTO) while Dr. Woo Paik; the outgoing CTO; takes on a newly-created role at LG responsible for identifying and developing new business aligned with technology.,LG Electronics; Inc. (LG) is a global leader and technology innovator in consumer electronics; home appliances and mobile communications; employing more than 82;000 people working in over 110 operations including 81 subsidiaries around the world. 
Tom,Rosenmayer,Vice President of Technology,Lehigh Technologies,Tom Rosenmayer was Appointed as Vice President of Technology at Lehigh Technologies,Naples; FL-based Lehigh Technologies appointed Tom Rosenmayer as Vice President of Technology.,Dr. Rosenmayer; vice president of technology; has over 20 years of experience at both large and small companies; including Baker-Hughes; IBM; W.L. Gore & Associates and Shamrock Technologies. He has a diverse background in technology; marketing and general management; including a five year international assignment in Germany. Rosenmayer is a member of the PDMA (Product Development and Management Association) and co-author on numerous technical publications and patents. He earned his PhD in Materials Science from Rice University where he is a member of the Rice Alliance for Technology and Entrepreneurship.,Lehigh Technologies is a leading green materials manufacturer that turns end-of-life tire materials and other rubber products into sustainable powders that can be used in a wide range of industrial and consumer applications.
Martin,Moskovits,Chief Technology Officer,API Technologies,Martin Moskovits Resigned as Chief Technology Officer at API Technologies,Ronkonkoma; NY-based API Technologies accepted resignation of Martin Moskovits as Chief Technology Officer.,Dr. Martin Moskovits has resigned as Chief Technology Officer.,API Technologies Corp. is a leading supplier of highly engineered products and solutions; components and subsystems to top manufacturers; major government contractors; international government and military organizations; and Fortune 500 companies.
Tom,Jarvi,Chief Technology Officer,Sun Catalytix Corporation,Tom Jarvi was Appointed as Chief Technology Officer at Sun Catalytix Corporation,Cambridge; MA-based Sun Catalytix Corporation appointed Tom Jarvi as Chief Technology Officer.,Dr. Jarvi received his Ph.D. and B.S. degrees in chemical engineering from the University of Washington and the University of Illinois; respectively. He has published thirteen papers in electrochemistry and fuel cells; and he is co-inventor on ten issued or pending patents.,Sun Catalytix is a seed-stage start-up spun out of MIT to commercialize recent water-splitting discoveries coming out of the labs of MIT Chemistry Professor Daniel Nocera.
Alex,Levran,Chief Technology Officer,Power One,Alex Levran Resigned as Chief Technology Officer at Power One,Camarillo; CA-based Power One accepted resignation of Alex Levran as Chief Technology Officer.,Dr. Alex Levran; formerly Chief Technology Officer (CTO) for Power-One; will assume the role of President; Renewable Energy Solutions. Dr. Levran has worked in the power conversion industry for nearly four decades; with more than a decade of experience in the solar and wind industries. Dr. Levran directed the development of Power-One's industry leading solar and wind inverters since joining the company in 2007.,Power-One; Inc. (Nasdaq:PWER); a leading provider of renewable energy and energy-efficient power conversion and power management solutions
Doyal,Alexander,Chief Technology Officer,RenewData,Doyal Alexander was Appointed as Chief Technology Officer at RenewData,Austin; TX-based RenewData appointed Doyal Alexander as Chief Technology Officer.,Doyal Alexander was previously the Sr Director - Application & Systems Development at Securus Technologies.,RenewData is a trusted provider of services for the discovery; archiving; and governance of electronically stored information (ESI) to help organizations proactively manage the inherent risks associated with ESI.
Douglas,Schmidt,Chief Technology Officer,Carnegie Mellon Software Engineering Institute,Douglas Schmidt was Appointed as Chief Technology Officer at Carnegie Mellon Software Engineering Institute,Pittsburg; PA-based Carnegie Mellon Software Engineering Institute appointed Douglas Schmidt as Chief Technology Officer.,Douglas Schmidt was a deputy office director and a program manager at the Defense Advanced Research Projects Agency (DARPA); where he led the national research and development effort on middleware for distributed real-time and embedded (DRE) systems. ,The Carnegie Mellon Software Engineering Institute (SEI) works closely with defense and government organizations; industry; and academia to continually improve software-intensive systems. 
Douglas,Hungerford,Chief Technology Officer,Fuel Doctor USA,Douglas Hungerford was Appointed as Chief Technology Officer at Fuel Doctor USA,Calabasas; CA-based Fuel Doctor USA appointed Douglas Hungerford as Chief Technology Officer.,Douglas Hungerford previously worked in a variety of capacities including Electronics Technician; Electrical Engineer; Project Engineer; and Systems Engineer. ,Fuel Doctor's FD-47 is the Fuel Efficiency Booster.The FD-47 increases a vehicle's miles per gallon (MPG) through power conditioning of the vehicle's electrical systems. 
Doug,Tracy,Chief Information Officer,Dana Holding,Doug Tracy was Appointed as Chief Information Officer at Dana Holding,Maumee; OH-based Dana Holding appointed Doug Tracy as Chief Information Officer.,Doug Tracy was previously the EVP of IT (North America) at Rolls-Royce.,Dana designs; engineers and manufactures value-added products and systems for automotive; commercial; and off-highway vehicles. Dana can create flexible solutions that fit any vehicle design. 
Doug,Rommel,Chief Information Officer,American Greetings Corporation,Doug Rommel was Appointed as Chief Information Officer at American Greetings Corporation,Cleveland; OH-based American Greetings Corporation appointed Doug Rommel as Chief Information Officer.,Doug Rommel was previously the Vice President; Information Services at American Greetings.,  American Greetings Corporation is a leading manufacturer of innovative social expression products that assist consumers in enhancing their relationships.
Doug,Ring,Chief Technology Officer,Peopleclick Authoria,Doug Ring was Appointed as Chief Technology Officer at Peopleclick Authoria,Raleigh; NC-based Peopleclick Authoria appointed Doug Ring as Chief Technology Officer.,Doug Ring was previously the CTO of Geac.,Peopleclick Authoria is transforming Talent Management through best-of-breed technology and expertise. 
Doug,Paradis,Chief Technology Officer,Anexinet Corp.,Doug Paradis was Appointed as Chief Technology Officer at Anexinet Corp.,Philadelphia; PA-based Anexinet Corp. appointed Doug Paradis as Chief Technology Officer.,Doug Paradis was previously the CTO & VP of Operations at Strategic Radar.,At Anexinet; we stand true to our founding mission of more than a decade: To deliver real value by integrating useful technology in a timely manner at a fair price.
Doug,Lingrel,Chief Information Officer,Greif,Doug Lingrel was Appointed as Chief Information Officer at Greif,Delaware; OH-based Greif appointed Doug Lingrel as Chief Information Officer.,Doug Lingrel previously held various technology positions in manufacturing companies.,Greif (NYSE:GEF; GEF.B) is a world leader in industrial packaging products and services. 
Doug,Horner,Chief Technology Officer,Medical Informatics Engineering,Doug Horner was Appointed as Chief Technology Officer at Medical Informatics Engineering,Fort Wayne; IN-based Medical Informatics Engineering appointed Doug Horner as Chief Technology Officer.,Doug has nearly two decades of software industry experience; building expertise in systems; networks; and management.,Founded in 1995; MIE has developed the WebChart EHR portfolio; a minimally invasive EHR which operates on any web browser or mobile device; including iPads or Smartphones. 
Andrew,Doty,Chief Information Officer,City of Springfield,Andrew Doty was Promoted to Chief Information Officer at City of Springfield,Springfield; MA-based City of Springfield promoted Andrew Doty to Chief Information Officer.,Doty has 20 years of combined experience as a computer programmer; mainframe operator; fiber optic; systems development; telecommunications; infrastructure design and project management. He was employed as the city's chief technology officer since 2005; and previously served as systems development specialist for the Fire Department among other positions in the public and private sectors.,Springfield is the largest city on the Connecticut River and the county seat of Hampden County; Massachusetts; United States.[2] In the 2000 census; the city population was 154;082 with an estimated 2008 population of 150;640.[1] It is the third largest city in Massachusetts and fourth largest in New England (behind Boston; Worcester and Providence).
Donald,Wright,Senior Vice President,AssureRx Health,Donald Wright was Promoted to Senior Vice President at AssureRx Health,Mason; OH-based AssureRx Health promoted Donald Wright to Senior Vice President.,Donald Wright was previously the TO and founder of SaaS Capital; a finance company specializing in the SaaS software industry; as the CIO and vice president of products for Domin-8 Enterprise Solutions; as the CTO for Spotlight Solutions; a leading provider of retail pricing and revenue optimization software through its purchase by Oracle.,AssureRx Health is a personalized medicine company specializing in pharmacogenetic products to help physicians select the right drug and right dose for psychiatric patients
Donald,Newell,Chief Technology Officer,AMD,Donald Newell was Appointed as Chief Technology Officer at AMD,Sunnyvale; CA-based AMD appointed Donald Newell as Chief Technology Officer.,Donald Newel was previously with Intel for 16 years; leading development of both SoC and server platform architecture innovations for areas ranging from cloud computing to hand-held devices,Advanced Micro Devices (NYSE: AMD) is an innovative technology company dedicated to collaborating with customers and technology partners to ignite the next generation of computing and graphics solutions at work; home and play.
Donald,Imholz,Chief Information Officer,Centene Corporation,Donald Imholz was Appointed as Chief Information Officer at Centene Corporation,Saint Louis; MO-based Centene Corporation appointed Donald Imholz as Chief Information Officer.,Donald Imholz was previously Vice President of Information Technology at Boeing Company.,Centene Corporation is a leading multi-line healthcare enterprise that provides programs and related services to individuals receiving benefits under Medicaid; including the State Children's Health Insurance Program (SCHIP); as well as Aged; Blind; or Disabled (ABD); Foster Care; Long-Term Care and Medicare (Special Needs Plans).
Donald,Hopkins,Chief Information Officer,Sungard Data Systems Inc. (Availability Services Unit),Donald Hopkins was Appointed as Chief Information Officer at Sungard Data Systems Inc. (Availability Services Unit),Wayne; PA-based Sungard Data Systems Inc. (Availability Services Unit) appointed Donald Hopkins as Chief Information Officer.,Donald Hopkins was previously at NCR on several technology positions.,SunGard is one of the world's leading software and technology services companies.
Donald,Ferguson,Chief Technology Officer,CA,Donald Ferguson was Appointed as Chief Technology Officer at CA,Islandia; NY-based CA appointed Donald Ferguson as Chief Technology Officer.,Donald Ferguson was previously at Microsoft in the Office of the CTO.,CA Technologies is an IT management software and solutions company with expertise across all IT environmentsfrom mainframe and physical to virtual and cloud. CA Technologies manages and secures IT environments; enabling our customers to deliver more flexible IT services.
Donald,Courtney,President; E-commerce,Finish Line,Donald Courtney was Promoted to President; E-commerce at Finish Line,Indianapolis; IN-based Finish Line promoted Donald Courtney to President; E-commerce.,Donald Courtney was previously Chief Information Officer/Executive Vice President of Information Systems and Distribution.,he Finish Line; Inc.; together with its subsidiaries; operates as a mall-based specialty retailer in the United States.
Don,Young,Chief Information Officer,Protection One,Don Young was Appointed as Chief Information Officer at Protection One,Wichita; KS-based Protection One appointed Don Young as Chief Information Officer.,Don Young most recently was the chief information officer for Stanley Convergent Solutions.,Protection One offers customized home security systems; business security systems; alarm systems; a free security evaluation; and expert safety advice
Donald,Versen,Chief Technology Officer,CIMCO Communications,Donald Versen was Appointed as Chief Technology Officer at CIMCO Communications,Oakbrook Terrace; IL-based CIMCO Communications appointed Donald Versen as Chief Technology Officer.,Don Versen was previously the Sr Director; Professional and Managed Services Product Managment at Sun Microsystems.,CIMCO Communications has been providing advanced technology solutions to businesses in the Chicago area for over 24 years.
