First Name,Last Name,Title,Company Name,Headline,What Happened,About Person,About Company
Priscilla ,Guthrie,Chief Information Officer,Office of the Director of National Intelligence,Priscilla  Guthrie Resigned as Chief Information Officer at Office of the Director of National Intelligence,Itasca; IL-based Office of the Director of National Intelligence accepted resignation of Priscilla  Guthrie as Chief Information Officer.,Priscilla Guthrie has been CIO since May 2009,The Director of National Intelligence (DNI) serves as the head of the Intelligence Community (IC); overseeing and directing the implementation of the National Intelligence Program and acting as the principal advisor to the President; the National Security Council; and the Homeland Security Council for intelligence matters related to the national security. 
Martin,Davis,Executive Vice President; Technology and Operations Group,Wells Fargo,Martin Davis was Appointed as Executive Vice President; Technology and Operations Group at Wells Fargo,San Francisco; CA-based Wells Fargo appointed Martin Davis as Executive Vice President; Technology and Operations Group.,Prior to Wachovia’s acquisition by Wells Fargo; Martin Davis served as Wachovia’s Corporate CIO., Wells Fargo & Co. (NYSE: WFC) is a diversified financial services company in the United States with operations around the world. Wells Fargo is the 4th largest bank in the US by assets and the 3rd largest bank by market cap.
Jan,Sevcik,Chief Information Officer,InnerWorkings,Jan Sevcik Resigned as Chief Information Officer at InnerWorkings,Chicago; IL-based InnerWorkings accepted resignation of Jan Sevcik as Chief Information Officer.,Prior to the CiO poistion; Jan Sevcik was a Senior Vice President of Technology & E-Commerce at InnerWorkings Inc. from July 2007 to January 2009. ,InnerWorkings is a leading global provider of managed print and promotional solutions. 
John,Running,Senior Vice President; Director of Technology,MRM Worldwide,John Running became Senior Vice President; Director of Technology at MRM Worldwide,New York; NY-based MRM Worldwide appointed John Running as Senior Vice President; Director of Technology.,Prior to taking the lead of MRM's Technology and Quality Assurance teams; John Running was CTO and founder of 1/0 Technology Corp; leading their team of technologists. During his tenure at 1/0 John helped drive five successive years of business growth. An expert in designing and developing leading technology solutions for B2C and B2B brands; John was responsible for developing; launching and maintaining Web sites and Web applications for a number of high profile clients including Scripps Networks; The Special Olympics; and Miraval Resorts; among others. ,MRM Worldwide is a top-five digital and direct agency that builds Customer Utility-a measure of content and context in the service of the brand--to attract; engage; acquire and retain customers and business decision makers; resulting in greater return on marketing investment for our clients.
Justin,Oesterle,Chief Information Officer,RouteOne,Justin Oesterle was Promoted to Chief Information Officer at RouteOne,Farmington Hills; MI-based RouteOne promoted Justin Oesterle to Chief Information Officer.,Prior to RouteOne Justin Oesterle was a Senior Manager with Deloitte Consulting and prior to that he was with Syntel Inc. Just received his BA and MBA at the University of Michigan,RouteOne was formed in 2002 by Chrysler Financial; Ford Motor Credit Company; GMAC; and Toyota Financial Services to create a more streamlined credit application for automobile dealers and their customers. Providing access to more than 21;500 dealers in North America; RouteOne's web-based system allows automotive dealers to submit credit applications to the largest indirect lenders; request credit reports; and increase profitability with RouteOne's free Dealer Reporting Suite. RouteOne's open integration business model also allows the dealer to integrate with their choice of a wide variety of best in class providers; including DSPs; CRM systems; F&I modules and menu providers. RouteOne offers dealers a common platform for all their credit application financing needs. More information is available at www.routeone.com.
Brian,Magnotta,Chief Technology Officer,Ziff Davis Enterprise,Brian Magnotta was Appointed as Chief Technology Officer at Ziff Davis Enterprise,New York; NY-based Ziff Davis Enterprise appointed Brian Magnotta as Chief Technology Officer.,Prior to joining Ziff Davis; Magnotta spent seven years at Reed Business Information as their Chief Technology Officer and as a member of their US executive team. ,Ziff Davis Enterprise; Inc. is B2B technology's trusted information resource. Millions of technology buyers rely on our brands  including eWEEK; Baseline; CIO Insight; Channel Insider; WebBuyersGuide.com; TechDirect; and the Developer Shed network  for relevant; objective content to identify the right solutions for their organizations. 
Bill  ,McCorey ,Chief Information Office,Universal Orlando ,Bill   McCorey  was Appointed as Chief Information Office at Universal Orlando ,Orlando ; AL-based Universal Orlando  appointed Bill   McCorey  as Chief Information Office.,Prior to joining Universal; McCorey has served as vice president of global IT infrastructure for IBM Corp.; and various positions with Circuit City including company CIO.,Universal Orlando Resort has created some of the world’s most innovative theme park attractions based on pop culture’s most compelling films and stories.   
Arthur,Reardon,Chief Technology Officer,Universal Stainless & Alloy Products Inc.,Arthur Reardon was Appointed as Chief Technology Officer at Universal Stainless & Alloy Products Inc.,Bridgeville; PA-based Universal Stainless & Alloy Products Inc. appointed Arthur Reardon as Chief Technology Officer.,Prior to joining Universal Stainless (Nasdaq: USAP); Reardon was director of technology R&D for Newell-Rubbermaid Corp. ,Universal Stainless is based in Bridgeville and makes semi-finished and finished specialty steels.
David,Jones,Vice President of Information Technology,TTI Exploration,David Jones was Appointed as Vice President of Information Technology at TTI Exploration,Houston; TX-based TTI Exploration appointed David Jones as Vice President of Information Technology.,Prior to joining TTI Exploration; Jones was Chief Architect for Crescent Enterprise Solutions. His experience includes IT infrastructure and optimization; enterprise solutions; and cloud computing. Prior to Crescent Enterprise Solutions; he was with MSC Software as Vice President; Enterprise Solutions and Services.,TTI Exploration; Inc. is a technology-driven exploration company that develops proprietary technologies and methodologies which enable customers and partners to more rapidly; cost-effectively and accurately explore for natural resources; while minimizing the environmental impact; risk and cycle-time.  The company has combined new data acquisition; processing and interpretation technologies and methodologies into a fully integrated exploration system; which is being successfully deployed in regions of North America and soon South America.  
Peter,Engel,Chief Technology Officer,Marcus Corporation,Peter Engel was Promoted to Chief Technology Officer at Marcus Corporation,Milwaukee; WI-based Marcus Corporation promoted Peter Engel to Chief Technology Officer.,Prior to joining The Marcus Corporation; Peter Engel served as president of Aperias Management Services; a consulting firm specializing in information technology and strategic management consulting services. ,Headquartered in Milwaukee; Wis.; The Marcus Corporation is a leader in the lodging and entertainment industries. Marcus Theatres is the seventh largest theatre circuit in the U.S.; with locations in major markets in the Midwest. 
Gary,Cantrell,Chief Information Officer,Textron,Gary Cantrell was Appointed as Chief Information Officer at Textron,Providence; RI-based Textron appointed Gary Cantrell as Chief Information Officer.,Prior to joining Textron; Gary Cantrell held senior-level roles with Bank of America as Senior Vice President; Enterprise Access and Technology Services,Textron Inc. is a multi-industry company that leverages its global network of aircraft; defense; industrial and finance businesses to provide customers with innovative solutions and services. Textron is known around the world for its powerful brands such as Bell Helicopter; Cessna Aircraft Company; Jacobsen; Kautex; Lycoming; E-Z-GO; Greenlee; and Textron Systems
Adan,Pope,Chief Technology Officer,Telcordia,Adan Pope became Chief Technology Officer at Telcordia,Piscataway; NJ-based Telcordia appointed Adan Pope as Chief Technology Officer.,Prior to joining Telcordia; Mr. Pope was CTO (Americas) and Vice President at Cramer.,Telcordia Technologies; formerly Bell Communications Research; Inc. (Bellcore); is the industrys go to expert for solving the most complex communications challenges.
Chris,Reigrut,Chief Technology Officer,SquareTwo Financial,Chris Reigrut was Appointed as Chief Technology Officer at SquareTwo Financial,Denver; CO-based SquareTwo Financial appointed Chris Reigrut as Chief Technology Officer.,Prior to joining SquareTwo Financial; Chris Reigrut was a consultant with Teravation; designing and building software to help countries control the spread of malaria and dengue fever in Africa.,SquareTwo Financial is a leader in the $40 billion asset recovery and management industry.
Amnon,Lotem,Chief Technology Officer,Skybox Security,Amnon Lotem was Appointed as Chief Technology Officer at Skybox Security,San Jose; CA-based Skybox Security appointed Amnon Lotem as Chief Technology Officer.,Prior to joining Skybox Security; Dr. Lotem was co founder of Estimotion Ltd. He also held R&D management positions at Amdocs and Technomatix Technologies. ,Skybox Security; Inc. is the leader in automated security risk and compliance management solutions; helping IT organizations pinpoint and prioritize security risks; compliance; and availability exposures within minutes.
Karthik,Ganesh,Chief Information Officer,QualCare,Karthik Ganesh was Appointed as Chief Information Officer at QualCare,Piscataway; NJ-based QualCare appointed Karthik Ganesh as Chief Information Officer.,Prior to joining QualCare; Karthik served as head of business technology at Aetna in Hartford; Ct.,QualCare; Inc. is the largest full service; provider-sponsored managed care organization owned and operated in the State of New Jersey. It is majority owned by 14 New Jersey hospital systems and physician organizations; and have more than 750;000 members currently enrolled in a full range of self-funded managed care products.
William,Baxter,Vice President of Technology,Proclivity Systems,William Baxter was Appointed as Vice President of Technology at Proclivity Systems,New York; NY-based Proclivity Systems appointed William Baxter as Vice President of Technology.,Prior to joining Proclivity Systems; Baxter served as Managing Member at FocusDB; a provider of non-relational database systems for high-speed querying of event data. In his role as Vice President of Technology for CheetahMail; trusted service provider of email marketing and customer intelligence technologies for top enterprises worldwide; Baxter played a pivotal role in taking the company from its beginning phases to sale; developing the company?s core infrastructure; as well as internal technology that led directly to CheetahMail?s second generation product,Proclivity enables online retailers to execute revenue-generating; direct marketing campaigns based on their customer's individual valuations and forecasted willingness to buy. Proclivity accomplishes this by gathering all of a retailer's consumer data into its unique Consumer Behavior Bank; scoring each consumer and generating individual valuations by product. Marketers can use this information to easily create and launch highly targeted campaigns through the consumer's preferred channels; with success metrics in excess of 20% revenue lift and 300% ROI. The Proclivity platform also helps retailers retain existing customers and acquire new ones. For more information; visit www.ProclivitySystems.com.
Wayne,Sadin,Chief Information Officer,Mxenergy,Wayne Sadin was Appointed as Chief Information Officer at Mxenergy,Stamford; CT-based Mxenergy appointed Wayne Sadin as Chief Information Officer.,Prior to joining MXenergy; Sadin held positions as SVP and CIO at Loomis Armored US; EVP and CIO at Aegis Mortgage Company; and SVP and CTO at Fifth Third Bank.,MXenergy Inc. is an independent provider of natural gas and electricity in North America
Martin  ,Adams ,Director of Technology ,HyperSolar,Martin   Adams  was Appointed as Director of Technology  at HyperSolar,Santa Barbara ; AL-based HyperSolar appointed Martin   Adams  as Director of Technology .,Prior to joining HyperSolar; Mr. Adams enjoyed a long career in the automotive industry developing innovative lighting elements and systems for Delphi Corporation and Trialon Corporation. ,HyperSolar is developing a breakthrough technology to magnify the power of the Sun to significantly increase the power output of solar cells. Based on innovative microphotonics and low cost manufacturing processes; HyperSolar is developing a thin; flat; optical layer that can inexpensively collect and deliver substantially more sunlight onto solar cells. 
Scott,Gerson,Chief Information Officer,Harsco,Scott Gerson Resigned as Chief Information Officer at Harsco,Camp Hill; PA-based Harsco accepted resignation of Scott Gerson as Chief Information Officer.,Prior to joining Harsco in 2005; Mr. Gerson was with Kulicke & Soffa Industries; Inc.; a manufacturer of semiconductor assembly and test equipment; where he most recently served as IT director of their worldwide application services. He has also served in IT management capacities with Compaq Computers and TRW Inc.,Harsco Corporation provides essential services and equipment to key industries that play a fundamental role in worldwide economic growth; including infrastructure; metals; railways and energy. Harsco's common stock is a component of the S&P MidCap 400 Index and the Russell 1000 Index. Additional information can be found at www.harsco.com.
Ted,Hengst,Chief Information Officer,Harris Corporation,Ted Hengst was Appointed as Chief Information Officer at Harris Corporation,Melbourne; FL-based Harris Corporation appointed Ted Hengst as Chief Information Officer.,Prior to joining Harris; Hengst served as a senior vice president for General Dynamics.  Previously; he served in the U.S. Army; retiring at the rank of Colonel.,Harris is an international communications and information technology company serving government and commercial markets in more than 150 countries. 
Clive  ,Winkler ,Chief Information Officer,FreeWave Technologies,Clive   Winkler  was Appointed as Chief Information Officer at FreeWave Technologies,Boulder; CO-based FreeWave Technologies appointed Clive   Winkler  as Chief Information Officer.,Prior to joining FreeWave; Winkler worked with Cubic Defense Applications in San Diego; Calif.; where he held the position of vice president; advanced development. During his time with the company; he introduced the adaptation of commercial technology; in both chips and waveforms; for military applications. He also managed product development programs that worked with advanced receivers; transmitters and co-site mitigation systems. Winkler studied electrical engineering and physics at the University of Adelaide in Australia and holds a doctorate in applied mathematics from The Australian National University. ,Founded in 1993; FreeWave Technologies manufactures the most reliable; high performing; lowest power consumption; spread spectrum and licensed radios for mission-critical data transmission. Through engineering excellence and a relentless commitment to best-in-class manufacturing; FreeWave customers enjoy superior radio up-time; range and the lowest cost of ownership available. Based in Boulder; Colorado; FreeWave designs and manufactures radios that are the leading choice for oil and gas; utility; military and numerous other industrial applications. 
Rampalli,Prasad,Senior Vice President of Global Technology Solutio,EMC Corporation,Rampalli Prasad was Appointed as Senior Vice President of Global Technology Solutio at EMC Corporation,Hopkinton; MA-based EMC Corporation appointed Rampalli Prasad as Senior Vice President of Global Technology Solutio.,Prior to joining EMC; Mr. Rampalli served as Vice President and Director of End-User Platform Integration; Intel Architecture Group. In this role; he drove usage model innovation and standards across Intel's enterprise and embedded telecommunications platforms with a focus on cloud computing and end user value. During his long and distinguished Intel career; he also led significant transformational roles across Manufacturing; Information Technology and Platform Business Units.,EMC Corporation (NYSE: EMC) is the world's leading developer and provider of information infrastructure technology and solutions that enable organizations of all sizes to transform the way they compete and create value from their information.
Lennart,Jonsson,Chief Technology Officer,Eaton Corp.,Lennart Jonsson was Promoted to Chief Technology Officer at Eaton Corp.,Cleveland; OH-based Eaton Corp. promoted Lennart Jonsson to Chief Technology Officer.,Prior to joining Eaton; he held positions with Nea-Lindberg AS in Denmark; Ulveco Power Systems in Sweden; Fiskars Power Systems OY/AB in Finland and Deltec Electronics Corporation; Exide Electronics/Powerware and Invensys Power Systems/Powerware in the U.S. ,Eaton Corporation is a diversified power management company with 2009 sales of $11.9 billion. Eaton is a global technology leader in electrical components and systems for power quality; distribution and control; hydraulics components; systems and services for industrial and mobile equipment; aerospace fuel; hydraulics and pneumatic systems for commercial and military use; and truck and automotive drivetrain and powertrain systems for performance; fuel economy and safety.
Erik,Huddleston,Chief Technology Officer,Dachis Group,Erik Huddleston was Appointed as Chief Technology Officer at Dachis Group,Austin; TX-based Dachis Group appointed Erik Huddleston as Chief Technology Officer.,Prior to joining Dachis Group; Huddleston was Chief Technology Officer of Inovis; the premier provider of cloud integration; analytics; and social supply chain solutions. ,Dachis Group (Dachis Corporation; Inc.) was created to unlock the value of social technologies for large corporate enterprises. Founded in 2008; by Jeffrey Dachis; Dachis Group services companies all around the globe with offices in seven cities in five countries.
Bobby,Brown,Chief Information Officer,Kimray Inc.,Bobby Brown was Promoted to Chief Information Officer at Kimray Inc.,Oklahoma; OK-based Kimray Inc. promoted Bobby Brown to Chief Information Officer.,Prior to his promotion; Brown served as director of information technology at Kimray where he's worked for the past 32 years.,Kimray; Inc. is an Oklahoma manufacturer of control valves and related equipment for oil and gas producing companies.
Darryl,Hair,Chief Information Officer,Crowell & Moring LLP,Darryl Hair Resigned as Chief Information Officer at Crowell & Moring LLP,Washington; DC-based Crowell & Moring LLP accepted resignation of Darryl Hair as Chief Information Officer.,Prior to Crowell; Darryl Hair was a Financial Advisor at Merrill Lynch,Crowell and Moring LLP is a full-service law firm with more than 350 lawyers practicing in litigation; antitrust; government contracts; corporate; intellectual property and more than 40 other practice areas
Robert,Hodges,Chief Executive Officer ,Continuent ,Robert Hodges was Promoted to Chief Executive Officer  at Continuent ,San Jose ; CA-based Continuent  promoted Robert Hodges to Chief Executive Officer .,Prior to Continuent; he worked as a Senior Engineering Manager at Sybase as well as Portera and Exigen Group; where he led development and operation of SaaS applications. ,Continuent is the data management company that makes open source databases as reliable as commercial databases. We provide continuous data availability with an enterprise class solution that provides scalability; performance and reliability with cloud flexibility at open source cost. 
Nial,McLoughlin,Chief Technology Officer,Ashworth College,Nial McLoughlin was Appointed as Chief Technology Officer at Ashworth College,Norcross; GA-based Ashworth College appointed Nial McLoughlin as Chief Technology Officer.,Prior to Ashworth; Nial McLoughlin ran a small software business delivering technology solutions to the airline industry; growing this business from a small; one-customer business to a provider to the nations largest airlines. ,Ashworth College; a leader in online education; offers students worldwide more than 100 online degrees; online certificate programs; online career training and online high school diplomas that are affordable and fit the busy schedules of working adults. 
John,Consoli,Chief Technology Officer,AFCO Systems,John Consoli Resigned as Chief Technology Officer at AFCO Systems,Farmingdale; NY-based AFCO Systems accepted resignation of John Consoli as Chief Technology Officer.,Prior to AFCO Systems; John Consoli was a Regional Sales Manager at Ace Electronics,AFCO Systems; a global leader in the design and manufacture of advanced enclosure technology for mission-critical datacenter environments; has the world's largest installed base of active; air-cooled; high-density (5-8 kW) and extreme high-density (up to 20 kW) server and network cabinets. 
Roger ,Liew,Chief Technology Officer,Orbitz Worldwide,Roger  Liew was Promoted to Chief Technology Officer at Orbitz Worldwide,Chicago; IL-based Orbitz Worldwide promoted Roger  Liew to Chief Technology Officer.,Previously; Roger was vice president of technology at Orbitz Worldwide and group manager of the Intelligent Marketplace group. ,Orbitz Worldwide is a leading global online travel company that uses innovative technology to enable leisure and business travelers to research; plan and book a broad range of travel products.
Roberto,Arrocha,Vice President of Information Technology,DAVACO,Roberto Arrocha was Appointed as Vice President of Information Technology at DAVACO,Dallas; TX-based DAVACO appointed Roberto Arrocha as Vice President of Information Technology.,Previously; Roberto Arrocha was with American Airlines as senior manager of enterprise architecture; where he was responsible for establishing application architecture standards and policies. ,DAVACO; based in Dallas; TX; is the nation's leading provider of retail services focused on the quality execution of high-volume rollouts; resets; and new stores.
Raffaele,Piemonte,Chief Technology Officer,HealthEd,Raffaele Piemonte was Appointed as Chief Technology Officer at HealthEd,Clark; NJ-based HealthEd appointed Raffaele Piemonte as Chief Technology Officer.,Previously; Mr. Piemonte was with KPMG as director of application integration services. His prior experience includes CTO positions with IEG-Sponsordirect; Riverblade; and Ingredients.com.,HealthEd is a specialized agency that uses education to help people develop the knowledge; skills; motivation; and confidence to manage important health decisions and activities and ultimately achieve better health outcomes.
Michael,Reznick,Chief Technology Officer,361md,Michael Reznick was Appointed as Chief Technology Officer at 361md,Great Neck; NY-based 361md appointed Michael Reznick as Chief Technology Officer.,Previously; Michael has been directly involved and responsible for delivery of multi-million dollar technology projects for a number of Fortune 500 companies and well known hospitals in New York City.,361md - a leading healthcare IT Company; represents a complete 360 degree solution for hospitals; doctors' offices; expert physicians; diagnostic labs; pharmacies; health insurance companies and other healthcare providers including nursing homes and rehab facilities.
Kevin,Prince,Chief Technology Officer,Compushare; Inc.,Kevin Prince was Appointed as Chief Technology Officer at Compushare; Inc.,Santa Ana; CA-based Compushare; Inc. appointed Kevin Prince as Chief Technology Officer.,Previously; Kevin Prince was founder and CEO of Red Cliff Solutions which provided firewall; intrusion detection and prevention; web content filtering; anti virus; virtual private networks; and vulnerability assessments to financial institutions; all with 24/7 management and monitoring.,Compushare is the leading national Financial Technology Management solutions provider for the financial services industry.
Jerry,Batt,Chief Information Officer,Pulte Homes,Jerry Batt was Appointed as Chief Information Officer at Pulte Homes,San Manuel; AZ-based Pulte Homes appointed Jerry Batt as Chief Information Officer.,Previously; Jerry Batt was with Sprint PCS from 2001 to 2003 as VP & CIO. ,Pulte Homes; Inc.; based in Bloomfield Hills; Mich.; is America’s largest home building company with operations in 29 states and the District of Columbia.
