First Name,Last Name,Title,Company Name,Headline,What Happened,About Person,About Company
Brian,Goodall,Chief Technology Officer,OriginOil,Brian Goodall was Appointed as Chief Technology Officer at OriginOil,Los Angeles; CA-based OriginOil appointed Brian Goodall as Chief Technology Officer.,Previously; Goodall served as Vice President of Downstream Technology at Sapphire Energy; Inc.; where he worked with Continental Airlines in helping to achieve the first U.S. commercial demo flight using an algae-oil blend. ,OriginOil; Inc. is developing a breakthrough technology that will transform algae; the most promising source of renewable oil; into a true competitor to petroleum. Much of the world's oil and gas is made up of ancient algae deposits. 
Sheldon,Walklin,Chief Technology Officer,Optelian ,Sheldon Walklin was Appointed as Chief Technology Officer at Optelian ,Marietta ; GA-based Optelian  appointed Sheldon Walklin as Chief Technology Officer.,Previously; Dr. Walklin served as the company's Director of Systems Architecture. He joined Optelian in 2006. ,Optelian; a trusted designer and manufacturer of optical transport systems; serves some of the world's largest network operators. With more than 4;700 systems and over 107;000 wavelengths installed; the company is known industry-wide for its exceptional product quality; speed of delivery; superior customer support and custom-design capabilities. Since 2002; Optelian's portfolio of optical solutions has enabled telecom; multi-service operator (MSO); utility and enterprise customers to expand their fiber capacity so they can increase revenue; cost-effectiveness and efficiency. 
Ciprian,Popoviciu,Chief Technology Officer,TechnoDyne,Ciprian Popoviciu was Appointed as Chief Technology Officer at TechnoDyne,Wayne; NJ-based TechnoDyne appointed Ciprian Popoviciu as Chief Technology Officer.,Previously; Cirprian Popoviciu managed the architecture team for Cisco's Engineering Infrastructure Services organization where he helped develop the strategy and drove the execution of the data center consolidation and transition to cloud.,TechnoDyne is a fast growing information technology services firm that delivers services to government agencies and private sector enterprises.
Awais,Shibli,Chief Technology Officer,Tecnex Systems,Awais Shibli was Appointed as Chief Technology Officer at Tecnex Systems,Houston; TX-based Tecnex Systems appointed Awais Shibli as Chief Technology Officer.,Previously; Awais Shibli worked on different projects with SETECS including Secure Electronic Medical Record Exchange and Patient Identification; XACML policies for Access Control; Public key Infrastructure; Identity Management and Secure Mobile Ticketing to name some.,The Houston-based company provides practice management systems and electronic health records solutions for physicians; clinics and hospitals throughout the U.S.
Chanchal,Samanta,Chief Technology Officer,PlumChoice,Chanchal Samanta was Appointed as Chief Technology Officer at PlumChoice,Billerica; MA-based PlumChoice appointed Chanchal Samanta as Chief Technology Officer.,Previously Samanta has held senior R&D and product development positions with top-tier companies in the telecommunications; enterprise software and financial services sectors; including Applix (now owned by IBM); Unica Corporation; Genesys Telecommunications Laboratories and Fidelity Investments.,PlumChoice pioneered the remote technical services business; providing 24x7 online repair and assistance for digital devices through top-tier telcos; ISPs; manufacturers; retailers/e-tailers and other business partners since 2001. 
Randy,McGarry,Chief Information Officer,Fox Chase Bancorp Inc.,Randy McGarry was Appointed as Chief Information Officer at Fox Chase Bancorp Inc.,Hatboro; PA-based Fox Chase Bancorp Inc. appointed Randy McGarry as Chief Information Officer.,Previously Randy McGarry had been executive vice president; chief information and technology officer for Harleysville National Corp.,Fox Chase Bancorp; Inc.; is the holding company of Fox Chase Bank. The Bank is a federally chartered savings bank established in 1867. The Bank offers traditional banking services and products from its main office in Hatboro; Pennsylvania and ten branch offices in Bucks; Montgomery; Chester; Delaware and Philadelphia Counties in Pennsylvania and Atlantic and Cape May Counties in New Jersey.
Magnus,Borg,Chief Information Officer,Sigma Aldrich,Magnus Borg was Appointed as Chief Information Officer at Sigma Aldrich,Saint Louis; MO-based Sigma Aldrich appointed Magnus Borg as Chief Information Officer.,Previously Magnus Borg  worked as chief information officer at Ericsson North America and Safety-Kleen. ,Sigma-Aldrich is a leading Life Science and High Technology company. Its biochemical and organic chemical products and kits are used in scientific research; including genomic and proteomic research; biotechnology; pharmaceutical development and as key components in pharmaceutical; diagnostic and other high technology manufacturing.
Glen,Kauffmann,Chief Technology Officer,Heritage Financial Group,Glen Kauffmann was Promoted to Chief Technology Officer at Heritage Financial Group,Albany; GA-based Heritage Financial Group promoted Glen Kauffmann to Chief Technology Officer.,Previously Glen Kauffmann held various technology positions with the Heritage  Financial Group,Heritage Financial Group is a management group for entities in the mobile home park; sub-prime finance; used car lots; and commercial real estate
Tim,Dyer,Chief Technology Officer,Energy Recovery,Tim Dyer was Promoted to Chief Technology Officer at Energy Recovery,San Leandro; CA-based Energy Recovery promoted Tim Dyer to Chief Technology Officer.,Previously Energy Recoverys chief scientist; Dyer brings more than 18 years of engineering; product development and management experience. He currently holds 31 patents and has 18 pending; and he has published numerous technical papers that have helped shape best practices within the advanced ceramics and material sciences fields. Dyer holds a bachelor?s degree in material science and a master?s degree in mechanical engineering from the University of California; Davis.,Energy Recovery Inc (NASDAQ:ERII) designs and develops energy recovery devices that help make desalination affordable by significantly reducing energy consumption.
Antoine,Haroun,Chief Information Officer,Mohawk College,Antoine Haroun was Appointed as Chief Information Officer at Mohawk College,Hamilton; ON-based Mohawk College appointed Antoine Haroun as Chief Information Officer.,Previously as a Director of Information Technology for the Ontario government; Antoine led complex technology projects including the HST system changes and establishing knowledge transfer and project management capacity and systems. ,Mohawk College in Hamilton Ontario offers over 100 full-time postsecondary and apprenticeship programs; over 1;000 continuing education courses; community training programs.
Ahmet,Mahmoud,Senior Vice President - Global Information Technol,Hewlett Packard,Ahmet Mahmoud was Appointed as Senior Vice President - Global Information Technol at Hewlett Packard,Palo Alto; CA-based Hewlett Packard appointed Ahmet Mahmoud as Senior Vice President - Global Information Technol.,Previously Ahmet Mahmoud was the Chief Information Officer at AMD,HP creates new possibilities for technology to have a meaningful impact on people; businesses; governments and society. The world's largest technology company; HP brings together a portfolio that spans printing; personal computing; software; services and IT infrastructure to solve customer problems. 
Sean,Corcoran,director of information technology,The American Society for Radiation Oncology,Sean Corcoran was Appointed as director of information technology at The American Society for Radiation Oncology,Fairfax; VA-based The American Society for Radiation Oncology appointed Sean Corcoran as director of information technology.,Previosuly Sean Corcoran was the director of quality assurance; product management and customer service at TMA Resources; an association management software company. ,ASTRO is a medical society for radiation oncologists and other members of the radiation therapy treatment team.
Praveen,Pay,Chief Technology Officer,Merrill Lynch,Praveen Pay was Appointed as Chief Technology Officer at Merrill Lynch,New York; NY-based Merrill Lynch appointed Praveen Pay as Chief Technology Officer.,Praveen Pay was previously the Director; fixed income technology; for Citigroup; markets and banking.,Global Wealth & Investment Management (GWIM) provides comprehensive wealth management to affluent and high-net-worth clients.
Pratik,Roychoudhury,Chief Technology Officer,Career Transitions,Pratik Roychoudhury Resigned as Chief Technology Officer at Career Transitions,Elkhart; IN-based Career Transitions accepted resignation of Pratik Roychoudhury as Chief Technology Officer.,Pratik Roychoudhury was previously Chief Technology Officer (CTO) at Career Transitions,Since 1987; Career Transitions; LLC; has been committed to helping organizations select; develop; retain and transition employees through all phases of the business cycle.
Prameet,Savla,Vice President,Central Technology Group   Kale Consultants,Prameet Savla was Appointed as Vice President at Central Technology Group   Kale Consultants,Edison; NJ-based Central Technology Group   Kale Consultants appointed Prameet Savla as Vice President.,Prameet Savla was previously with Travis Internet Pvt. Ltd working on high availability; scalable; and multi-tenant SaaS based solutions.  ,Kale Consultants is a leading technology solutions provider to Airline; Airports; Logistics and Travel (AALT) industry
Prakash,Iyer,Chief Technology Officer,envIO Networks,Prakash Iyer was Promoted to Chief Technology Officer at envIO Networks,Andover; MA-based envIO Networks promoted Prakash Iyer to Chief Technology Officer.,Prakash Iyer was previously the CEO of envIO Networks.,envIO Networks patent-pending Social Genome technology leverages social networks to help consumers discover relevant mobile apps and content.
Prakash,Bedapudi,Chief Technology Officer,Lennox International,Prakash Bedapudi was Appointed as Chief Technology Officer at Lennox International,Richardson; TX-based Lennox International appointed Prakash Bedapudi as Chief Technology Officer.,Prakash Bedapudi was previously the Vice President - Engineering & Technology; Commercial Systems at Trane.,Lennox International (LII) makes products so cool they're hot -- and vice versa.
Pradeep,Pai,Chief Technology Officer,Merrill Lynch,Pradeep Pai was Appointed as Chief Technology Officer at Merrill Lynch,New York; NY-based Merrill Lynch appointed Pradeep Pai as Chief Technology Officer.,Pradeep Pai was previously the Managing Director & CTO; Investment Banking & Research at Merrill Lynch.,Global Wealth & Investment Management (GWIM) provides comprehensive wealth management to affluent and high-net-worth clients.
Piyush ,Singh,Chief Information Officer,American Financial Group,Piyush  Singh was Appointed as Chief Information Officer at American Financial Group,Cincinnati; OH-based American Financial Group appointed Piyush  Singh as Chief Information Officer.,Piyush Singh was previously the CIO of RLI Corp.,merican Financial Group (
Pierre-Michel,Kronenberg,Chief Technology Officer,Webroot Software Inc,Pierre-Michel Kronenberg was Appointed as Chief Technology Officer at Webroot Software Inc,Boulder; CO-based Webroot Software Inc appointed Pierre-Michel Kronenberg as Chief Technology Officer.,Pierre-Michel Kronenberg was previously the chief technology officer for PC Tools.,Webroot is a leading provider of Internet security for consumers and businesses worldwide.
Pierre,Zakarauskas,Executive Director of Technology & Product Develop,Peak Resources Inc.,Pierre Zakarauskas was Appointed as Executive Director of Technology & Product Develop at Peak Resources Inc.,Calgary; AB-based Peak Resources Inc. appointed Pierre Zakarauskas as Executive Director of Technology & Product Develop.,Pierre Zakarauskas co-founded a successful high tech company; Wavemakers Inc.; where he held the posts of President; V.P. of R&D; and CTO. ,Mine Clearing Corp is set to become a leading force in the humanitarian demining of the third world's war zones with cutting edge technology
Phyllis,Teater,Chief Information Officer,Ohio State University Medical Center,Phyllis Teater was Promoted to Chief Information Officer at Ohio State University Medical Center,Columbus; OH-based Ohio State University Medical Center promoted Phyllis Teater to Chief Information Officer.,Phyllis Teater previously held various technology positions at the Ohio State University Medical Center.,Ohio State University Medical Center
Phillip,Maxwell,Chief Information Officer,Neiman Marcus,Phillip Maxwell was Appointed as Chief Information Officer at Neiman Marcus,Dallas; TX-based Neiman Marcus appointed Phillip Maxwell as Chief Information Officer.,Phillip Maxwell was previously the CIO at Nissan North America.,The Neiman Marcus Group; Inc. operations include the Specialty Retail Stores segment and the Direct Marketing segment. The Specialty Retail Stores segment consists primarily of Neiman Marcus and Bergdorf Goodman stores. 
