First Name,Last Name,Title,Company Name,Headline,What Happened,About Person,About Company
Richard,Caccappolo,President and chief operating officer,oneTXT,Richard Caccappolo was Appointed as President and chief operating officer at oneTXT,New York; NY-based oneTXT appointed Richard Caccappolo as President and chief operating officer.,Richard Caccappolo was previously the chief technology officer and chief operating officer of iVillage Inc.; which became the centerpiece of NBC Universal's Interactive division. ,ORCA provides a payments processing alternative for social networks; online games to accept payments; create loyalty programs; and send marketing messages.
Richard,Brotzman,Chief Technology Officer,Nanophase Technologies,Richard Brotzman Resigned as Chief Technology Officer at Nanophase Technologies,Romeoville; IL-based Nanophase Technologies accepted resignation of Richard Brotzman as Chief Technology Officer.,Richard Brotzman was previously the Director of Research at TPL; Inc.,Nanophase Technologies Corporation engages in the development; manufacture; and sale of nanomaterials in the United States; Europe; and Asia.
Rick,Bellamy,Chief Information Officer,RPI,Rick Bellamy was Appointed as Chief Information Officer at RPI,Tukwila; WA-based RPI appointed Rick Bellamy as Chief Information Officer.,Richard Bellamy was the CEO/President at Ivey.,RPI is a leading make-on-demand producer of private label personalized photo books; greeting cards and stationery products for mass and specialty retailers.
Richard,Anderson,Chief Information Officer,KPMG LLP,Richard Anderson was Appointed as Chief Information Officer at KPMG LLP,Montvale; NJ-based KPMG LLP appointed Richard Anderson as Chief Information Officer.,Richard Anderson was previously the global and national leader of KPMG's IT Strategy and Performance Services. ,KPMG operates as an international network of member firms offering audit; tax and advisory services. 
Rich,Rzasa,Chief Information Officer,LifeLock Inc,Rich Rzasa was Appointed as Chief Information Officer at LifeLock Inc,Tempe; AZ-based LifeLock Inc appointed Rich Rzasa as Chief Information Officer.,Rich Rzasa was previously the Vice Chairman and Chief Information Officer for TD Waterhouse.,Founded in 2005; LifeLock works to close many of the doors identity thieves go through to misuse personal information.
Rich,Green,Chief Technology Officer,Nokia Corporation America,Rich Green was Appointed as Chief Technology Officer at Nokia Corporation America,Irving; TX-based Nokia Corporation America appointed Rich Green as Chief Technology Officer.,Rich Green was previously the VP of Software at Sun Microsystems.,Nokia is the world leader in mobility; driving the transformation and growth of the converging Internet and communications industries. 
Rich,Gius,Chief Information Officer,Atmos Energy Corporation,Rich Gius was Appointed as Chief Information Officer at Atmos Energy Corporation,Dallas; TX-based Atmos Energy Corporation appointed Rich Gius as Chief Information Officer.,Rich Gius was previously the SVP; IT at Allegiance Healthcare.,Atmos Energy is the largest natural-gas-only distributor in the United States.
Rich,Alexander,Chief Information Officer,Cerberus Capital management,Rich Alexander was Promoted to Chief Information Officer at Cerberus Capital management,Raleigh; NC-based Cerberus Capital management promoted Rich Alexander to Chief Information Officer.,Rich Alexander was previously CIO within IT Practice at  Cerberus Capital Management  ,Established in 1992; Cerberus Capital Management; L.P.; along with its affiliates; is one of the world's leading private investment firms with approximately $23 billion under management in funds and accounts. 
Rehan,Khan,Chief Information Officer,West Virginia University,Rehan Khan was Appointed as Chief Information Officer at West Virginia University,Morgantown; WV-based West Virginia University appointed Rehan Khan as Chief Information Officer.,Rehan Khan was previously assistant dean for information technologies and chief information officer at Emory University School of Medicine.,Extended Learning takes West Virginia University courses around the state and around the globe through off-campus programming and distance technology.
Rebecca,Wanta,Chief Information Officer,State Compensation Insurance Fund,Rebecca Wanta was Appointed as Chief Information Officer at State Compensation Insurance Fund,San Francisco; CA-based State Compensation Insurance Fund appointed Rebecca Wanta as Chief Information Officer.,Rebecca Wanta was previously the Chief Information Officer - NA at Best Buy.,State Compensation Insurance Fund provides workers' compensation insurance to employers in California.
Raymond,Voelker,Chief Information Officer,Progressive ,Raymond Voelker was Appointed as Chief Information Officer at Progressive ,Cleveland; OH-based Progressive  appointed Raymond Voelker as Chief Information Officer.,Raymond Voelker previously held various technology positions in the insurance industry.,The Progressive Corporation; through its subsidiaries; provides personal and commercial automobile insurance; and other specialty property-casualty insurance products and related services.
Raymond,Slee,President,Intelimax Media,Raymond Slee was Promoted to President at Intelimax Media,Vancouver; BC-based Intelimax Media promoted Raymond Slee to President.,Raymond Slee was previously the CTO of Intelimax Media,Intelimax Media Inc. (www.intelimax.com [http://www.intelimax.com]) is an Internet services company focusing on online games and web content. 
Raymond,Pawlicki,Chief Information Officer,Biogen Idec,Raymond Pawlicki was Appointed as Chief Information Officer at Biogen Idec,Cambridge; MA-based Biogen Idec appointed Raymond Pawlicki as Chief Information Officer.,Raymond Pawlicki was previously the CIO of Novartis Pharmaceuticals.,Biogen Idec is a global leader in the discovery; development; manufacturing; and commercialization of innovative therapies that address diseases such as lymphoma; multiple sclerosis; and rheumatoid arthritis.
Raymie,Stata,Chief Technology Officer,Yahoo,Raymie Stata was Promoted to Chief Technology Officer at Yahoo,Sunnyvale; CA-based Yahoo promoted Raymie Stata to Chief Technology Officer.,Raymie Stata was previously Chief Architect at Yahoo!,Yahoo! attracts hundreds of millions of users every month through its innovative technology and engaging content and services; making it one of the most visited Internet destinations and a world-class online media company. 
Ray,Webb,director of information technology,Fort Bend County,Ray Webb was Appointed as director of information technology at Fort Bend County,Rosenberg; TX-based Fort Bend County appointed Ray Webb as director of information technology.,Ray Webb was prevsiously 16 years with the Bell System in which he held various technical and management roles in central office operations; network engineering and customer service. ,Fort Bend County is a county located along the Gulf Coast region in the U.S. state of Texas within the Houston-Sugar Land-Baytown metropolitan area. In 2000 its population was 354;452
Ray,Roberge,Chief Technology Officer,Airgas National Welders,Ray Roberge was Appointed as Chief Technology Officer at Airgas National Welders,Charlotte; NC-based Airgas National Welders appointed Ray Roberge as Chief Technology Officer.,Ray Roberge was previously the President of Praxair Electronics.,Airgas; Inc. (NYSE: ARG); through its subsidiaries; is the largest U.S. distributor of industrial; medical; and specialty gases; and hardgoods; such as welding equipment and supplies.
Ray,Roberge,Chief Technology Officer,Praxair Electronics,Ray Roberge was Appointed as Chief Technology Officer at Praxair Electronics,Danbury; CT-based Praxair Electronics appointed Ray Roberge as Chief Technology Officer.,Ray Roberge was previously the President of Praxair Electronics.,Praxair; a Fortune 300 company; is the largest industrial gases company in North and South America; and one of the largest worldwide; with 2009 sales of $9 billion.
Ravi,Simhambhatla,Chief information officer,Virgin America,Ravi Simhambhatla was Appointed as Chief information officer at Virgin America,Burlingame; CA-based Virgin America appointed Ravi Simhambhatla as Chief information officer.,Ravi Simhambhatla was previously the Director of Architecture and Integration at Vigin America.,Virgin America; the new airline dedicated to changing the way people fly.
Randyll,Bowen,Interim Vice President of Information Technology,Niagara Community College,Randyll Bowen was Appointed as Interim Vice President of Information Technology at Niagara Community College,Sanborn; NY-based Niagara Community College appointed Randyll Bowen as Interim Vice President of Information Technology.,Randyll Bowen was previously the vice president of workforce and community development at Niagara Community College.,Niagara County Community College is located in Sanborn; New York; USA northeast of the City of Niagara Falls. NCCC offers associate's degrees in many programs. Niagara County Community College was founded in 1962 and is sponsored by Niagara County and SUNY.
Randy,Wilson,Chief Technology Officer,Driveline,Randy Wilson was Promoted to Chief Technology Officer at Driveline,Mebane; NC-based Driveline promoted Randy Wilson to Chief Technology Officer.,Randy Wilson was previously the President of the Driveline Services.,GKN is a leading global supplier to the world's automotive; offhighway and aerospace manufacturers.
Randy,Spratt,Chief Technology Officer,McKesson Corporation,Randy Spratt was Promoted to Chief Technology Officer at McKesson Corporation,Atlanta; GA-based McKesson Corporation promoted Randy Spratt to Chief Technology Officer.,Randy Spratt was previously the Vice President and Chief Information Officer (CIO).,McKesson Corporation; currently ranked 14th on the FORTUNE 500; is a healthcare services and information technology company dedicated to helping its customers deliver high-quality healthcare by reducing costs; streamlining processes; and improving the quality and safety of patient care.
Randy,Senn,Chief Information Officer,SCANA Corporation,Randy Senn was Appointed as Chief Information Officer at SCANA Corporation,Columbia; SC-based SCANA Corporation appointed Randy Senn as Chief Information Officer.,Randy Senn previously held various technology positions at SCANA Corp.,Headquartered in Columbia; South Carolina; SCANA is a $10 billion; Fortune 500; energy-based holding company.
Randy,Merilatt,Chief Technology Officer,Raima,Randy Merilatt was Promoted to Chief Technology Officer at Raima,Seattle; WA-based Raima promoted Randy Merilatt to Chief Technology Officer.,Randy Merilatt is the founder of Raima.,Raima Inc. is a premier provider of high performance embedded database and dataflow solutions known as the Raima Database Manager (RDM) product line.
Randy,McGarry,Chief Information Officer,Harleysville National Corp.,Randy McGarry Resigned as Chief Information Officer at Harleysville National Corp.,Buffalo; NY-based Harleysville National Corp. accepted resignation of Randy McGarry as Chief Information Officer.,Randy MacGarry resigned from Harleysville National Corp. to join Fox Chase Bank,First Niagara Financial Group; Inc. (NASDAQ: FNFG) is the holding company for First Niagara Bank; N.A.; a leading provider of financial services to consumers and businesses in upstate New York; and western and eastern Pennsylvania. With the acquisition of 57 National City branches in western Pennsylvania (September 2009) and Harleysville National Corporation (April 2010); First Niagara has $20 billion in assets; 254 branches and $14 billion in deposits.
Randy,Burdick,Chief Information Officer,OfficeMax,Randy Burdick was Appointed as Chief Information Officer at OfficeMax,Naperville; IL-based OfficeMax appointed Randy Burdick as Chief Information Officer.,Randy Burdick was previously the Group Information Officer for Hewlett-Packard.,OfficeMax is the third largest office supplies retailer founded in 1988 with its headquarters in Naperville; Illinois. The company has over 1;000 superstores in 49 states; Puerto Rico; and the US Virgin Islands.
Randall,Francis,Chief Technology Officer,Tivus; Inc.,Randall Francis was Appointed as Chief Technology Officer at Tivus; Inc.,Omaha; NE-based Tivus; Inc. appointed Randall Francis as Chief Technology Officer.,Randall Francis has been an innovator in entertainment electronics since 1983. As national projects manager for Philips Electro Acoustics division in New Zealand; he developed an immersive virtual visitor`s center at a petrochemical plant using never before integrated technologies including a computer controlled synchronized Laservision disc; projection video; compact audio disc; and fiber optic lighting system allowing completely safe public tours.,Tivus; Inc. is a technology entertainment services company that provides internet based TV and Cable programming; interactive game content; and goods & services to the hotel/hospitality industry.
Randall,Carrier,Deputy Chief Information Officer,First Horizon,Randall Carrier was Appointed as Deputy Chief Information Officer at First Horizon,Memphis; TN-based First Horizon appointed Randall Carrier as Deputy Chief Information Officer.,Randall Carrier was previously the Director of customer knowledge and digital strategy.,First Horizon National Corporation operates as a holding company for First Tennessee Bank National Association; which provides various financial services in the United States.
Ramprakash,Narayanaswamy,Chief Technology Officer,8x8; Inc.,Ramprakash Narayanaswamy was Appointed as Chief Technology Officer at 8x8; Inc.,Sunnyvale; CA-based 8x8; Inc. appointed Ramprakash Narayanaswamy as Chief Technology Officer.,Ramprakash Narayanaswamy was previously Enterprise Software Architect at Nextance Inc.; Director; Tools Architecture and Development at Bluelight.com and Senior Software Engineer at Sun Microsystems Inc.,8x8; Inc. offers voice; video and mobile IP communications solutions for business and residential customers.
Ramon,Baez,Technology Position,Department of Information Resources,Ramon Baez was Appointed as Technology Position at Department of Information Resources,Austin; TX-based Department of Information Resources appointed Ramon Baez as Technology Position.,Ramon Baez was previously the Vice President and CIO at Kimberly-Clark.,The mission of the Department of Information Resources (DIR) is to provide technology leadership; solutions and value to all levels of Texas government and education; to enable and facilitate the fulfillment of their core missions.
Ramon,Baez,Chief Information Officer,Kimberly-Clark ,Ramon Baez was Appointed as Chief Information Officer at Kimberly-Clark ,Irwing; TX-based Kimberly-Clark  appointed Ramon Baez as Chief Information Officer.,Ramon Baez was previously the Chief Information Officer at Fisher Scientific.,  Kimberly-Clark is a leading global health and hygiene company employing more than 55;000 people worldwide and posting sales of $18.3 billion in 2007.
Rama,Nada,Director of Technology,Examsoft,Rama Nada was Appointed as Director of Technology at Examsoft,Deerfield Beach; FL-based Examsoft appointed Rama Nada as Director of Technology.,Rama Nada was previously the Director with Versata Software/Trilogy Software where he was responsible for managing the delivery of Deployed Enterprise Software Solutions. ,ExamSoft provides secure exam software solutions for high stakes legal; medical; and certification exams. 
Ralph,Szygenda,Chief Information Officer,General Motors,Ralph Szygenda Retired as Chief Information Officer at General Motors,Detroit; MI-based General Motors announced retirement of Ralph Szygenda as Chief Information Officer.,Ralph Szygenda was previously the  Interim CIO at GM Asia Pacific.,We're the new General Motors. We are a company of diverse brands; selling over 7.5 million vehicles in more than 120 countries worldwide.
Dan,Raju,Chief Information Officer,TradeKing,Dan Raju was Appointed as Chief Information Officer at TradeKing,Boca Raton; FL-based TradeKing appointed Dan Raju as Chief Information Officer.,Raju was most recently Senior Director and Associate Vice President of Global Technology Infrastructure & Operations at the Associated Press where he was charged with overseeing all aspects of technology operations; strategy; engineering and support for the world's largest news company with operations in 300 plus global locations supporting about 10;000 newspapers and broadcasters and members.,TradeKing (http://www.tradeking.com) is a nationally licensed online stock and option trading broker offering simple; low trading fees ($4.95 per trade plus $.65 per option contract) with no hidden costs or account minimums.1 A pioneer in integrating new financial social media as part of its innovative online equities; options trading and fixed-income trading platform; TradeKing has received multiple five-star ratings from top industry sources and was rated best in customer service by SmartMoney2 Magazine; ahead of OptionsXpress; Scottrade; Fidelity and TD Ameritrade. (June 2010 SmartMoney Broker Survey).
Dawn,White,Chief Technology Officer,Accio Energy,Dawn White became Chief Technology Officer at Accio Energy,Ann Arbor; MI-based Accio Energy appointed Dawn White as Chief Technology Officer.,Rajesh Raichoudhury brings not only technology but investor experience to Buyology. He is a prominent angel investor and has been a limited partner at Silicon Valley Angel Investors; an early stage funder of Google.,Buyology Inc.; the worlds leading strategic neuromarketing company; is in the business of quantifying; improving; and actively managing sustainable relationships between brands and their customers. Buyology utilizes its global neuroscience database to develop rigorous tools that bridge science and business so as to provide a provocative and proprietary understanding of consumer decision making and brand relationships. Buyology helps significantly enhance marketings transformational business impact.
Rahul,Sood,Chief Technology Officer,Hewlett-Packard Company ,Rahul Sood Resigned as Chief Technology Officer at Hewlett-Packard Company ,Palo Alto; CA-based Hewlett-Packard Company  accepted resignation of Rahul Sood as Chief Technology Officer.,Rahul Sood was chief technology officer of HP.,HP is a technology company that operates in more than 170 countries around the world.
Rahul,Merchant,Chief Information Officer,Fannie Mae,Rahul Merchant Resigned as Chief Information Officer at Fannie Mae,Wahsington; DC-based Fannie Mae accepted resignation of Rahul Merchant as Chief Information Officer.,Rahul Merchant was previously the SVP - CTO at Merrill Lynch.,Fannie Mae is a government-sponsored enterprise (GSE) chartered by Congress with a mission to provide liquidity and stability to the U.S. housing and mortgage markets.
Raheel,Retiwalla,Vice President of Information Technology,Clearway Technology Partners,Raheel Retiwalla was Appointed as Vice President of Information Technology at Clearway Technology Partners,Medfield; MA-based Clearway Technology Partners appointed Raheel Retiwalla as Vice President of Information Technology.,Raheel Retiwalla was previously with Microsoft where he most recently served as Senior Product Manager for SQL Server; responsible for helping launch SQL Server 2008 as well as driving their Systems Integrator partner channel strategy for the SQL Server business. ,Star Information Technology is a private company categorized under Prepackaged Software and located in Medfield; MA. Current estimates show this company has an annual revenue of less than $500;000 and employs a staff of approximately 1 to 4
Rachelle,Chong,Special counsel of advanced information and commun,State of California,Rachelle Chong was Appointed as Special counsel of advanced information and commun at State of California,Sacramento; CA-based State of California appointed Rachelle Chong as Special counsel of advanced information and commun.,Rachelle Chong was previously a member of Public Utilities Commission of the State of California.,California  is the most populous state in the United States; and the third largest by land area; after Alaska and Texas; it is also the most populous sub-national entity in North America.
Rachel,Desmarais,Vice President of Information Services,Forsyth Technical Community College,Rachel Desmarais was Appointed as Vice President of Information Services at Forsyth Technical Community College,Winston-Salem; NC-based Forsyth Technical Community College appointed Rachel Desmarais as Vice President of Information Services.,Rachel Desmarais was previously department chairwoman of Forsyth Tech's Thomas H. Davis iTEC Center for six years.,Forsyth Technical Community College is a public; two-year higher learning institution located in the North Carolina community of Winston-Salem
Rachad,Alao,Chief Technology Officer,Bluestreak Technology,Rachad Alao was Appointed as Chief Technology Officer at Bluestreak Technology,Montreal; ON-based Bluestreak Technology appointed Rachad Alao as Chief Technology Officer.,Rachad Alao was previously Vice President of Technology and Product Management.,Bluestreak Technology is the open Flash platform leader for companies that want to create custom Adobe Flash-based user interfaces; applications; and web services across a wide variety of wired and wireless devices. 
Keith,Halbert,Chief Information Officer,United Airlines,Keith Halbert was Appointed as Chief Information Officer at United Airlines,Chicago; IL-based United Airlines appointed Keith Halbert as Chief Information Officer.,R. Keith Halbert Senior Vice President and Chief Information Officer Keith Halbert is senior vice president and chief information officer for United Airlines. He is based at United's operations center in suburban Chicago. Halbert joined United in January 2008 and is responsible for the effective implementation and management of technology solutions to support all aspects of United's businesses and programs. Before joining United; Halbert was vice president and CIO of Electronic Data Systems (EDS). At EDS; Halbert led the company's digital transformation efforts and implemented a three-year IT transformation plan that consistently improved the company's performance and reduced operating expenses. Prior to joining EDS; Halbert served as managing director of knowledge management for the Feld Group; Inc.; a privately held technology management consultancy acquired by EDS. While at Feld; Halbert held a number of leadership positions; including a three-year role as senior vice president and chief development officer for Delta Airlines; where he developed and implemented applications and infrastructure to support Delta?s customer experience; revenue management; airline operations and enterprise shared services business strategies. Additionally at Feld; Halbert served for two years as senior vice president and chief development officer for First Data Resources; where he developed and led a multi-year IT transformation effort focused on restructuring legacy systems to improve client service. He also served in a one-year role as senior vice president and chief development officer for Home Depot; where he developed and led their IT transformation initiative. Halbert holds a bachelor's degree in computer information systems and a master's degree in business administration from Jacksonville University.,United Airlines; a wholly-owned subsidiary of UAL Corporation (Nasdaq: UAUA); operates approximately 3;400* flights a day on United and United Express to more than 230 U.S. domestic and international destinations from its hubs in Los Angeles; San Francisco; Denver; Chicago and Washington; D.C.  With key global air rights in the Asia-Pacific region; Europe and Latin America; United is one of the largest international carriers based in the United States.  United also is a founding member of Star Alliance; which overall offers 19;700 daily flights to 1;077 airports in 175 countries through its 26 member airlines.  United's 46;000 employees reside in every U.S. state and in many countries around the world.  United ranked No. 1 in on-time performance** for domestic scheduled flights for 2009 among America's five largest global carriers; as measured by the Department of Transportation and published in the Air Travel Consumer Report for 2009. United also ranked No. 1 in on-time arrivals among the five largest U.S. global carriers for the first six months of 2010 based on preliminary information.  News releases and other information about United can be found at the company's Web site at united.com; and follow United on Twitter @UnitedAirlines.
Priscilla,Guthrie,Chief Information Officer,Office of the Director of National Intelligence; Washington; D.C.,Priscilla Guthrie was Appointed as Chief Information Officer at Office of the Director of National Intelligence; Washington; D.C.,Itasca; IL-based Office of the Director of National Intelligence; Washington; D.C. appointed Priscilla Guthrie as Chief Information Officer.,Priscilla Guthrie was previously the Director of the Information Technology and Systems Division at the Institute for Defense Analyses., The Director of National Intelligence (DNI) serves as the head of the Intelligence  Community (IC) and is the principal advisor to the President; the National Security  Council; and the Homeland Security Council (HSC) for intelligence matters related to  national security.
