First Name,Last Name,Title,Company Name,Headline,What Happened,About Person,About Company
Don,Sharp,Chief Information Officer,Navistar,Don Sharp was Appointed as Chief Information Officer at Navistar,Warrenville; IL-based Navistar appointed Don Sharp as Chief Information Officer.,Don Sharp was previously the Managing Director at Valint Consulting.,Navistar International Corp. is a holding company whose individual units provide integrated and best-in-class transportation solutions. 
Don,Riley,Chief Information Officer,Mohawk Industries,Don Riley was Appointed as Chief Information Officer at Mohawk Industries,Calhoun; GA-based Mohawk Industries appointed Don Riley as Chief Information Officer.,Don Riley was previously the CIO at Kellwood Company.,Mohawk Industries is one of the largest makers of residential carpets and rugs in the US.
Don,Pyatt,Senior Vice President of Technology,Viracon,Don Pyatt was Appointed as Senior Vice President of Technology at Viracon,Owatonna; MN-based Viracon appointed Don Pyatt as Senior Vice President of Technology.,Don Pyatt was previously the President of Viracon.,As an international company; Viracon offers the most complete range of high-performance architectural glass products available worldwide.
Donald,Wolfe,Vice President Information Technology,Silvergate Bank,Donald Wolfe was Appointed as Vice President Information Technology at Silvergate Bank,La Jolla; CA-based Silvergate Bank appointed Donald Wolfe as Vice President Information Technology.,Don most recently was with San Diego National Bank as Vice President of Information Technology; managing its data center; information security; and other functions supporting an electronic network serving 400 users in 28 offices. ,Silvergate Capital Corporation ('Silvergate) is the parent company of Silvergate Bank; a California chartered commercial bank. 
Don,Moore,Chief Information Officer,Occidental Petroleum Corporation,Don Moore was Appointed as Chief Information Officer at Occidental Petroleum Corporation,Los Angeles; CA-based Occidental Petroleum Corporation appointed Don Moore as Chief Information Officer.,Don Moore previously held various technology positions in the oil and gas industry.,Occidental Petroleum Corporation (NYSE: OXY) is an international oil and gas exploration and production company; as well as a major North American chemical manufacturer.
Don,Claunch,Chief Information Officer,Wyoming Medical Center,Don Claunch was Appointed as Chief Information Officer at Wyoming Medical Center,Casper; WY-based Wyoming Medical Center appointed Don Claunch as Chief Information Officer.,Don Claunch was previously Various at Wyoming Medical Center.,Wyoming Medical Center is a 207 bed not-for-profit (501c3) acute care hospital in the center of Wyoming.
Dominique,Roddier,Chief Technology Officer,Principle Power; Inc.,Dominique Roddier was Appointed as Chief Technology Officer at Principle Power; Inc.,Seattle; WA-based Principle Power; Inc. appointed Dominique Roddier as Chief Technology Officer.,Dominique Roddier was previously the co-founder of Marine Innovation & Technology and worked in the offshore division of ExxonMobil's Upstream Research Company. ,Principle Power is focused on the deep-water offshore wind energy market. Its product; the WindFloat; is a floating foundation for wind turbines that enables siting independent of water depth; thus exploiting the world's highest capacity wind resources.
