First Name,Last Name,Title,Company Name,Headline,What Happened,About Person,About Company
Jeffrey,Zack,Vice President of Technology,Catapult Technology,Jeffrey Zack was Appointed as Vice President of Technology at Catapult Technology,Bethesda; MD-based Catapult Technology appointed Jeffrey Zack as Vice President of Technology.,Jeffrey Zack was previously Vice President at Project Performance Corporation.,Catapult Technology; Ltd. (Catapult) is a Service-Disabled Veteran-Owned (SDVO) firm that provides information technology and management consulting services to the federal government.
Jeffrey,Wilbur,Director of Information Technology,West Virginia University at Parkersburg,Jeffrey Wilbur was Appointed as Director of Information Technology at West Virginia University at Parkersburg,Parkersburg; WV-based West Virginia University at Parkersburg appointed Jeffrey Wilbur as Director of Information Technology.,Jeffrey Wilbur was previously the Director of computer technology for Stetson University College of Law in St. Petersburg.,WVU Parkersburg is a public institution of higher education; affiliated with West Virginia University; separately accredited by the Higher Learning Commission; and operated by the state of West Virginia.
Jeffrey,Walsh,Chief Information Officer,Telorean Associates,Jeffrey Walsh was Appointed as Chief Information Officer at Telorean Associates,; CA-based Telorean Associates appointed Jeffrey Walsh as Chief Information Officer.,Jeffrey Walsh has over 20 years of experience in management level IT and operational positions where he achieved success in start up; turnaround and high growth ventures. Walsh has a Bachelor of Science in Finance & Marketing from Boston College. ,Telorean Associates specializes in Information Technology Systems. The company designs; installs; updates; and manages multi faceted telecommunication systems nationwide. 
Jeff,Medina,Chief Information Officer,Diskeeper Corporation,Jeff Medina was Appointed as Chief Information Officer at Diskeeper Corporation,Burbank; CA-based Diskeeper Corporation appointed Jeff Medina as Chief Information Officer.,Jeffrey Medina was previously the Vice President of eBusiness at Diskeeper Corporation.,Diskeeper Corporation is the undisputed innovator of technologies that enhance the performance and reliability of Windows computers.
Jeffrey,Keisling,Chief Information Officer,Pfizer,Jeffrey Keisling was Appointed as Chief Information Officer at Pfizer,New York; NY-based Pfizer appointed Jeffrey Keisling as Chief Information Officer.,Jeffrey Keisling was previously the Corporate VP and CIO at Wyeth.,Pfizer Incorporated is a major pharmaceutical company; which ranks number one in the world in sales. The company is based in New York City; with its research headquarters residing in Groton; Connecticut. 
Jeffrey,Fisher,Chief Information Officer,Solveras Payment Solutions,Jeffrey Fisher was Appointed as Chief Information Officer at Solveras Payment Solutions,Franklin; TN-based Solveras Payment Solutions appointed Jeffrey Fisher as Chief Information Officer.,Jeffrey Fisher was previously the Treasury/Capital Markets Program Manager at the Federal Reserve.,Founded in 2000; with operations in Arlington; VA and Nashville; TN; Solveras; Inc. provides comprehensive electronic payment solutions and customer service to small- and medium-sized businesses nationwide.
Jeffrey,Campbell,Chief Information Officer,Burlington Northern Santa Fe,Jeffrey Campbell was Appointed as Chief Information Officer at Burlington Northern Santa Fe,Fort Worth; TX-based Burlington Northern Santa Fe appointed Jeffrey Campbell as Chief Information Officer.,Jeffrey Campbell previously held various technology positions in the transportation industry.,Burlington Northern Santa Fe Railway operates services and in the mid and western United States.
Jeff,Swanson,Chief Technology Officer,Xilinx,Jeff Swanson was Appointed as Chief Technology Officer at Xilinx,San Jose; CA-based Xilinx appointed Jeff Swanson as Chief Technology Officer.,Jeff Swanson was previously the Sr Director IT at Sybase.,With superior FPGA and CPLD products; Xilinx is the leader in the digital programmable logic device (PLD) market. 
Jeff,Story,Director of Information Technology,Myriad Systems,Jeff Story was Appointed as Director of Information Technology at Myriad Systems,Oklahoma City; OK-based Myriad Systems appointed Jeff Story as Director of Information Technology.,Jeff Story was previously Solutions Developer at Aldrich Web Solutions.,Myriad Systems is a leading provider of print and mail; online document delivery; and item processing solutions for financial institutions across the United States.
Jeff,Stewart,Chief Information Officer,Decision Resources,Jeff Stewart was Appointed as Chief Information Officer at Decision Resources,Waltham; MA-based Decision Resources appointed Jeff Stewart as Chief Information Officer.,Jeff Stewart was previously the CIO at IntrinsiQ Technology Group.,Decision Resources; Inc. is a cohesive portfolio of companies that offers best-in-class; high-value information and insights on important sectors of the healthcare industry.
Jeff,Steinhorn,Chief Information Officer,Hess,Jeff Steinhorn was Appointed as Chief Information Officer at Hess,New York; NY-based Hess appointed Jeff Steinhorn as Chief Information Officer.,Jeff Steinhorn was previously the CIO at Linens N Things.,Hess Corporation is an integrated oil and gas company conducts exploration and production primarily in Algeria; Australia; Azerbaijan; Brazil; Denmark; Egypt; Equatorial Guinea; Gabon; Ghana; Indonesia; Libya; Malaysia; Norway; Peru; Russia; Thailand; the UK; and the US. In 2008 Hess reported proved reserves totaling more than 1.4 billion barrels of oil equivalent. 
Jeff,Segal,Chief Technology Officer,WellAWARE Systems,Jeff Segal was Appointed as Chief Technology Officer at WellAWARE Systems,Glen Allen; VA-based WellAWARE Systems appointed Jeff Segal as Chief Technology Officer.,Jeff Segal was previously at intoPIX of America; where he was CEO and established the U.S. market for the Belgium-based company. He was also co-founder and CTO of CINEA; a Dolby Laboratories Company; where he defined the technology and product strategy for the company. Segal has a bachelor?s in mathematics/computer science from VCU and a master?s in engineering management from George Washington University.,WellAWARE Systems; in partnership with Volunteers of America (VOA) and The Evangelical Lutheran Good Samaritan Society (GSS); offers the opportunity for enhanced quality of life for our aging population through an innovative approach to wellness and safety for senior living. 
Jeff,Sacks,Chief Technology Officer,Access Systems,Jeff Sacks was Appointed as Chief Technology Officer at Access Systems,Reston; VA-based Access Systems appointed Jeff Sacks as Chief Technology Officer.,Jeff Sacks was previously the vice president of technology at JP Morgan Chase in Columbus; Ohio. ,Access Systems; Inc. (ACCESS) provides information technology and management solutions to Government defense and civilian clients.
Jeff,Roberson,Vice President of Information Technology,Musician's Friend; a division of Guitar Center,Jeff Roberson was Appointed as Vice President of Information Technology at Musician's Friend; a division of Guitar Center,Medford; OR-based Musician's Friend; a division of Guitar Center appointed Jeff Roberson as Vice President of Information Technology.,Jeff Roberson was previously vice president of information technology for The Woodwind & Brasswind.,Musicians Friend has over 1;000 employees; headquarters in Medford; Oregon; a call center in Salt Lake City; and a state-of-the-art distribution center in Kansas City that's the size of 13 football fields.
Jeff,Pelletier,Chief Technology Officer,IP5280 COMMUNICATIONS,Jeff Pelletier was Appointed as Chief Technology Officer at IP5280 COMMUNICATIONS,Englewood; CO-based IP5280 COMMUNICATIONS appointed Jeff Pelletier as Chief Technology Officer.,Jeff Pelletier CTO at Simple Signal.,Ip5280 is a Global VoIP Provider based in Englewood Colorado. IP5280 is building the next generation communications company; providing Voice; Video and Data services across IP networks.
Jeff,Osegard,Chief Information Officer,Lakewood Health System,Jeff Osegard was Appointed as Chief Information Officer at Lakewood Health System,Staples; MN-based Lakewood Health System appointed Jeff Osegard as Chief Information Officer.,Jeff Osegard previously worked at Regina Medical Center in Hastings; MN.,Serving the Staples and surrounding communities since 1936; Lakewood Health System has grown from a small community hospital to one recognized as a leading rural health care system. 
Jeff,Mowry,Chief Information Officer,BROWARD COUNTY (Florida),Jeff Mowry was Appointed as Chief Information Officer at BROWARD COUNTY (Florida),Fort Lauderdale; FL-based BROWARD COUNTY (Florida) appointed Jeff Mowry as Chief Information Officer.,Jeff Mowry was previously the IT Executive at Chrysler.,Broward County is an equal opportunity employer and provider of services.
Jeff,Hagins,Chief Technology Officer,ReachLocal,Jeff Hagins was Appointed as Chief Technology Officer at ReachLocal,Woodland Hills; CA-based ReachLocal appointed Jeff Hagins as Chief Technology Officer.,Jeff Hagins previously held CTO roles at Mural Consulting; a Software-as-a-Service (SaaS) advisory firm; Dynix; a library automation software company; Apptix; a hosted messaging and collaboration provider; and TeleComputing; a hosted application management provider. ,ReachLocal; Inc.'s (NASDAQ: RLOC) mission is to help small- and medium-sized businesses (SMBs) acquire; maintain and retain customers via the Internet. 
Jeff,Frieling,Chief Information Officer,West Tennessee Healthcare,Jeff Frieling was Promoted to Chief Information Officer at West Tennessee Healthcare,Jackson; TN-based West Tennessee Healthcare promoted Jeff Frieling to Chief Information Officer.,Jeff Frieling was previously the executive director of the West Tennessee Cancer Center and administrator of Humboldt General Hospital.,West Tennessee Healthcare is a public; not-for-profit healthcare system.
Jeff,Fried,VP of Engineering & CTO,BA-Insight,Jeff Fried was Appointed as VP of Engineering & CTO at BA-Insight,White Plains; NY-based BA-Insight appointed Jeff Fried as VP of Engineering & CTO.,Jeff Fried was previously with Microsoft; where he served as core product manager for FAST Search for SharePoint and then technical product manager for all Microsoft enterprise search products.,BA-Insight's Software is instrumental in enabling Information Access in the Enterprise. Companies that use BA-Insight's software enable it's people to turn data into insight; transform ideas into action; and turn change into opportunity.
Jeff,Frazee,Chief Information Officer,Aviva,Jeff Frazee was Appointed as Chief Information Officer at Aviva,Des Moines; IA-based Aviva appointed Jeff Frazee as Chief Information Officer.,Jeff Frazee was previously the senior vice president and chief information officer of West Bend Mutual Insurance Co; West Bend; Wisc.,Aviva USA Aviva USA is part of Aviva plc; which has a corporate lineage dating back to 1696; and is the fifth-largest insurance group in the world. One of the fastest-growing U.S. life insurers; Aviva USA offers a competitive portfolio of long-term savings; insurance and retirement income products
Jeff,Fabry,Chief Information Officer,Island Insurance Company,Jeff Fabry was Promoted to Chief Information Officer at Island Insurance Company,Honolulu; HI-based Island Insurance Company promoted Jeff Fabry to Chief Information Officer.,Jeff Fabry was previously Vice President at the Island Insurance,Island Insurance Company; Ltd. is Hawaii's largest locally owned and managed insurance carrier; offering a full range of property and casualty protection. Founded 
Jeff,Donnellan,Chief Information Officer,Geomodeling Technology Corp.,Jeff Donnellan was Appointed as Chief Information Officer at Geomodeling Technology Corp.,Calgary; AB-based Geomodeling Technology Corp. appointed Jeff Donnellan as Chief Information Officer.,Jeff Donnellan was previously the Business Partner Management at TIBCO OpenSpirit.,Geomodeling Technology Corp. is the leading source for realistic geologic and cross-scale modeling software for the up-stream E&P industry.
Jeff,Burton,Director of Information Technology,Noerr Programs,Jeff Burton was Promoted to Director of Information Technology at Noerr Programs,Arvada; CO-based Noerr Programs promoted Jeff Burton to Director of Information Technology.,JEFF BURTON was previously the IT Excutive at Noerr Programs.,The Noerr Programs provides Digital Event Imaging services; productions; and promotions to 3.5 million family members at more than 180 locations in 37 states.
Jeff,Atkins,Vice President of Information Technology,Upp Technology,Jeff Atkins was Appointed as Vice President of Information Technology at Upp Technology,Downers Grove; IL-based Upp Technology appointed Jeff Atkins as Vice President of Information Technology.,Jeff Atkins was previously Director; Information Technology at HomeDirectUSA.,What began 25 years ago as a commitment to putting the client first and building long-term relationships is still what we're all about today.
Jeetu,Patel,Chief Technology Officer,EMC,Jeetu Patel was Appointed as Chief Technology Officer at EMC,Hopkinton; MA-based EMC appointed Jeetu Patel as Chief Technology Officer.,Jeetu Patel is a 17-year information management veteran and former partner of Doculabs; a strategic consultancy for enterprise social collaboration and content management. Patel will report to Mark Lewis; President of EMC?s Information Intelligence Group and will be responsible for orchestrating and driving the group?s product vision and innovation; growth strategy and cloud computing initiatives.,EMC Corporation (NYSE: EMC) is the world's leading developer and provider of information infrastructure technology and solutions that enable organizations of all sizes to transform the way they compete and create value from their information. Information about EMC's products and services can be found at www.EMC.com.
Jeanne,Lieb ,Chief Information Officer,FM Global,Jeanne Lieb  was Appointed as Chief Information Officer at FM Global,Johnston; RI-based FM Global appointed Jeanne Lieb  as Chief Information Officer.,Jeanne Lieb previoulsy held various technology positions in the insurance industry.,  FM Global specializes in property protection and one of the largest industrial and commercial property insurance as well as risk management organization.
Jean,Hill,Head of Information Technology,First New York Securities; LLC,Jean Hill was Appointed as Head of Information Technology at First New York Securities; LLC,New York; NY-based First New York Securities; LLC appointed Jean Hill as Head of Information Technology.,Jean Hill brings over 25 years of operations and leadership experience with a focus on implementing business driven strategic IT plans. She has extensive experience in creating managed service models designed to optimize performance and provide incremental business value.,First New York Securities is a global multi strategy trading firm and registered broker dealer. The firm's diverse trading business spans numerous asset classes; including domestic and international equities; fixed income; commodities; interest rates; foreign exchange; derivatives; energy and tax exempt bonds.
Jaz,Banga,Chief Technology Officer,Feeva,Jaz Banga Resigned as Chief Technology Officer at Feeva,San Francisco; CA-based Feeva accepted resignation of Jaz Banga as Chief Technology Officer.,Jaz Banga was previously the owner of UnwireNow Inc,Feeva is a provider of real-time market segmentation data for online advertising
Jayesh,Bhayani,Chief Technology Officer,Permuto,Jayesh Bhayani was Appointed as Chief Technology Officer at Permuto,Palo Alto; CA-based Permuto appointed Jayesh Bhayani as Chief Technology Officer.,Jayesh Bhayani has been a software engineer for nearly twenty years; including early roles at Global Automation and Tata Consultancy Services. Most recently; Bhayani was vice president of engineering and product at Yahoo!; where he led a team of 200 people to build a massively scalable backend system to process over 50 billion advertising events per day.,Permuto is building the world's largest index of consumer purchase intent; history and activity data; and leveraging that deep knowledge to unlock significant value for both buyers and sellers.
Jay,Seirmarco,Chief Technology Officer,Geeknet,Jay Seirmarco was Terminated as Chief Technology Officer at Geeknet,Mountain View; CA-based Geeknet terminated Jay Seirmarco as Chief Technology Officer.,Jay Serimarco was previously the General Counsel & Corporate Secretary at  SourceForge  ,Geeknet owns and operates SourceForge; Slashdot; ThinkGeek; Geek.com; ohloh; and freshmeat. Each month; we provide over 45 million geeks with content; connections; commerce; and all the things that geeks crave.
Jay,Levine,Chief Information Officer,Blue Cross and Blue Shield of Minnesota,Jay Levine was Appointed as Chief Information Officer at Blue Cross and Blue Shield of Minnesota,Eagan; MN-based Blue Cross and Blue Shield of Minnesota appointed Jay Levine as Chief Information Officer.,Jay Levine was previously the Executive vice president of product development and chief technology officer for Minneapolis-based Wolters Kluwer Financial Services.,Blue Cross and Blue Shield of Minnesota  a nonprofit organization  was chartered in 1933 as Minnesotas first health plan.
Jay,Kurtzman,Chief Technology Officer,Equity Residential Properties Trust,Jay Kurtzman was Appointed as Chief Technology Officer at Equity Residential Properties Trust,Chicago; IL-based Equity Residential Properties Trust appointed Jay Kurtzman as Chief Technology Officer.,Jay Kurtzman was previously the Managing Consultant at Spherion Technology.,With more choices in more markets; Equity Residential is America's Choice for Apartment Living. We are the largest publicly traded owner; operator and developer of multifamily housing in the United States with nearly 200;000 apartments in 32 states and the District of Columbia.
Jay,Graves,Chief Technology Officer,edo Interactive,Jay Graves was Appointed as Chief Technology Officer at edo Interactive,Nashville; TN-based edo Interactive appointed Jay Graves as Chief Technology Officer.,Jay Graves was previously Vice President at Merkle.,edo Interactive is a leading marketing services company that provides interactive advertising solutions.
Jay,Gardner,Senior Vice President,NetIQ,Jay Gardner was Appointed as Senior Vice President at NetIQ,Houston; TX-based NetIQ appointed Jay Gardner as Senior Vice President.,Jay Gardner vice president and general manager of the BMC.,NetIQ is an enterprise software company with relentless focus on customer success.
Jason,Press,Chief Technology Officer,Comcast Interactive Media,Jason Press was Promoted to Chief Technology Officer at Comcast Interactive Media,Philadelphia; PA-based Comcast Interactive Media promoted Jason Press to Chief Technology Officer.,Jason Press was previously the Vice President; Technology & Operations at Comcast Interactive Media.,Comcast Interactive Media (CIM); is a division of Comcast Corporation (NASDAQ:CMCSA) (NASDAQ:CMCSK) dedicated to developing and operating online and cross-platform entertainment and media businesses; including Comcast.net (www.comcast.net) one of the countrys most visited websites.
Jason,Potosky,Chief Technology Officer,Delphi Technology,Jason Potosky was Appointed as Chief Technology Officer at Delphi Technology,Boston; MA-based Delphi Technology appointed Jason Potosky as Chief Technology Officer.,Jason Potosky was previously the Senior Vice President of Development at Delphi Technology.,Delphi Technology; Inc. provides information technology solutions to the risk management and insurance industry primarily in the United States.
Jason,Pierson,Chief Information Officer,HealthCare Insight,Jason Pierson was Appointed as Chief Information Officer at HealthCare Insight,South Jordan; UT-based HealthCare Insight appointed Jason Pierson as Chief Information Officer.,Jason Pierson was previously COO at HealthCare Insight.,HealthCare Insight (HCI); a division of Verisk Health; serves private and public health care payors with a new and continually evolving kind of fraud; abuse; and overpayment prevention service.
Jason,Newport,Senior Vice President; Technology,Posterscope,Jason Newport was Appointed as Senior Vice President; Technology at Posterscope,Atlanta; GA-based Posterscope appointed Jason Newport as Senior Vice President; Technology.,Jason Newport was previously the CMO and Managing Director of MobileBehavior; a strategic mobile marketing consultancy within Omnicom Group.,Posterscope USA; part of the Posterscope Worldwide Network; is the leading Out of Home communications agency offering a powerful combination of strategic insight; planning; buying scale and measurement that helps brands extract maximum value from OOH in a world of increasingly connected consumers.
Jason,Mattox,Chief Technology Officer,Vizioncore,Jason Mattox was Promoted to Chief Technology Officer at Vizioncore,Buffalo Grove; IL-based Vizioncore promoted Jason Mattox to Chief Technology Officer.,Jason Mattox was previously CTO of the Server Virtualization Group for Quest Software.,Vizioncore; the leader in virtualization management; is now Quest Softwares Server Virtualization Management group. 
Jason,Gaedtke,Group Vice President,Time Warner Cable,Jason Gaedtke was Appointed as Group Vice President at Time Warner Cable,New York; NY-based Time Warner Cable appointed Jason Gaedtke as Group Vice President.,Jason Gaedtke CTO at Joost.,Time Warner Cable is the second-largest cable operator in the U.S.; with technologically advanced; well-clustered systems located mainly in five geographic areas  New York State (including New York City); the Carolinas; Ohio; southern California (including Los Angeles) and Texas. Time Warner Cable serves more than 14 million customers who subscribe to one or more of its video; high-speed data and voice services. Time Warner Cable Business Class offers a suite of phone; Internet; Ethernet and cable television services to businesses of all sizes.
Jason,Blum,Chief Technology Officer,GPL Technologies,Jason Blum was Appointed as Chief Technology Officer at GPL Technologies,Santa Monica; CA-based GPL Technologies appointed Jason Blum as Chief Technology Officer.,Jason Blum was previously the Chief Technology Officer at Miracle Data; a provider of outsourced IT for a vast array of local non-profits. ,GPL Technologies is a leader in the design; deployment and support of IT solutions and pipeline infrastructures that meet the unique needs of film companies; post production facilities; visual effects shops and game studios. 
Jason,Ball,Chief Information Officer,Florida Atlantic University (Boca Raton),Jason Ball was Appointed as Chief Information Officer at Florida Atlantic University (Boca Raton),Boca Raton; FL-based Florida Atlantic University (Boca Raton) appointed Jason Ball as Chief Information Officer.,Jason Ball was previously the Director of information technology at Florida Institute of Technology in Melbourne.,FAU is a public university in the State of Florida. The University serves 27;000 freshmen; transfers and graduate students on seven campuses and sites.
Jared,Fraher,Director of Information Technology Operations,LibertyBank Corp,Jared Fraher was Appointed as Director of Information Technology Operations at LibertyBank Corp,Eugene; OR-based LibertyBank Corp appointed Jared Fraher as Director of Information Technology Operations.,Jared Fraher was previously the VP; IT and Security Manager at  Silvergate Bank.,0
Janice,Jesse,Vice President Information Technology,Glatfelter,Janice Jesse was Appointed as Vice President Information Technology at Glatfelter,York; PA-based Glatfelter appointed Janice Jesse as Vice President Information Technology.,Janice Jesse was previously with International Paper Corporation; responsibe for IT strategy development; enterprise architecture; IT investment and governance; and project management processes.,Glatfelter is a supplier of speciality papers and fibre based engineered products.
Jane,Tingley,Director of Technology,The Fallsburg Central School District,Jane Tingley was Appointed as Director of Technology at The Fallsburg Central School District,Warwick; NY-based The Fallsburg Central School District appointed Jane Tingley as Director of Technology.,Jane Tingley previously held various technology positions The Fallsburg Central School District.,The Fallsburg Central School District is comprised of two outstanding schools. Benjamin Cosor Elementary School (serving grades preK-6); and the Fallsburg Jr./Sr. High School; (serving grades 7-12). These schools serve a multi-cultural community of approximately 20;000 in the areas of Fallsburg; South Fallsburg; Glen Wild; Greenfield Park; Hurleyville; Loch Sheldrake; Mountaindale; Woodbourne and Woodridge. 
Jane,Aboyoun,Chief Technology Officer,Asset International,Jane Aboyoun was Appointed as Chief Technology Officer at Asset International,Stamford; CT-based Asset International appointed Jane Aboyoun as Chief Technology Officer.,Jane Aboyoun was previously the Senior Vice President; Chief Information Officer at Bertelsmann Media Worldwide - Direct Group N.A.,Asset International is a privately-held publisher and information provider to global pension funds; asset managers; financial advisers; banking service providers; and other financial institutions in the private and public sector.
